question,answer,ground_truth,contexts,evolution_type,faithfulness,answer_relevancy,context_precision,context_recall,source_articles
"Theo Điều 1, nội dung quy định về phạm vi điều chỉnh là gì?",#### Điều 21. Nội dung hợp đồng lao động,"Phạm vi điều chỉnh Bộ luật Lao động quy định tiêu chuẩn lao động; quyền, nghĩa vụ, trách nhiệm của người lao động, người sử dụng lao động, tổ chức đại diện người lao động tại cơ sở, tổ chức đại diện người sử dụng lao động trong quan hệ lao động và các quan hệ khác liên quan trực tiếp đến quan hệ lao động; quản lý nhà nước về lao động.","[""#### Điều 21. Nội dung hợp đồng lao động"", ""#### Điều 214. Nội dung thanh tra lao động\n\n1. Thanh tra việc chấp hành quy định của pháp luật về lao động.\n\n- 2. Điều tra tại nạn lao động và vi phạm an toàn, vệ sinh lao động. - 3. Tham gia hướng dẫn áp dụng hệ thống tiêu chuẩn, quy chuẩn kỹ thuật về điều kiện lao động, an toàn, vệ sinh lao động. - 4. Giải quyết khiếu nại, tố cáo về lao động theo quy định của pháp luật. - 5. Xử lý theo thẩm quyền và kiến nghị cơ quan có thẩm quyền xử lý vi phạm pháp luật về lao động."", ""#### Điều 200. Trình tự đình công\n\n- 1. Lấy ý kiến về đình công theo quy định tại Điều 201 của Bộ luật này. - 2. Ra quyết định đình công và thông báo đình công theo quy định tại Điều 202 của Bộ luật này. - 3. Tiến hành đình công."", ""## Điều 204. Trường hợp đình công bất hợp pháp\n\n- 1. Không thuộc trường hợp được đình công quy định tại Điều 199 của Bộ luật này. - 2. Không do tổ chức đại diện người lao động có quyền tổ chức và lãnh đạo đình công. - 3. Vi phạm các quy định về trình tự, thủ tục tiến hành đình công theo quy định của Bộ luật này. - 4. Khi tranh chấp lao động tập thể đang được cơ quan, tổ chức, cá nhân có thẩm quyền giải quyết theo quy định của Bộ luật này. - 5. Tiến hành đình công trường hợp không được đình công quy định tại Điều 209 của Bộ luật này. - 6. Khi đã có quyết định hoãn hoặc ngừng đình công của cơ quan có thẩm quyền theo quy định tại Điều 210 của Bộ luật này."", ""### \""Điều 54. Điều kiện hưởng lương hưu""]",simple,1.0,0.0,0.1408,0.4545,"[""Điều 1""]"
"Theo Điều 9, nội dung quy định về việc làm, giải quyết việc làm là gì?","#### Điều 9. Việc làm, giải quyết việc làm - 1.","Việc làm, giải quyết việc làm Việc làm là hoạt động lao động tạo ra thu nhập mà pháp luật không cấm. - 2.","[""#### Điều 9. Việc làm, giải quyết việc làm\n\n- 1. Việc làm là hoạt động lao động tạo ra thu nhập mà pháp luật không cấm. - 2. Nhà nước, người sử dụng lao động và xã hội có trách nhiệm tham gia giải quyết việc làm, bảo đảm cho mọi người có khả năng lao động đều có cơ hội có việc làm."", ""#### Điều 47. Trợ cấp mất việc làm\n\n- 1. Người sử dụng lao động trả trợ cấp mất việc làm cho người lao động đã làm việc thường xuyên cho mình từ đủ 12 tháng trở lên mà bị mất việc làm theo quy định tại khoản 11 Điều 34 của Bộ luật này, cứ mỗi năm làm việc trả 01 tháng tiền lương nhưng ít nhất bằng 02 tháng tiền lương. - 2. Thời gian làm việc để tính trợ cấp mất việc làm là tổng thời gian người lao động đã làm việc thực tế cho người sử dụng lao động trừ đi thời gian người lao động đã tham gia bảo hiểm thất nghiệp theo quy định của pháp luật về bảo hiểm thất nghiệp và thời gian làm việc đã được người sử dụng lao động chi trả trợ cấp thôi việc, trợ cấp mất việc làm. - 3. Tiền lương để tính trợ cấp mất việc làm là tiền lương bình quân của 06 tháng liền kề theo hợp đồng lao động trước khi người lao động mất việc làm. - 4. Chính phủ quy định chi tiết Điều này."", ""## Điều 205. Thông báo quyết định đóng cửa tạm thời nơi làm việc\n\nÍt nhất 03 ngày làm việc trước ngày đóng cửa tạm thời nơi làm việc, người sử dụng lao động phải niêm yết công khai quyết định đóng cửa tạm thời nơi làm việc tại nơi làm việc và thông báo cho các cơ quan, tổ chức sau đây:\n\n- 1. Tổ chức đại diện người lao động đang tổ chức và lãnh đạo đình công; - 2. Ủy ban nhân dân cấp tỉnh có nơi làm việc dự kiến đóng cửa; - 3. Ủy ban nhân dân cấp huyện có nơi làm việc dự kiến đóng cửa."", ""#### Điều 112. Nghỉ lễ, tết\n\n- 1. Người lao động được nghi làm việc, hưởng nguyên lương trong những ngày lễ, tết sau đây: - a) Tết Dương lịch: 01 ngày (ngày 01 tháng 01 dương lịch); - b) Tết Âm lịch: 05 ngày;\n\n- c) Ngày Chiến thắng: 01 ngày (ngày 30 tháng 4 dương lịch); - d) Ngày Quốc tế lao động: 01 ngày (ngày 01 tháng 5 dương lịch); - đ) Quốc khánh: 02 ngày (ngày 02 tháng 9 dương lịch và 01 ngày liền kề trước hoặc sau); - e) Ngày Giỗ Tổ Hùng Vương: 01 ngày (ngày 10 tháng 3 âm lịch). - 2. Lao động là người nước ngoài làm việc tại Việt Nam ngoài các ngày nghi theo quy định tại khoản 1 Điều này còn được nghỉ thêm 01 ngày Tết cổ truyền dân tộc và 01 ngày Quốc khánh của nước họ. - 3. Hằng năm, căn cứ vào điều kiện thực tế, Thủ tướng Chính phủ quyết định cụ thể ngày nghỉ quy định tại điểm b và điểm đ khoản 1 Điều này."", ""## Điều 114. Ngày nghỉ hằng năm tăng thêm theo thâm niên làm việc\n\nCứ đủ 05 năm làm việc cho một người sử dụng lao động thì số ngày nghi hằng năm của người lao động theo quy định tại khoản 1 Điều 113 của Bộ luật này được tăng thêm tương ứng 01 ngày.""]",simple,1.0,1.0,0.0781,1.0,"[""Điều 9""]"
"Theo Điều 17, nội dung quy định về hành vi người sử dụng lao động không được làm khi giao kết, thực hiện hợp đồng lao động là gì?","## Điều 17. Hành vi người sử dụng lao động không được làm khi giao kết, thực hiện hợp đồng lao động - 1.","Hành vi người sử dụng lao động không được làm khi giao kết, thực hiện hợp đồng lao động Giữ bản chính giấy tờ tùy thân, văn bằng, chứng chỉ của người lao động. - 2.","[""## Điều 17. Hành vi người sử dụng lao động không được làm khi giao kết, thực hiện hợp đồng lao động\n\n- 1. Giữ bản chính giấy tờ tùy thân, văn bằng, chứng chỉ của người lao động. - 2. Yêu cầu người lao động phải thực hiện biện pháp bảo đảm bằng tiền hoặc tài sản khác cho việc thực hiện hợp đồng lao động. - 3. Buộc người lao động thực hiện hợp đồng lao động để trả nợ cho người sử dụng lao động."", ""### Điều 13. Hợp đồng lao động\n\n1. Hợp đồng lao động là sự thỏa thuận giữa người lao động và người sử dụng lao động về việc làm có trả công, tiền lương, điều kiện lao động, quyền và nghĩa vụ của mỗi bên trong quan hệ lao động.\n\nTrường hợp hai bên thỏa thuận bằng tên gọi khác nhưng có nội dung thể hiện về việc làm có trả công, tiền lương và sự quản lý, điều hành, giám sát của một bên thì được coi là hợp đồng lao động.\n\n2. Trước khi nhận người lao động vào làm việc thì người sử dụng lao động phải giao kết hợp đồng lao động với người lao động."", ""#### Điều 118. Nội quy lao động\n\n- 1. Người sử dụng lao động phải ban hành nội quy lao động, nếu sử dụng từ 10 người lao động trở lên thì nội quy lao động phải bằng văn bản. - 2. Nội dung nội quy lao động không được trái với pháp luật về lao động và quy định của pháp luật có liên quan. Nội quy lao động bao gồm những nội dung chủ yếu sau đây: - a) Thời giờ làm việc, thời giờ nghi ngơi; - b) Trật tự tại nơi làm việc; - c) An toàn, vệ sinh lao động; - d) Phòng, chống quấy rối tình dục tại nơi làm việc; trình tự, thủ tục xử lý hành vi quấy rối tình dục tại nơi làm việc; - đ) Việc bảo vệ tài sản và bí mật kinh doanh, bí mật công nghệ, sở hữu trí tuệ của người sử dụng lao động; - e) Trường hợp được tạm thời chuyển người lao động làm việc khác so với hợp đồng lao động; - g) Các hành vi vi phạm kỷ luật lao động của người lao động và các hình thức xử lý kỷ luật lao động; - h) Trách nhiệm vật chất; - i) Người có thẩm quyền xử lý kỷ luật lao động. - 3. Trước khi ban hành nội quy lao động hoặc sửa đổi, bổ sung nội quy lao động, người sử dụng lao động phải tham khảo ý kiến của tổ chức đại diện người lao động tại cơ sở đối với nơi có tổ chức đại diện người lao động tại cơ sở. - 4. Nội quy lao động phải được thông báo đến người lao động và những nội dung chính phải được niêm yết ở những nơi cần thiết tại nơi làm việc. - 5. Chính phủ quy định chi tiết Điều này."", ""## Điều 36. Quyền đơn phương chấm dứt hợp đồng lao động của người sử dụng lao động\n\n- 1. Người sử dụng lao động có quyền đơn phương chấm dứt hợp đồng lao động trong trường hợp sau đây: - a) Người lao động thường xuyên không hoàn thành công việc theo hợp đồng lao động được xác định theo tiêu chí đánh giá mức độ hoàn thành công việc trong quy chế của người sử dụng lao động. Quy chế đánh giá mức độ hoàn thành công việc do người sử dụng lao động ban hành nhưng phải tham khảo ý kiến tổ chức đại diện người lao động tại cơ sở đối với nơi có tổ chức đại diện người lao động tại cơ sở; - b) Người lao động bị ốm đau, tai nạn đã điều trị 12 tháng liên tục đối với người làm việc theo hợp đồng lao động không xác định thời hạn hoặc đã điều trị 06 tháng liên tục đối với người làm việc theo hợp đồng lao động xác định thời hạn có thời hạn từ 12 tháng đến 36 tháng hoặc quá nửa thời hạn hợp đồng lao động đối với người làm việc theo hợp đồng lao động xác định thời hạn có thời hạn dưới 12 tháng mà khả năng lao động chưa hồi phục.\n\nKhi sức khỏe của người lao động bình phục thì người sử dụng lao động xem xét để tiếp tục giao kết hợp đồng lao động với người lao động;"", ""### Điều 64. Nội dung đối thoại tại nơi làm việc\n\n- 1. Nội dung đối thoại bắt buộc theo quy định tại điểm c khoản 2 Điều 63 của Bộ luật này. - 2. Ngoài nội dung quy định tại khoản 1 Điều này, các bên lựa chọn một hoặc một số nội dung sau đây để tiến hành đối thoại: - a) Tình hình sản xuất, kinh doanh của người sử dụng lao động; - b) Việc thực hiện hợp đồng lao động, thỏa ước lao động tập thể, nội quy lao động, quy chế và cam kết, thỏa thuận khác tại nơi làm việc; - c) Điều kiện làm việc; - d) Yêu cầu của người lao động, tổ chức đại diện người lao động đối với người sử dụng lao động; - đ) Yêu cầu của người sử dụng lao động đối với người lao động, tổ chức đại diện người lao động; - e) Nội dung khác mà một hoặc các bên quan tâm.""]",simple,1.0,1.0,0.0936,1.0,"[""Điều 17""]"
"Theo Điều 25, nội dung quy định về thời gian thử việc là gì?",#### Điều 24. Thử việc - 1.,"Thời gian thử việc Thời gian thử việc do hai bên thỏa thuận căn cứ vào tính chất và mức độ phức tạp của công việc nhưng chỉ được thử việc một lần đối với một công việc và bảo đảm điều kiện sau đây: Không quá 180 ngày đối với công việc của người quản lý doanh nghiệp theo quy định của Luật Doanh nghiệp, Luật Quản lý, sử dụng vốn nhà nước đầu tư vào sản xuất, kinh doanh tại doanh nghiệp; - 2. Không quá 60 ngày đối với công việc có chức danh nghề nghiệp cần trình độ chuyên môn, kỹ thuật từ cao đẳng trở lên; - 3.","[""#### Điều 24. Thử việc\n\n- 1. Người sử dụng lao động và người lao động có thể thỏa thuận nội dung thử việc ghi trong hợp đồng lao động hoặc thỏa thuận về thử việc bằng việc giao kết hợp đồng thử việc. - 2. Nội dung chủ yếu của hợp đồng thử việc gồm thời gian thử việc và nội dung quy định tại các điểm a, b, c, đ, g và h khoản 1 Điều 21 của Bộ luật này. - 3. Không áp dụng thử việc đối với người lao động giao kết hợp đồng lao động có thời hạn dưới 01 tháng."", "". .....................................\n\n- 11. Người sử dụng lao động cho người lao động thôi việc theo quy định tại Điều 42 và Điều 43 của Bộ luật này. - 12. Giấy phép lao động hết hiệu lực đối với người lao động là người nước ngoài làm việc tại Việt Nam theo quy định tại Điều 156 của Bộ luật này. - 13. Trường hợp thỏa thuận nội dung thử việc ghi trong hợp đồng lao động mà thử việc không đạt yêu cầu hoặc một bên hủy bỏ thỏa thuận thử việc."", ""#### Điều 117. Kỷ luật lao động\n\nKỷ luật lao động là những quy định về việc tuân theo thời gian, công nghệ và điều hành sản xuất, kinh doanh do người sử dụng lao động ban hành trong nội quy lao động và do pháp luật quy định."", ""## Điều 70. Quy trình thương lượng tập thể tại doanh nghiệp\n\n1. Khi có yêu cầu thương lượng tập thể của tổ chức đại diện người lao động tại cơ sở có quyền yêu cầu thương lượng tập thể theo quy định tại Điều 68 của Bộ luật này hoặc yêu cầu của người sử dụng lao động thì bên nhận được yêu cầu không được từ chối việc thương lượng.\n\nTrong thời hạn 07 ngày làm việc kể từ ngày nhận được yêu cầu và nội dung thương lượng, các bên thỏa thuận về địa điểm, thời gian bắt đầu thương lượng.\n\nNgười sử dụng lao động có trách nhiệm bố trí thời gian, địa điểm và các điều kiện cần thiết để tổ chức các phiên họp thương lượng tập thể.\n\nThời gian bắt đầu thương lượng không được quá 30 ngày kể từ ngày nhận được yêu cầu thương lượng tập thể.\n\n2. Thời gian thương lượng tập thể không được quá 90 ngày kể từ ngày bắt đầu thương lượng, trừ trường hợp các bên có thỏa thuận khác.\n\nThời gian tham gia các phiên họp thương lượng tập thể của đại diện bên người lao động được tính là thời gian làm việc có hưởng lương. Trường hợp người lao động là thành viên của tổ chức đại diện người lao động tham gia các phiên họp thương lượng tập thể thì thời gian tham gia các phiên họp không tính vào thời gian quy định tại khoản 2 Điều 176 của Bộ luật này."", ""### Điều 46. Trợ cấp thôi việc\n\n- 1. Khi hợp đồng lao động chấm dứt theo quy định tại các khoản 1, 2, 3, 4, 6, 7, 9 và 10 Điều 34 của Bộ luật này thì người sử dụng lao động có trách nhiệm trả trợ cấp thôi việc cho người lao động đã làm việc thường xuyên cho mình từ đủ 12 tháng trở lên, mỗi năm làm việc được trợ cấp một nửa tháng tiền lương, trừ trường hợp đủ điều kiện hưởng lương hưu theo quy định của pháp luật về bảo hiểm xã hội và trường hợp quy định tại điểm e khoản 1 Điều 36 của Bộ luật này. - 2. Thời gian làm việc để tính trợ cấp thôi việc là tổng thời gian người lao động đã làm việc thực tế cho người sử dụng lao động trừ đi thời gian người lao động đã tham gia bảo hiểm thất nghiệp theo quy định của pháp luật về bảo hiểm thất nghiệp và thời gian làm việc đã được người sử dụng lao động chi trả trợ cấp thôi việc, trợ cấp mất việc làm. - 3. Tiền lương để tính trợ cấp thôi việc là tiền lương bình quân của 06 tháng liền kề theo hợp đồng lao động trước khi người lao động thôi việc. - 4. Chính phủ quy định chi tiết Điều này.""]",simple,1.0,1.0,0.2373,0.549,"[""Điều 25""]"
"Theo Điều 33, nội dung quy định về sửa đổi, bổ sung hợp đồng lao động là gì?","#### Điều 33. Sửa đổi, bổ sung hợp đồng lao động - 1.","Sửa đổi, bổ sung hợp đồng lao động Trong quá trình thực hiện hợp đồng lao động, nếu bên nào có yêu cầu sửa đổi, bổ sung nội dung hợp đồng lao động thì phải báo cho bên kia biết trước ít nhất 03 ngày làm việc về nội dung cần sửa đổi, bổ sung. - 2.","[""#### Điều 33. Sửa đổi, bổ sung hợp đồng lao động\n\n- 1. Trong quá trình thực hiện hợp đồng lao động, nếu bên nào có yêu cầu sửa đổi, bổ sung nội dung hợp đồng lao động thì phải báo cho bên kia biết trước ít nhất 03 ngày làm việc về nội dung cần sửa đổi, bổ sung. - 2. Trường hợp hai bên thỏa thuận được thì việc sửa đổi, bổ sung nội dung hợp đồng lao động được tiến hành bằng việc ký kết phụ lục hợp đồng lao động hoặc giao kết hợp đồng lao động mới. - 3. Trường hợp hai bên không thỏa thuận được việc sửa đổi, bổ sung nội dung hợp đồng lao động thì tiếp tục thực hiện hợp đồng lao động đã giao kết."", ""### Điều 22. Phụ lục hợp đồng lao động\n\n1. Phụ lục hợp đồng lao động là bộ phận của hợp đồng lao động và có hiệu lực như hợp đồng lao động.\n\n2. Phụ lục hợp đồng lao động quy định chi tiết, sửa đổi, bổ sung một số điều, khoản của hợp đồng lao động nhưng không được sửa đổi thời hạn của hợp đồng lao động.\n\nTrường hợp phụ lục hợp đồng lao động quy định chi tiết một số điều, khoản của hợp đồng lao động mà dẫn đến cách hiểu khác với hợp đồng lao động thì thực hiện theo nội dung của hợp đồng lao động.\n\nTrường hợp phụ lục hợp đồng lao động sửa đổi, bổ sung một số điều, khoản của hợp đồng lao động thì phải ghi rõ nội dung điều, khoản sửa đổi, bổ sung và thời điểm có hiệu lực."", ""#### Điều 21. Nội dung hợp đồng lao động"", ""## Điều 51. Xử lý hợp đồng lao động vô hiệu\n\n- 1. Khi hợp đồng lao động bị tuyên bố vô hiệu từng phần thì xử lý như sau: - a) Quyền, nghĩa vụ và lợi ích của hai bên được giải quyết theo thỏa ước lao động tập thể đang áp dụng; trường hợp không có thỏa ước lao động tập thể thì thực hiện theo quy định của pháp luật;\n\n- b) Hai bên tiến hành sửa đổi, bổ sung phần của hợp đồng lao động bị tuyên bố vô hiệu để phù hợp với thỏa ước lao động tập thể hoặc pháp luật về lao động. - 2. Khi hợp đồng lao động bị tuyên bố vô hiệu toàn bộ thì quyền, nghĩa vụ và lợi ích của người lao động được giải quyết theo quy định của pháp luật; trường hợp do ký sai thẩm quyền thì hai bên ký lại. - 3. Chính phủ quy định chi tiết Điều này."", ""### Điều 64. Nội dung đối thoại tại nơi làm việc\n\n- 1. Nội dung đối thoại bắt buộc theo quy định tại điểm c khoản 2 Điều 63 của Bộ luật này. - 2. Ngoài nội dung quy định tại khoản 1 Điều này, các bên lựa chọn một hoặc một số nội dung sau đây để tiến hành đối thoại: - a) Tình hình sản xuất, kinh doanh của người sử dụng lao động; - b) Việc thực hiện hợp đồng lao động, thỏa ước lao động tập thể, nội quy lao động, quy chế và cam kết, thỏa thuận khác tại nơi làm việc; - c) Điều kiện làm việc; - d) Yêu cầu của người lao động, tổ chức đại diện người lao động đối với người sử dụng lao động; - đ) Yêu cầu của người sử dụng lao động đối với người lao động, tổ chức đại diện người lao động; - e) Nội dung khác mà một hoặc các bên quan tâm.""]",simple,1.0,1.0,0.21,1.0,"[""Điều 33""]"
"Theo Điều 41, nội dung quy định về nghĩa vụ của người sử dụng lao động khi đơn phương chấm dứt hợp đồng lao động trái pháp luật là gì?","## Điều 39. Đơn phương chấm dứt hợp đồng lao động trái pháp luật Đơn phương chấm dứt hợp đồng lao động trái pháp luật là trường hợp chấm dứt hợp đồng lao động không đúng quy định tại các điều 35, 36 và 37 của Bộ luật này.","Nghĩa vụ của người sử dụng lao động khi đơn phương chấm dứt hợp đồng lao động trái pháp luật Phải nhận người lao động trở lại làm việc theo hợp đồng lao động đã giao kết; phải trả tiền lương, đóng bảo hiểm xã hội, bảo hiểm y tế, bảo hiểm thất nghiệp trong những ngày người lao động không được làm việc và phải trả thêm cho người lao động một khoản tiền ít nhất bằng 02 tháng tiền lương theo hợp đồng lao động. Sau khi được nhận lại làm việc, người lao động hoàn trả cho người sử dụng lao động các khoản tiền trợ cấp thôi việc, trợ cấp mất việc làm nếu đã nhận của người sử dụng lao động.","[""## Điều 39. Đơn phương chấm dứt hợp đồng lao động trái pháp luật\n\nĐơn phương chấm dứt hợp đồng lao động trái pháp luật là trường hợp chấm dứt hợp đồng lao động không đúng quy định tại các điều 35, 36 và 37 của Bộ luật này."", ""## Điều 40. Nghĩa vụ của người lao động khi đơn phương chấm dứt hợp đồng lao động trái pháp luật\n\n- 1. Không được trợ cấp thôi việc. - 2. Phải bồi thường cho người sử dụng lao động nửa tháng tiền lương theo hợp đồng lao động và một khoản tiền tương ứng với tiền lương theo hợp đồng lao động trong những ngày không báo trước. - 3. Phải hoàn trả cho người sử dụng lao động chi phí đào tạo quy định tại Điều 62 của Bộ luật này."", ""## Điều 45. Thông báo chấm dứt hợp đồng lao động\n\n1. Người sử dụng lao động phải thông báo bằng văn bản cho người lao động về việc chấm dứt hợp đồng lao động khi hợp đồng lao động chấm dứt theo quy định của Bộ luật này, trừ trường hợp quy định tại các khoản 4, 5, 6, 7 và 8 Điều 34 của Bộ luật này.\n\n2. Trường hợp người sử dụng lao động không phải là cá nhân chấm dứt hoạt động thì thời điểm chấm dứt hợp đồng lao động tính từ thời điểm có thông báo chấm dứt hoạt động.\n\nTrường hợp người sử dụng lao động không phải là cá nhân bị cơ quan chuyên môn về đăng ký kinh doanh thuộc Ủy ban nhân dân cấp tỉnh ra thông báo không có người đại diện theo pháp luật, người được ủy quyền thực hiện quyền và nghĩa vụ của người đại diện theo pháp luật theo quy định tại khoản 7 Điều 34 của Bộ luật này thì thời điểm chấm dứt hợp đồng lao động tính từ ngày ra thông báo."", ""## Điều 35. Quyền đơn phương chấm dứt hợp đồng lao động của người lao động"", ""- 1. Hết hạn hợp đồng lao động, trừ trường hợp quy định tại khoản 4 Điều 177 của Bộ luật này. - 2. Đã hoàn thành công việc theo hợp đồng lao động. - 3. Hai bên thỏa thuận chấm dứt hợp đồng lao động. - 4. Người lao động bị kết án phạt tù nhưng không được hưởng án treo hoặc không thuộc trường hợp được trả tự do theo quy định tại khoản 5 Điều 328 của Bộ luật Tố tụng hình sự, tử hình hoặc bị cấm làm công việc ghi trong hợp đồng lao động theo bản án, quyết định của Tòa án đã có hiệu lực pháp luật. - 5. Người lao động là người nước ngoài làm việc tại Việt Nam bị trục xuất theo bản án, quyết định của Tòa án đã có hiệu lực pháp luật, quyết định của cơ quan nhà nước có thẩm quyền. - 6. Người lao động chết; bị Tòa án tuyên bố mất năng lực hành vi dân sự, mất tích hoặc đã chết. - 7. Người sử dụng lao động là cá nhân chết; bị Tòa án tuyên bố mất năng lực hành vi dân sự, mất tích hoặc đã chết. Người sử dụng lao động không phải là cá nhân chấm dứt hoạt động hoặc bị cơ quan chuyên môn về đăng ký kinh doanh thuộc Ủy ban nhân dân cấp tinh ra thông báo không có người đại diện theo pháp luật, người được ủy quyền thực hiện quyền và nghĩa vụ của người đại diện theo pháp luật. - 8. Người lao động bị xử lý kỷ luật sa thải. - 9. Người lao động đơn phương chấm dứt hợp đồng lao động theo quy định tại Điều 35 của Bộ luật này. - 10. Người sử dụng lao động đơn phương chấm dứt hợp đồng lao động theo quy""]",simple,1.0,0.7692,0.2525,0.6579,"[""Điều 41""]"
"Theo Điều 50, nội dung quy định về thẩm quyền tuyên bố hợp đồng lao động vô hiệu là gì?",## Điều 50. Thẩm quyền tuyên bố hợp đồng lao động vô hiệu Tòa án nhân dân có quyền tuyên bố hợp đồng lao động vô hiệu.,Thẩm quyền tuyên bố hợp đồng lao động vô hiệu Tòa án nhân dân có quyền tuyên bố hợp đồng lao động vô hiệu.,"[""## Điều 50. Thẩm quyền tuyên bố hợp đồng lao động vô hiệu\n\nTòa án nhân dân có quyền tuyên bố hợp đồng lao động vô hiệu."", ""## Điều 51. Xử lý hợp đồng lao động vô hiệu\n\n- 1. Khi hợp đồng lao động bị tuyên bố vô hiệu từng phần thì xử lý như sau: - a) Quyền, nghĩa vụ và lợi ích của hai bên được giải quyết theo thỏa ước lao động tập thể đang áp dụng; trường hợp không có thỏa ước lao động tập thể thì thực hiện theo quy định của pháp luật;\n\n- b) Hai bên tiến hành sửa đổi, bổ sung phần của hợp đồng lao động bị tuyên bố vô hiệu để phù hợp với thỏa ước lao động tập thể hoặc pháp luật về lao động. - 2. Khi hợp đồng lao động bị tuyên bố vô hiệu toàn bộ thì quyền, nghĩa vụ và lợi ích của người lao động được giải quyết theo quy định của pháp luật; trường hợp do ký sai thẩm quyền thì hai bên ký lại. - 3. Chính phủ quy định chi tiết Điều này."", ""#### Điều 21. Nội dung hợp đồng lao động"", ""### Điều 22. Phụ lục hợp đồng lao động\n\n1. Phụ lục hợp đồng lao động là bộ phận của hợp đồng lao động và có hiệu lực như hợp đồng lao động.\n\n2. Phụ lục hợp đồng lao động quy định chi tiết, sửa đổi, bổ sung một số điều, khoản của hợp đồng lao động nhưng không được sửa đổi thời hạn của hợp đồng lao động.\n\nTrường hợp phụ lục hợp đồng lao động quy định chi tiết một số điều, khoản của hợp đồng lao động mà dẫn đến cách hiểu khác với hợp đồng lao động thì thực hiện theo nội dung của hợp đồng lao động.\n\nTrường hợp phụ lục hợp đồng lao động sửa đổi, bổ sung một số điều, khoản của hợp đồng lao động thì phải ghi rõ nội dung điều, khoản sửa đổi, bổ sung và thời điểm có hiệu lực."", ""## Điều 49. Hợp đồng lao động vô hiệu\n\n- 1. Hợp đồng lao động vô hiệu toàn bộ trong trường hợp sau đây: - a) Toàn bộ nội dung của hợp đồng lao động vi phạm pháp luật; - b) Người giao kết hợp đồng lao động không đúng thẩm quyền hoặc vi phạm nguyên tắc giao kết hợp đồng lao động quy định tại khoản 1 Điều 15 của Bộ luật này; - c) Công việc đã giao kết trong họp đồng lao động là công việc mà pháp luật cấm. - 2. Hợp đồng lao động vô hiệu từng phần khi nội dung của phần đó vi phạm pháp luật nhưng không ảnh hưởng đến các phần còn lại của hợp đồng.""]",simple,1.0,1.0,0.12,1.0,"[""Điều 50""]"
"Theo Điều 58, nội dung quy định về quyền và nghĩa vụ của người lao động thuê lại là gì?","## Điều 56. Quyền và nghĩa vụ của doanh nghiệp cho thuê lại lao động Ngoài các quyền và nghĩa vụ quy định tại Điều 6 của Bộ luật này, doanh nghiệp cho thuê lại lao động có các quyền và nghĩa vụ sau đây: - 1.","Quyền và nghĩa vụ của người lao động thuê lại Ngoài các quyền và nghĩa vụ theo quy định tại Điều 5 của Bộ luật này, người lao động thuê lại có các quyền và nghĩa vụ sau đây: Thực hiện công việc theo hợp đồng lao động đã ký với doanh nghiệp hoạt động cho thuê lại lao động; - 2. Chấp hành kỷ luật lao động, nội quy lao động; tuân theo sự quản lý, điều hành, giám sát hợp pháp của bên thuê lại lao động; - 3.","[""## Điều 56. Quyền và nghĩa vụ của doanh nghiệp cho thuê lại lao động\n\nNgoài các quyền và nghĩa vụ quy định tại Điều 6 của Bộ luật này, doanh nghiệp cho thuê lại lao động có các quyền và nghĩa vụ sau đây:\n\n- 1. Bảo đảm đưa người lao động có trình độ phù hợp với những yêu cầu của bên thuê lại lao động và nội dung của hợp đồng lao động đã ký với người lao động; - 2. Thông báo cho người lao động biết nội dung của hợp đồng cho thuê lại lao động; - 3. Thông báo cho bên thuê lại lao động biết sơ yếu lý lịch của người lao động, yêu cầu của người lao động; - 4. Bảo đảm trả lương cho người lao động thuê lại không thấp hơn tiền lương của người lao động của bên thuê lại lao động có cùng trình độ, làm cùng công việc hoặc công việc có giá trị như nhau; - 5. Lập hồ sơ ghi rõ số lao động đã cho thuê lại, bên thuê lại lao động và định kỳ báo cáo cơ quan chuyên môn về lao động thuộc Ủy ban nhân dân cấp tỉnh; - 6. Xử lý kỷ luật lao động đối với người lao động vi phạm kỷ luật lao động khi bên thuê lại lao động trả lại người lao động do vi phạm kỷ luật lao động."", ""## Điều 6. Quyền và nghĩa vụ của người sử dụng lao động"", ""#### Điều 57. Quyền và nghĩa vụ của bên thuê lại lao động\n\n- 1. Thông báo, hướng dẫn cho người lao động thuê lại biết nội quy lao động và các quy chế khác của mình. - 2. Không được phân biệt đối xử về điều kiện lao động đối với người lao động thuê lại so với người lao động của mình. - 3. Thỏa thuận với người lao động thuê lại về làm việc vào ban đêm, làm thêm giờ theo quy định của Bộ luật này. - 4. Thỏa thuận với người lao động thuê lại và doanh nghiệp cho thuê lại lao động để tuyển dụng chính thức người lao động thuê lại làm việc cho mình trong trường hợp hợp đồng lao động của người lao động thuê lại với doanh nghiệp cho thuê lại lao động chưa chấm dứt. - 5. Trả lại người lao động thuê lại không đáp ứng yêu cầu như đã thỏa thuận hoặc vi phạm kỷ luật lao động cho doanh nghiệp cho thuê lại lao động. - 6. Cung cấp cho doanh nghiệp cho thuê lại lao động chứng cứ về hành vi vi phạm kỷ luật lao động của người lao động thuê lại để xem xét xử lý kỷ luật lao động."", ""### Điều 58. Quyền và nghĩa vụ của người lao động thuê lại\n\nNgoài các quyền và nghĩa vụ theo quy định tại Điều 5 của Bộ luật này, người lao động thuê lại có các quyền và nghĩa vụ sau đây:\n\n- 1. Thực hiện công việc theo hợp đồng lao động đã ký với doanh nghiệp hoạt động cho thuê lại lao động; - 2. Chấp hành kỷ luật lao động, nội quy lao động; tuân theo sự quản lý, điều hành, giám sát hợp pháp của bên thuê lại lao động; - 3. Được trả lương không thấp hơn tiền lương của người lao động của bên thuê lại lao động có cùng trình độ, làm cùng công việc hoặc công việc có giá trị như nhau; - 4. Khiếu nại với doanh nghiệp cho thuê lại lao động trong trường hợp bị bên thuê lại lao động vi phạm các thỏa thuận trong hợp đồng cho thuê lại lao động; - 5. Thỏa thuận chấm dứt hợp đồng lao động với doanh nghiệp cho thuê lại lao động để giao kết hợp đồng lao động với bên thuê lại lao động."", ""## Điều 178. Quyền và nghĩa vụ của tổ chức đại diện người lao động tại cơ sở trong quan hệ lao động\n\n- 1. Thương lượng tập thể với người sử dụng lao động theo quy định của Bộ luật này. - 2. Đối thoại tại nơi làm việc theo quy định của Bộ luật này. - 3. Được tham khảo ý kiến xây dựng và giám sát việc thực hiện thang lương, bảng lương, mức lao động, quy chế trả lương, quy chế thưởng, nội quy lao động và những vấn đề liên quan đến quyền, lợi ích của người lao động là thành viên của mình. - 4. Đại diện cho người lao động trong quá trình giải quyết khiếu nại, tranh chấp lao động cá nhân khi được người lao động ủy quyền.\n\n- 5. Tổ chức và lãnh đạo đình công theo quy định của Bộ luật này. - 6. Tiếp nhận hỗ trợ kỹ thuật của cơ quan, tổ chức đăng ký hoạt động hợp pháp tại Việt Nam nhằm tìm hiểu pháp luật về lao động; về trình tự, thủ tục thành lập tổ chức đại diện người lao động và việc tiến hành các hoạt động đại diện trong quan hệ lao động sau khi được cấp đăng ký. - 7. Được người sử dụng lao động bố trí nơi làm việc và được cung cấp thông tin, bảo đảm các điều kiện cần thiết cho hoạt động của tổ chức đại diện người lao động tại cơ sở. - 8. Các quyền và nghĩa vụ khác theo quy định của pháp luật.""]",simple,1.0,1.0,0.1678,1.0,"[""Điều 58""]"
"Theo Điều 66, nội dung quy định về nguyên tắc thương lượng tập thể là gì?","## Điều 72. Thương lượng tập thể ngành, thương lượng tập thể có nhiều doanh nghiệp tham gia - 1.","Nguyên tắc thương lượng tập thể Thương lượng tập thể được tiến hành theo nguyên tắc tự nguyện, hợp tác, thiện chí, bình đẳng, công khai và minh bạch.","[""## Điều 72. Thương lượng tập thể ngành, thương lượng tập thể có nhiều doanh nghiệp tham gia\n\n- 1. Nguyên tắc, nội dung thương lượng tập thể ngành, thương lượng tập thể có nhiều doanh nghiệp tham gia thực hiện theo quy định tại Điều 66 và Điều 67 của Bộ luật này. - 2. Quy trình tiến hành thương lượng tập thể ngành, thương lượng tập thể có nhiều doanh nghiệp tham gia do các bên thỏa thuận quyết định, bao gồm cả việc thỏa thuận tiến hành thương lượng tập thể thông qua Hội đồng thương lượng tập thể quy định tại Điều 73 của Bộ luật này. - 3. Trường hợp thương lượng tập thể ngành thì đại diện thương lượng là tổ chức công đoàn ngành và tổ chức đại diện người sử dụng lao động cấp ngành quyết định.\n\nTrường hợp thương lượng tập thể có nhiều doanh nghiệp tham gia thì đại diện thương lượng do các bên thương lượng quyết định trên cơ sở tự nguyện, thỏa thuân."", ""## Điều 66. Nguyên tắc thương lượng tập thể\n\nThương lượng tập thể được tiến hành theo nguyên tắc tự nguyện, hợp tác, thiện chí, bình đẳng, công khai và minh bạch."", ""## Điều 74. Trách nhiệm của Ủy ban nhân dân cấp tỉnh trong thương lượng tập thể\n\n- 1. Tổ chức đào tạo, bồi dưỡng kỹ năng thương lượng tập thể cho các bên thương lượng tập thể. - 2. Xây dựng và cung cấp các thông tin, dữ liệu về kinh tế xã hội, thị trường lao động, quan hệ lao động nhằm hỗ trợ, thúc đẩy thương lượng tập thể. - 3. Chủ động hoặc khi có yêu cầu của cả hai bên thương lượng tập thể, hỗ trợ các bên đạt được thỏa thuận trong quá trình thương lượng tập thể; trường hợp không có yêu cầu, việc chủ động hỗ trợ của Ủy ban nhân dân cấp tỉnh chỉ được tiến hành nếu được các bên đồng ý. - 4. Thành lập Hội đồng thương lượng tập thể khi có yêu cầu của các bên thương lượng tập thể có nhiều doanh nghiệp theo quy định tại Điều 73 của Bộ luật này."", ""## Điều 70. Quy trình thương lượng tập thể tại doanh nghiệp\n\n1. Khi có yêu cầu thương lượng tập thể của tổ chức đại diện người lao động tại cơ sở có quyền yêu cầu thương lượng tập thể theo quy định tại Điều 68 của Bộ luật này hoặc yêu cầu của người sử dụng lao động thì bên nhận được yêu cầu không được từ chối việc thương lượng.\n\nTrong thời hạn 07 ngày làm việc kể từ ngày nhận được yêu cầu và nội dung thương lượng, các bên thỏa thuận về địa điểm, thời gian bắt đầu thương lượng.\n\nNgười sử dụng lao động có trách nhiệm bố trí thời gian, địa điểm và các điều kiện cần thiết để tổ chức các phiên họp thương lượng tập thể.\n\nThời gian bắt đầu thương lượng không được quá 30 ngày kể từ ngày nhận được yêu cầu thương lượng tập thể.\n\n2. Thời gian thương lượng tập thể không được quá 90 ngày kể từ ngày bắt đầu thương lượng, trừ trường hợp các bên có thỏa thuận khác.\n\nThời gian tham gia các phiên họp thương lượng tập thể của đại diện bên người lao động được tính là thời gian làm việc có hưởng lương. Trường hợp người lao động là thành viên của tổ chức đại diện người lao động tham gia các phiên họp thương lượng tập thể thì thời gian tham gia các phiên họp không tính vào thời gian quy định tại khoản 2 Điều 176 của Bộ luật này."", ""## Điều 73. Thương lượng tập thể có nhiều doanh nghiệp tham gia thông qua Hội đồng thương lượng tập thể""]",simple,1.0,0.4,0.1759,1.0,"[""Điều 66""]"
"Theo Điều 74, nội dung quy định về trách nhiệm của ủy ban nhân dân cấp tỉnh trong thương lượng tập thể là gì?",## Điều 74. Trách nhiệm của Ủy ban nhân dân cấp tỉnh trong thương lượng tập thể - 1.,"Trách nhiệm của Ủy ban nhân dân cấp tỉnh trong thương lượng tập thể Tổ chức đào tạo, bồi dưỡng kỹ năng thương lượng tập thể cho các bên thương lượng tập thể. - 2.","[""## Điều 74. Trách nhiệm của Ủy ban nhân dân cấp tỉnh trong thương lượng tập thể\n\n- 1. Tổ chức đào tạo, bồi dưỡng kỹ năng thương lượng tập thể cho các bên thương lượng tập thể. - 2. Xây dựng và cung cấp các thông tin, dữ liệu về kinh tế xã hội, thị trường lao động, quan hệ lao động nhằm hỗ trợ, thúc đẩy thương lượng tập thể. - 3. Chủ động hoặc khi có yêu cầu của cả hai bên thương lượng tập thể, hỗ trợ các bên đạt được thỏa thuận trong quá trình thương lượng tập thể; trường hợp không có yêu cầu, việc chủ động hỗ trợ của Ủy ban nhân dân cấp tỉnh chỉ được tiến hành nếu được các bên đồng ý. - 4. Thành lập Hội đồng thương lượng tập thể khi có yêu cầu của các bên thương lượng tập thể có nhiều doanh nghiệp theo quy định tại Điều 73 của Bộ luật này."", ""- 1. Trên cơ sở đồng thuận, các bên thương lượng tập thể có nhiều doanh nghiệp tham gia có thể yêu cầu Ủy ban nhân dân cấp tỉnh nơi đặt trụ sở chính của các doanh nghiệp tham gia thương lượng hoặc nơi do các bên lựa chọn trong trường hợp các doanh nghiệp tham gia thương lượng có trụ sở chính tại nhiều tỉnh, thành phố trực thuộc trung ương thành lập Hội đồng thương lượng tập thể để tiến hành thương lượng tập thể. - 2. Khi nhận được yêu cầu của các bên thương lượng tập thể có nhiều doanh nghiệp tham gia, Ủy ban nhân dân cấp tỉnh quyết định thành lập Hội đồng thương lượng tập thể để tổ chức việc thương lượng tập thể. Thành phần Hội đồng thương lượng tập thể bao gồm: - a) Chủ tịch Hội đồng do các bên quyết định và có trách nhiệm điều phối hoạt động của Hội đồng thương lượng tập thể, hỗ trợ cho việc thương lượng tập thể của các bên; - b) Đại diện các bên thương lượng tập thể do mỗi bên cử. Số lượng đại diện mỗi bên thương lượng tham gia Hội đồng do các bên thỏa thuận; - c) Đại diện Ủy ban nhân dân cấp tỉnh. - 3. Hội đồng thương lượng tập thể tiến hành thương lượng theo yêu cầu các bên và tự chấm dứt hoạt động khi thỏa ước lao động tập thể có nhiều doanh nghiệp tham gia được ký kết hoặc theo thỏa thuận của các bên. - 4. Bộ trưởng Bộ Lao động Thương binh và Xã hội quy định chức năng, nhiệm vụ, hoạt động của Hội đồng thương lượng tập thể."", ""## Điều 72. Thương lượng tập thể ngành, thương lượng tập thể có nhiều doanh nghiệp tham gia\n\n- 1. Nguyên tắc, nội dung thương lượng tập thể ngành, thương lượng tập thể có nhiều doanh nghiệp tham gia thực hiện theo quy định tại Điều 66 và Điều 67 của Bộ luật này. - 2. Quy trình tiến hành thương lượng tập thể ngành, thương lượng tập thể có nhiều doanh nghiệp tham gia do các bên thỏa thuận quyết định, bao gồm cả việc thỏa thuận tiến hành thương lượng tập thể thông qua Hội đồng thương lượng tập thể quy định tại Điều 73 của Bộ luật này. - 3. Trường hợp thương lượng tập thể ngành thì đại diện thương lượng là tổ chức công đoàn ngành và tổ chức đại diện người sử dụng lao động cấp ngành quyết định.\n\nTrường hợp thương lượng tập thể có nhiều doanh nghiệp tham gia thì đại diện thương lượng do các bên thương lượng quyết định trên cơ sở tự nguyện, thỏa thuân."", ""## Điều 70. Quy trình thương lượng tập thể tại doanh nghiệp\n\n1. Khi có yêu cầu thương lượng tập thể của tổ chức đại diện người lao động tại cơ sở có quyền yêu cầu thương lượng tập thể theo quy định tại Điều 68 của Bộ luật này hoặc yêu cầu của người sử dụng lao động thì bên nhận được yêu cầu không được từ chối việc thương lượng.\n\nTrong thời hạn 07 ngày làm việc kể từ ngày nhận được yêu cầu và nội dung thương lượng, các bên thỏa thuận về địa điểm, thời gian bắt đầu thương lượng.\n\nNgười sử dụng lao động có trách nhiệm bố trí thời gian, địa điểm và các điều kiện cần thiết để tổ chức các phiên họp thương lượng tập thể.\n\nThời gian bắt đầu thương lượng không được quá 30 ngày kể từ ngày nhận được yêu cầu thương lượng tập thể.\n\n2. Thời gian thương lượng tập thể không được quá 90 ngày kể từ ngày bắt đầu thương lượng, trừ trường hợp các bên có thỏa thuận khác.\n\nThời gian tham gia các phiên họp thương lượng tập thể của đại diện bên người lao động được tính là thời gian làm việc có hưởng lương. Trường hợp người lao động là thành viên của tổ chức đại diện người lao động tham gia các phiên họp thương lượng tập thể thì thời gian tham gia các phiên họp không tính vào thời gian quy định tại khoản 2 Điều 176 của Bộ luật này."", ""#### Điều 185. Hội đồng trọng tài lao động\n\n- 1. Chủ tịch Ủy ban nhân dân cấp tỉnh quyết định thành lập Hội đồng trọng tài lao động, bổ nhiệm Chủ tịch, thư ký và các trọng tài viên lao động của Hội đồng trọng tài lao động. Nhiệm kỳ của Hội đồng trọng tài lao động là 05 năm. - 2. Số lượng trọng tài viên lao động của Hội đồng trọng tài lao động do Chủ tịch Ủy ban nhân dân cấp tỉnh quyết định, ít nhất là 15 người, bao gồm số lượng ngang nhau do các bên đề cử, cụ thể như sau: - a) Tối thiểu 05 thành viên do cơ quan chuyên môn về lao động thuộc Ủy ban nhân dân cấp tỉnh đề cử, trong đó có Chủ tịch Hội đồng là đại diện lãnh đạo và thư ký Hội đồng là công chức của cơ quan chuyên môn về lao động thuộc Ủy ban nhân dân cấp tỉnh; - b) Tối thiểu 05 thành viên do công đoàn cấp tỉnh đề cử;""]",simple,1.0,1.0,0.1304,1.0,"[""Điều 74""]"
"Theo Điều 84, nội dung quy định về mở rộng phạm vi áp dụng của thỏa ước lao động tập thể ngành hoặc thỏa ước lao động tập thể có nhiều doanh nghiệp là gì?","# Điều 81. Quan hệ giữa thỏa ước lao động tập thể doanh nghiệp, thỏa ước lao động tập thể ngành và thỏa ước lao động tập thể có nhiều doanh nghiệp - 1.","Mở rộng phạm vi áp dụng của thỏa ước lao động tập thể ngành hoặc thỏa ước lao động tập thể có nhiều doanh nghiệp Khi một thỏa ước lao động tập thể ngành hoặc thỏa ước lao động tập thể có nhiều doanh nghiệp có phạm vi áp dụng chiếm trên 75% người lao động hoặc trên 75% doanh nghiệp cùng ngành, nghề, lĩnh vực trong khu công nghiệp, khu kinh tế, khu chế xuất, khu công nghệ cao thì người sử dụng lao động hoặc tổ chức đại diện của người lao động tại đó đề nghị cơ quan nhà nước có thẩm quyền quyết định mở rộng phạm vi áp dụng một phần hoặc toàn bộ thỏa ước đó đối với các doanh nghiệp cùng ngành, nghề, lĩnh vực trong khu công nghiệp, khu kinh tế, khu chế xuất, khu công nghệ cao. - 2.","[""# Điều 81. Quan hệ giữa thỏa ước lao động tập thể doanh nghiệp, thỏa ước lao động tập thể ngành và thỏa ước lao động tập thể có nhiều doanh nghiệp\n\n- 1. Trường hợp thỏa ước lao động tập thể doanh nghiệp, thỏa ước lao động tập thể có nhiều doanh nghiệp, thỏa ước lao động tập thể ngành quy định về quyền, nghĩa vụ và lợi ích của người lao động khác nhau thì thực hiện theo nội dung có lợi nhất cho người lao động. - 2. Doanh nghiệp thuộc đối tượng áp dụng của thỏa ước lao động tập thể ngành hoặc thỏa ước lao động tập thể có nhiều doanh nghiệp nhưng chưa có thỏa ước lao động tập thể doanh nghiệp thì có thể xây dựng thỏa ước lao động tập thể doanh nghiệp với những nội dung có lợi hơn cho người lao động so với thỏa ước lao động tập thể ngành hoặc thỏa ước lao động tập thể có nhiều doanh nghiệp. - 3. Khuyến khích doanh nghiệp chưa tham gia thỏa ước lao động tập thể ngành hoặc thỏa ước lao động tập thể có nhiều doanh nghiệp thực hiện nội dung có lợi hơn cho người lao động của thỏa ước lao động tập thể ngành hoặc thỏa ước lao động tập thể có nhiều doanh nghiệp."", ""## Điều 84. Mở rộng phạm vi áp dụng của thỏa ước lao động tập thể ngành hoặc thỏa ước lao động tập thể có nhiều doanh nghiệp\n\n- 1. Khi một thỏa ước lao động tập thể ngành hoặc thỏa ước lao động tập thể có nhiều doanh nghiệp có phạm vi áp dụng chiếm trên 75% người lao động hoặc trên 75% doanh nghiệp cùng ngành, nghề, lĩnh vực trong khu công nghiệp, khu kinh tế, khu chế xuất, khu công nghệ cao thì người sử dụng lao động hoặc tổ chức đại diện của người lao động tại đó đề nghị cơ quan nhà nước có thẩm quyền quyết định mở rộng phạm vi áp dụng một phần hoặc toàn bộ thỏa ước đó đối với các doanh nghiệp cùng ngành, nghề, lĩnh vực trong khu công nghiệp, khu kinh tế, khu chế xuất, khu công nghệ cao. - 2. Chính phủ quy định chi tiết khoản 1 Điều này; quy định trình tự, thủ tục và thẩm quyền quyết định mở rộng phạm vi áp dụng thỏa ước lao động tập thể quy định tại khoản 1 Điều này."", ""## Điều 85. Gia nhập và rút khỏi thỏa ước lao động tập thể ngành hoặc thỏa ước lao động tập thể có nhiều doanh nghiệp\n\n- 1. Doanh nghiệp có thể gia nhập thỏa ước lao động tập thể ngành, thỏa ước lao động tập thể có nhiều doanh nghiệp khi có sự đồng thuận của tất cả người sử dụng lao động và tổ chức đại diện người lao động tại doanh nghiệp là thành viên của thỏa ước, trừ trường hợp quy định tại khoản 1 Điều 84 của Bộ luật này. - 2. Doanh nghiệp thành viên của thỏa ước lao động tập thể ngành, thỏa ước lao động tập thể có nhiều doanh nghiệp được rút khỏi thỏa ước lao động tập thể khi có sự đồng thuận của tất cả người sử dụng lao động và tổ chức đại diện người lao động tại doanh nghiệp là thành viên của thỏa ước, trừ trường hợp có khó khăn đặc biệt trong hoạt động sản xuất, kinh doanh. - 3. Chính phủ quy định chi tiết Điều này."", ""### Điều 75. Thỏa ước lao động tập thể\n\n1. Thỏa ước lao động tập thể là thỏa thuận đạt được thông qua thương lượng tập thể và được các bên ký kết bằng văn bản.\n\nThỏa ước lao động tập thể bao gồm thỏa ước lao động tập thể doanh nghiệp, thỏa ước lao động tập thể ngành, thỏa ước lao động tập thể có nhiều doanh nghiệp và các thỏa ước lao động tập thể khác.\n\n2. Nội dung thỏa ước lao động tập thể không được trái với quy định của pháp luật; khuyến khích có lợi hơn cho người lao động so với quy định của pháp luật.\n\nĐiều 76. Lấy ý kiến và ký kết thỏa ước lao động tập thể\n\n1. Đối với thỏa ước lao động tập thể doanh nghiệp, trước khi ký kết, dự thảo thỏa ước lao động tập thể đã được các bên đàm phán phải được lấy ý kiến của toàn bộ người lao động trong doanh nghiệp. Thỏa ước lao động tập thể doanh nghiệp chỉ được ký kết khi có trên 50% người lao động của doanh nghiệp biểu quyết tán thành.\n\n2. Đối với thỏa ước lao động tập thể ngành, đối tượng lấy ý kiến bao gồm toàn bộ thành viên ban lãnh đạo của các tổ chức đại diện người lao động tại các doanh nghiệp tham gia thương lượng. Thỏa ước lao động tập thể ngành chỉ được ký kết khi có trên 50% tổng số người được lấy ý kiến biểu quyết tán thành."", ""## THỎA ƯỚC LAO ĐỘNG TẬP THỂ""]",simple,1.0,0.9,0.3304,1.0,"[""Điều 84""]"
"Theo Điều 92, nội dung quy định về hội đồng tiền lương quốc gia là gì?",### Điều 92. Hội đồng tiền lương quốc gia 1.,"Hội đồng tiền lương quốc gia Hội đồng tiền lương quốc gia là cơ quan tư vấn cho Chính phủ về mức lương tối thiểu và chính sách tiền lương đối với người lao động. Thủ tướng Chính phủ thành lập Hội đồng tiền lương quốc gia bao gồm các thành viên là đại diện của Bộ Lao động Thương binh và Xã hội, Tổng Liên đoàn Lao động Việt Nam, một số tổ chức đại diện người sử dụng lao động ở trung ương và chuyên gia độc lập.","[""### Điều 92. Hội đồng tiền lương quốc gia\n\n1. Hội đồng tiền lương quốc gia là cơ quan tư vấn cho Chính phủ về mức lương tối thiểu và chính sách tiền lương đối với người lao động.\n\n- 2. Thủ tướng Chính phủ thành lập Hội đồng tiền lương quốc gia bao gồm các thành viên là đại diện của Bộ Lao động Thương binh và Xã hội, Tổng Liên đoàn Lao động Việt Nam, một số tổ chức đại diện người sử dụng lao động ở trung ương và chuyên gia độc lập. - 3. Chính phủ quy định chức năng, nhiệm vụ, cơ cấu tổ chức và hoạt động của Hội đồng tiền lương quốc gia."", ""## QUỐC HỘI"", ""#### TIỀN LƯƠNG"", ""#### Điều 21. Nội dung hợp đồng lao động"", ""## Điều 207. Tiền lương và các quyền lợi hợp pháp khác của người lao động trong thời gian đình công\n\n1. Người lao động không tham gia đình công nhưng phải ngừng việc vì lý do đình công thì được trả lương ngừng việc theo quy định tại khoản 2 Điều 99 của Bộ luật này và các quyền lợi khác theo quy định của pháp luật về lao động.\n\n2. Người lao động tham gia đình công không được trả lương và các quyền lợi khác theo quy định của pháp luật, trừ trường hợp các bên có thỏa thuận khác.""]",simple,1.0,1.0,0.5385,1.0,"[""Điều 92""]"
"Theo Điều 100, nội dung quy định về trả lương thông qua người cai thầu là gì?",### Điều 100. Trả lương thông qua người cai thầu - 1.,"Trả lương thông qua người cai thầu Nơi nào sử dụng người cai thầu hoặc người có vai trò trung gian tương tự thì người sử dụng lao động là chủ chính phải có danh sách và địa chỉ của những người này kèm theo danh sách những người lao động làm việc với họ và phải bảo đảm việc họ tuân thủ quy định của pháp luật về trả lương, an toàn, vệ sinh lao động. - 2.","[""### Điều 100. Trả lương thông qua người cai thầu\n\n- 1. Nơi nào sử dụng người cai thầu hoặc người có vai trò trung gian tương tự thì người sử dụng lao động là chủ chính phải có danh sách và địa chỉ của những người này kèm theo danh sách những người lao động làm việc với họ và phải bảo đảm việc họ tuân thủ quy định của pháp luật về trả lương, an toàn, vệ sinh lao động. - 2. Trường hợp người cai thầu hoặc người có vai trò trung gian tương tự không trả lương hoặc trả lương không đầy đủ và không bảo đảm các quyền lợi khác cho người lao động thì người sử dụng lao động là chủ chính phải chịu trách nhiệm trả lương và bảo đảm các quyền lợi cho người lao động.\n\nTrong trường hợp này, người sử dụng lao động là chủ chính có quyền yêu cầu người cai thầu hoặc người có vai trò trung gian tương tự đền bù hoặc yêu cầu cơ quan nhà nước có thẩm quyền giải quyết tranh chấp theo quy định của pháp luật."", ""#### Điều 96. Hình thức trả lương\n\n1. Người sử dụng lao động và người lao động thỏa thuận về hình thức trả lương theo thời gian, sản phẩm hoặc khoán.\n\n2. Lương được trả bằng tiền mặt hoặc trả qua tài khoản cá nhân của người lao động được mở tại ngân hàng.\n\nTrường hợp trả lương qua tài khoản cá nhân của người lao động được mở tại ngân hàng thì người sử dụng lao động phải trả các loại phí liên quan đến việc mở tài khoản và chuyển tiền lương.\n\n3. Chính phủ quy định chi tiết Điều này."", ""### Điều 64. Nội dung đối thoại tại nơi làm việc\n\n- 1. Nội dung đối thoại bắt buộc theo quy định tại điểm c khoản 2 Điều 63 của Bộ luật này. - 2. Ngoài nội dung quy định tại khoản 1 Điều này, các bên lựa chọn một hoặc một số nội dung sau đây để tiến hành đối thoại: - a) Tình hình sản xuất, kinh doanh của người sử dụng lao động; - b) Việc thực hiện hợp đồng lao động, thỏa ước lao động tập thể, nội quy lao động, quy chế và cam kết, thỏa thuận khác tại nơi làm việc; - c) Điều kiện làm việc; - d) Yêu cầu của người lao động, tổ chức đại diện người lao động đối với người sử dụng lao động; - đ) Yêu cầu của người sử dụng lao động đối với người lao động, tổ chức đại diện người lao động; - e) Nội dung khác mà một hoặc các bên quan tâm."", ""## Điều 207. Tiền lương và các quyền lợi hợp pháp khác của người lao động trong thời gian đình công\n\n1. Người lao động không tham gia đình công nhưng phải ngừng việc vì lý do đình công thì được trả lương ngừng việc theo quy định tại khoản 2 Điều 99 của Bộ luật này và các quyền lợi khác theo quy định của pháp luật về lao động.\n\n2. Người lao động tham gia đình công không được trả lương và các quyền lợi khác theo quy định của pháp luật, trừ trường hợp các bên có thỏa thuận khác."", ""#### Điều 90. Tiền lương\n\n- 1. Tiền lương là số tiền mà người sử dụng lao động trả cho người lao động theo thỏa thuận để thực hiện công việc, bao gồm mức lương theo công việc hoặc chức danh, phụ cấp lương và các khoản bổ sung khác. - 2. Mức lương theo công việc hoặc chức danh không được thấp hơn mức lương tối thiểu. - 3. Người sử dụng lao động phải bảo đảm trả lương bình đẳng, không phân biệt giới tính đối với người lao động làm công việc có giá trị như nhau.""]",simple,1.0,0.8571,0.2222,1.0,"[""Điều 100""]"
"Theo Điều 108, nội dung quy định về làm thêm giờ trong trường hợp đặc biệt là gì?",### Điều 108. Làm thêm giờ trong trường hợp đặc biệt Người sử dụng lao động có quyền yêu cầu người lao động làm thêm giờ vào bất kỳ ngày nào mà không bị giới hạn về số giờ làm thêm theo quy định tại Điều 107 của Bộ luật này và người lao động không được từ chối trong trường hợp sau đây: - 1.,"Làm thêm giờ trong trường hợp đặc biệt Người sử dụng lao động có quyền yêu cầu người lao động làm thêm giờ vào bất kỳ ngày nào mà không bị giới hạn về số giờ làm thêm theo quy định tại Điều 107 của Bộ luật này và người lao động không được từ chối trong trường hợp sau đây: Thực hiện lệnh động viên, huy động bảo đảm nhiệm vụ quốc phòng, an ninh theo quy định của pháp luật; - 2. Thực hiện các công việc nhằm bảo vệ tính mạng con người, tài sản của cơ quan, tổ chức, cá nhân trong phòng ngừa, khắc phục hậu quả thiên tai, hỏa hoạn, dịch bệnh nguy hiểm và thảm họa, trừ trường hợp có nguy cơ ảnh hưởng đến tính mạng, sức khỏe của người lao động theo quy định của pháp luật về an toàn, vệ sinh lao động.","[""### Điều 108. Làm thêm giờ trong trường hợp đặc biệt\n\nNgười sử dụng lao động có quyền yêu cầu người lao động làm thêm giờ vào bất kỳ ngày nào mà không bị giới hạn về số giờ làm thêm theo quy định tại Điều 107 của Bộ luật này và người lao động không được từ chối trong trường hợp sau đây:\n\n- 1. Thực hiện lệnh động viên, huy động bảo đảm nhiệm vụ quốc phòng, an ninh theo quy định của pháp luật; - 2. Thực hiện các công việc nhằm bảo vệ tính mạng con người, tài sản của cơ quan, tổ chức, cá nhân trong phòng ngừa, khắc phục hậu quả thiên tai, hỏa hoạn, dịch bệnh nguy hiểm và thảm họa, trừ trường hợp có nguy cơ ảnh hưởng đến tính mạng, sức khỏe của người lao động theo quy định của pháp luật về an toàn, vệ sinh lao động."", ""### Điều 107. Làm thêm giờ"", ""- 1. Thời gian làm thêm giờ là khoảng thời gian làm việc ngoài thời giờ làm việc bình thường theo quy định của pháp luật, thỏa ước lao động tập thể hoặc nội quy lao động. - 2. Người sử dụng lao động được sử dụng người lao động làm thêm giờ khi đáp ứng đầy đủ các yêu cầu sau đây: - a) Phải được sự đồng ý của người lao động; - b) Bảo đảm số giờ làm thêm của người lao động không quá 50% số giờ làm việc bình thường trong 01 ngày; trường hợp áp dụng quy định thời giờ làm việc bình thường theo tuần thì tổng số giờ làm việc bình thường và số giờ làm thêm không quá 12 giờ trong 01 ngày; không quá 40 giờ trong 01 tháng; - c) Bảo đảm số giờ làm thêm của người lao động không quá 200 giờ trong 01 năm, trừ trường hợp quy định tại khoản 3 Điều này. - 3. Người sử dụng lao động được sử dụng người lao động làm thêm không quá 300 giờ trong 01 năm trong một số ngành, nghề, công việc hoặc trường hợp sau đây: - a) Sản xuất, gia công xuất khẩu sản phẩm hàng dệt, may, da, giày, điện, điện tử, chế biến nông, lâm, diêm nghiệp, thủy sản; - b) Sản xuất, cung cấp điện, viễn thông, lọc dầu; cấp, thoát nước; - c) Trường hợp giải quyết công việc đòi hỏi lao động có trình độ chuyên môn, kỹ thuật cao mà thị trường lao động không cung ứng đầy đủ, kịp thời; - d) Trường hợp phải giải quyết công việc cấp bách, không thể trì hoãn do tính chất thời vụ, thời điểm của nguyên liệu, sản phẩm hoặc để giải quyết công"", ""#### Điều 109. Nghỉ trong giờ làm việc\n\n1. Người lao động làm việc theo thời giờ làm việc quy định tại Điều 105 của Bộ luật này từ 06 giờ trở lên trong một ngày thì được nghỉ giữa giờ ít nhất 30 phút liên tục, làm việc ban đêm thì được nghỉ giữa giờ ít nhất 45 phút liên tục.\n\nTrường hợp người lao động làm việc theo ca liên tục từ 06 giờ trở lên thì thời gian nghỉ giữa giờ được tính vào giờ làm việc.\n\n2. Ngoài thời gian nghi quy định tại khoản 1 Điều này, người sử dụng lao động bố trí cho người lao động các đợt nghỉ giải lao và ghi vào nội quy lao động."", ""thức giải quyết trong trường hợp thực hiện hợp đồng chịu ảnh hưởng của thiên tai, hỏa hoạn, thời tiết. - 4. Chính phủ quy định nội dung của hợp đồng lao động đối với người lao động được thuê làm giám đốc trong doanh nghiệp có vốn nhà nước. - 5. Bộ trưởng Bộ Lao động Thương binh và Xã hội quy định chi tiết các khoản 1, 2 và 3 Điều này.""]",simple,1.0,0.9565,0.3869,1.0,"[""Điều 108""]"
"Theo Điều 117, nội dung quy định về kỷ luật lao động là gì?","#### Điều 117. Kỷ luật lao động Kỷ luật lao động là những quy định về việc tuân theo thời gian, công nghệ và điều hành sản xuất, kinh doanh do người sử dụng lao động ban hành trong nội quy lao động và do pháp luật quy định.","Kỷ luật lao động Kỷ luật lao động là những quy định về việc tuân theo thời gian, công nghệ và điều hành sản xuất, kinh doanh do người sử dụng lao động ban hành trong nội quy lao động và do pháp luật quy định.","[""#### Điều 117. Kỷ luật lao động\n\nKỷ luật lao động là những quy định về việc tuân theo thời gian, công nghệ và điều hành sản xuất, kinh doanh do người sử dụng lao động ban hành trong nội quy lao động và do pháp luật quy định."", ""#### Điều 214. Nội dung thanh tra lao động\n\n1. Thanh tra việc chấp hành quy định của pháp luật về lao động.\n\n- 2. Điều tra tại nạn lao động và vi phạm an toàn, vệ sinh lao động. - 3. Tham gia hướng dẫn áp dụng hệ thống tiêu chuẩn, quy chuẩn kỹ thuật về điều kiện lao động, an toàn, vệ sinh lao động. - 4. Giải quyết khiếu nại, tố cáo về lao động theo quy định của pháp luật. - 5. Xử lý theo thẩm quyền và kiến nghị cơ quan có thẩm quyền xử lý vi phạm pháp luật về lao động."", ""### Điều 131. Khiếu nại về kỷ luật lao động, trách nhiệm vật chất\n\nNgười bị xử lý kỷ luật lao động, bị tạm đình chỉ công việc hoặc phải bồi thường theo chế độ trách nhiệm vật chất nếu thấy không thỏa đáng có quyền khiếu nại với người sử dụng lao động, với cơ quan có thẩm quyền theo quy định của pháp luật hoặc yêu cầu giải quyết tranh chấp lao động theo trình tự do pháp luật quy định.\n\nChính phủ quy định chi tiết Điều này."", ""#### KỶ LUẬT LAO ĐỘNG"", ""### Điều 127. Các hành vi bị nghiêm cấm khi xử lý kỷ luật lao động\n\n- 1. Xâm phạm sức khỏe, danh dự, tính mạng, uy tín, nhân phẩm của người lao động. - 2. Phạt tiền, cắt lương thay việc xử lý kỷ luật lao động. - 3. Xử lý kỷ luật lao động đối với người lao động có hành vi vi phạm không được quy định trong nội quy lao động hoặc không thỏa thuận trong hợp đồng lao động đã giao kết hoặc pháp luật về lao động không có quy định.""]",simple,1.0,0.9333,0.1538,1.0,"[""Điều 117""]"
"Theo Điều 125, nội dung quy định về áp dụng hình thức xử lý kỷ luật sa thải là gì?","### Điều 131. Khiếu nại về kỷ luật lao động, trách nhiệm vật chất Người bị xử lý kỷ luật lao động, bị tạm đình chỉ công việc hoặc phải bồi thường theo chế độ trách nhiệm vật chất nếu thấy không thỏa đáng có quyền khiếu nại với người sử dụng lao động, với cơ quan có thẩm quyền theo quy định của pháp luật hoặc yêu cầu giải quyết tranh chấp lao động theo trình tự do pháp luật quy định.","Áp dụng hình thức xử lý kỷ luật sa thải Hình thức xử lý kỷ luật sa thải được người sử dụng lao động áp dụng trong trường hợp sau đây: Người lao động có hành vi trộm cắp, tham ô, đánh bạc, cố ý gây thương tích, sử dụng ma tuý tại nơi làm việc; - 2. Người lao động có hành vi tiết lộ bí mật kinh doanh, bí mật công nghệ, xâm phạm quyền sở hữu trí tuệ của người sử dụng lao động, có hành vi gây thiệt hại nghiêm trọng hoặc đe dọa gây thiệt hại đặc biệt nghiêm trọng về tài sản, lợi ích của người sử dụng lao động hoặc quấy rối tình dục tại nơi làm việc được quy định trong nội quy lao động; Người lao động bị xử lý kỷ luật kéo dài thời hạn nâng lương hoặc cách chức mà tái phạm trong thời gian chưa xóa kỷ luật.","[""### Điều 131. Khiếu nại về kỷ luật lao động, trách nhiệm vật chất\n\nNgười bị xử lý kỷ luật lao động, bị tạm đình chỉ công việc hoặc phải bồi thường theo chế độ trách nhiệm vật chất nếu thấy không thỏa đáng có quyền khiếu nại với người sử dụng lao động, với cơ quan có thẩm quyền theo quy định của pháp luật hoặc yêu cầu giải quyết tranh chấp lao động theo trình tự do pháp luật quy định.\n\nChính phủ quy định chi tiết Điều này."", ""## Điều 124. Hình thức xử lý kỷ luật lao động\n\n- 1. Khiển trách. - 2. Kéo dài thời hạn nâng lương không quá 06 tháng. - 3. Cách chức. - 4. Sa thải."", ""#### Điều 117. Kỷ luật lao động\n\nKỷ luật lao động là những quy định về việc tuân theo thời gian, công nghệ và điều hành sản xuất, kinh doanh do người sử dụng lao động ban hành trong nội quy lao động và do pháp luật quy định."", ""## Điều 125. Áp dụng hình thức xử lý kỷ luật sa thải\n\nHình thức xử lý kỷ luật sa thải được người sử dụng lao động áp dụng trong trường hợp sau đây:\n\n- 1. Người lao động có hành vi trộm cắp, tham ô, đánh bạc, cố ý gây thương tích, sử dụng ma tuý tại nơi làm việc; - 2. Người lao động có hành vi tiết lộ bí mật kinh doanh, bí mật công nghệ, xâm phạm quyền sở hữu trí tuệ của người sử dụng lao động, có hành vi gây thiệt hại nghiêm trọng hoặc đe dọa gây thiệt hại đặc biệt nghiêm trọng về tài sản, lợi ích của người sử dụng lao động hoặc quấy rối tình dục tại nơi làm việc được quy định trong nội quy lao động;\n\n- 3. Người lao động bị xử lý kỷ luật kéo dài thời hạn nâng lương hoặc cách chức mà tái phạm trong thời gian chưa xóa kỷ luật. Tái phạm là trường hợp người lao động lặp lại hành vi vi phạm đã bị xử lý kỷ luật mà chưa được xóa kỷ luật theo quy định tại Điều 126 của Bộ luật này; - 4. Người lao động tự ý bỏ việc 05 ngày cộng dồn trong thời hạn 30 ngày hoặc 20 ngày cộng dồn trong thời hạn 365 ngày tính từ ngày đầu tiên tự ý bỏ việc mà không có lý do chính đáng.\n\nTrường hợp được coi là có lý do chính đáng bao gồm thiên tai, hỏa hoạn, bản thân, thân nhân bị ốm có xác nhận của cơ sở khám bệnh, chữa bệnh có thẩm quyền và trường hợp khác được quy định trong nội quy lao động."", ""#### Điều 214. Nội dung thanh tra lao động\n\n1. Thanh tra việc chấp hành quy định của pháp luật về lao động.\n\n- 2. Điều tra tại nạn lao động và vi phạm an toàn, vệ sinh lao động. - 3. Tham gia hướng dẫn áp dụng hệ thống tiêu chuẩn, quy chuẩn kỹ thuật về điều kiện lao động, an toàn, vệ sinh lao động. - 4. Giải quyết khiếu nại, tố cáo về lao động theo quy định của pháp luật. - 5. Xử lý theo thẩm quyền và kiến nghị cơ quan có thẩm quyền xử lý vi phạm pháp luật về lao động.""]",simple,1.0,0.125,0.4207,1.0,"[""Điều 125""]"
"Theo Điều 133, nội dung quy định về chương trình an toàn, vệ sinh lao động là gì?","#### Điều 133. Chương trình an toàn, vệ sinh lao động - 1.","Chương trình an toàn, vệ sinh lao động Chính phủ quyết định Chương trình quốc gia về an toàn, vệ sinh lao động. - 2.","[""#### Điều 133. Chương trình an toàn, vệ sinh lao động\n\n- 1. Chính phủ quyết định Chương trình quốc gia về an toàn, vệ sinh lao động. - 2. Ủy ban nhân dân cấp tỉnh trình Hội đồng nhân dân cùng cấp quyết định Chương trình an toàn, vệ sinh lao động của địa phương và đưa vào kế hoạch phát triển kinh tế xã hội."", ""#### Chương IX AN TOÀN, VỆ SINH LAO ĐỘNG"", ""#### Điều 214. Nội dung thanh tra lao động\n\n1. Thanh tra việc chấp hành quy định của pháp luật về lao động.\n\n- 2. Điều tra tại nạn lao động và vi phạm an toàn, vệ sinh lao động. - 3. Tham gia hướng dẫn áp dụng hệ thống tiêu chuẩn, quy chuẩn kỹ thuật về điều kiện lao động, an toàn, vệ sinh lao động. - 4. Giải quyết khiếu nại, tố cáo về lao động theo quy định của pháp luật. - 5. Xử lý theo thẩm quyền và kiến nghị cơ quan có thẩm quyền xử lý vi phạm pháp luật về lao động."", ""#### Điều 134. Bảo đảm an toàn, vệ sinh lao động tại nơi làm việc\n\n- 1. Người sử dụng lao động có trách nhiệm thực hiện đầy đủ các giải pháp nhằm bảo đảm an toàn, vệ sinh lao động tại nơi làm việc. - 2. Người lao động có trách nhiệm chấp hành quy định, nội quy, quy trình, yêu cầu về an toàn, vệ sinh lao động; tuân thủ pháp luật và nắm vững kiến thức, kỹ năng về các biện pháp bảo đảm an toàn, vệ sinh lao động tại nơi làm việc."", ""### Điều 132. Tuân thủ pháp luật về an toàn, vệ sinh lao động\n\nNgười sử dụng lao động, người lao động và cơ quan, tổ chức, cá nhân có liên quan đến lao động, sản xuất, kinh doanh phải thực hiện quy định của pháp luật về an toàn, vệ sinh lao động.""]",simple,1.0,0.8,0.1125,1.0,"[""Điều 133""]"
"Theo Điều 141, nội dung quy định về trợ cấp trong thời gian chăm sóc con ốm đau, thai sản và thực hiện các biện pháp tránh thai là gì?","## Điều 141. Trợ cấp trong thời gian chăm sóc con ốm đau, thai sản và thực hiện các biện pháp tránh thai Thời gian nghỉ việc khi chăm sóc con dưới 07 tuổi ốm đau, khám thai, sẩy thai, nạo, hút thai, thai chết lưu, phá thai bệnh lý, thực hiện các biện pháp tránh thai, triệt sản, người lao động được hưởng trợ cấp theo quy định của pháp luật về bảo hiểm xã hội.","Trợ cấp trong thời gian chăm sóc con ốm đau, thai sản và thực hiện các biện pháp tránh thai Thời gian nghỉ việc khi chăm sóc con dưới 07 tuổi ốm đau, khám thai, sẩy thai, nạo, hút thai, thai chết lưu, phá thai bệnh lý, thực hiện các biện pháp tránh thai, triệt sản, người lao động được hưởng trợ cấp theo quy định của pháp luật về bảo hiểm xã hội.","[""## Điều 141. Trợ cấp trong thời gian chăm sóc con ốm đau, thai sản và thực hiện các biện pháp tránh thai\n\nThời gian nghỉ việc khi chăm sóc con dưới 07 tuổi ốm đau, khám thai, sẩy thai, nạo, hút thai, thai chết lưu, phá thai bệnh lý, thực hiện các biện pháp tránh thai, triệt sản, người lao động được hưởng trợ cấp theo quy định của pháp luật về bảo hiểm xã hội."", ""## Điều 137. Bảo vệ thai sản"", ""#### Điều 139. Nghỉ thai sản\n\n1. Lao động nữ được nghỉ thai sản trước và sau khi sinh con là 06 tháng; thời gian nghỉ trước khi sinh không quá 02 tháng.\n\nTrường hợp lao động nữ sinh đôi trở lên thì tính từ con thứ 02 trở đi, cứ mỗi con, người mẹ được nghỉ thêm 01 tháng.\n\n- 2. Trong thời gian nghỉ thai sản, lao động nữ được hưởng chế độ thai sản theo quy định của pháp luật về bảo hiểm xã hội. - 3. Hết thời gian nghỉ thai sản theo quy định tại khoản 1 Điều này, nếu có nhu cầu, lao động nữ có thể nghỉ thêm một thời gian không hưởng lương sau khi thỏa thuận với người sử dụng lao động. - 4. Trước khi hết thời gian nghỉ thai sản theo quy định tại khoản 1 Điều này, lao động nữ có thể trở lại làm việc khi đã nghỉ ít nhất được 04 tháng nhưng người lao động phải báo trước, được người sử dụng lao động đồng ý và có xác nhận của cơ sở khám bệnh, chữa bệnh có thẩm quyền về việc đi làm sóm không có hại cho sức khỏe của người lao động. Trong trường hợp này, ngoài tiền lương của những ngày làm việc do người sử dụng lao động trả, lao động nữ vẫn tiếp tục được hưởng trợ cấp thai sản theo quy định của pháp luật về bảo hiểm xã hội. - 5. Lao động nam khi vợ sinh con, người lao động nhận nuôi con nuôi dưới 06 tháng tuổi, lao động nữ mang thai hộ và người lao động là người mẹ nhờ mang thai hộ được nghỉ việc hưởng chế độ thai sản theo quy định của pháp luật về bảo hiểm xã hội."", ""#### Điều 117. Kỷ luật lao động\n\nKỷ luật lao động là những quy định về việc tuân theo thời gian, công nghệ và điều hành sản xuất, kinh doanh do người sử dụng lao động ban hành trong nội quy lao động và do pháp luật quy định."", ""### Điều 46. Trợ cấp thôi việc\n\n- 1. Khi hợp đồng lao động chấm dứt theo quy định tại các khoản 1, 2, 3, 4, 6, 7, 9 và 10 Điều 34 của Bộ luật này thì người sử dụng lao động có trách nhiệm trả trợ cấp thôi việc cho người lao động đã làm việc thường xuyên cho mình từ đủ 12 tháng trở lên, mỗi năm làm việc được trợ cấp một nửa tháng tiền lương, trừ trường hợp đủ điều kiện hưởng lương hưu theo quy định của pháp luật về bảo hiểm xã hội và trường hợp quy định tại điểm e khoản 1 Điều 36 của Bộ luật này. - 2. Thời gian làm việc để tính trợ cấp thôi việc là tổng thời gian người lao động đã làm việc thực tế cho người sử dụng lao động trừ đi thời gian người lao động đã tham gia bảo hiểm thất nghiệp theo quy định của pháp luật về bảo hiểm thất nghiệp và thời gian làm việc đã được người sử dụng lao động chi trả trợ cấp thôi việc, trợ cấp mất việc làm. - 3. Tiền lương để tính trợ cấp thôi việc là tiền lương bình quân của 06 tháng liền kề theo hợp đồng lao động trước khi người lao động thôi việc. - 4. Chính phủ quy định chi tiết Điều này.""]",simple,1.0,0.9677,0.2479,1.0,"[""Điều 141""]"
"Theo Điều 149, nội dung quy định về sử dụng người lao động cao tuổi là gì?",#### Điều 148. Người lao động cao tuổi - 1.,"Sử dụng người lao động cao tuổi Khi sử dụng người lao động cao tuổi, hai bên có thể thỏa thuận giao kết nhiều lần hợp đồng lao động xác định thời hạn. - 2.","[""#### Điều 148. Người lao động cao tuổi\n\n- 1. Người lao động cao tuổi là người tiếp tục lao động sau độ tuổi theo quy định tại khoản 2 Điều 169 của Bộ luật này. - 2. Người lao động cao tuổi có quyền thỏa thuận với người sử dụng lao động về việc rút ngắn thời giờ làm việc hằng ngày hoặc áp dụng chế độ làm việc không trọn thời gian. - 3. Nhà nước khuyến khích sử dụng người lao động cao tuổi làm việc phù hợp với sức khỏe để bảo đảm quyền lao động và sử dụng hiệu quả nguồn nhân lực."", ""### Điều 149. Sử dụng người lao động cao tuổi\n\n- 1. Khi sử dụng người lao động cao tuổi, hai bên có thể thỏa thuận giao kết nhiều lần hợp đồng lao động xác định thời hạn. - 2. Khi người lao động cao tuổi đang hưởng lương hưu theo quy định của Luật Bảo hiểm xã hội mà làm việc theo hợp đồng lao động mới thì ngoài quyền\n\nlợi đang hưởng theo chế độ hưu trí, người lao động cao tuổi được hưởng tiền lương và các quyền lợi khác theo quy định của pháp luật, hợp đồng lao động.\n\n- 3. Không được sử dụng người lao động cao tuổi làm nghề, công việc nặng nhọc, độc hại, nguy hiểm hoặc đặc biệt nặng nhọc, độc hại, nguy hiểm có ảnh hưởng xấu tới sức khỏe người lao động cao tuổi, trừ trường hợp bảo đảm các điều kiện làm việc an toàn. - 4. Người sử dụng lao động có trách nhiệm quan tâm chăm sóc sức khỏe của người lao động cao tuổi tại nơi làm việc."", ""### Điều 64. Nội dung đối thoại tại nơi làm việc\n\n- 1. Nội dung đối thoại bắt buộc theo quy định tại điểm c khoản 2 Điều 63 của Bộ luật này. - 2. Ngoài nội dung quy định tại khoản 1 Điều này, các bên lựa chọn một hoặc một số nội dung sau đây để tiến hành đối thoại: - a) Tình hình sản xuất, kinh doanh của người sử dụng lao động; - b) Việc thực hiện hợp đồng lao động, thỏa ước lao động tập thể, nội quy lao động, quy chế và cam kết, thỏa thuận khác tại nơi làm việc; - c) Điều kiện làm việc; - d) Yêu cầu của người lao động, tổ chức đại diện người lao động đối với người sử dụng lao động; - đ) Yêu cầu của người sử dụng lao động đối với người lao động, tổ chức đại diện người lao động; - e) Nội dung khác mà một hoặc các bên quan tâm."", ""#### Điều 121. Hiệu lực của nội quy lao động\n\nNội quy lao động có hiệu lực sau 15 ngày kể từ ngày cơ quan nhà nước có thẩm quyền quy định tại Điều 119 của Bộ luật này nhận được đầy đủ hồ sơ đăng ký nội quy lao động.\n\nTrường hợp người sử dụng lao động sử dụng dưới 10 người lao động ban hành nội quy lao động bằng văn bản thì hiệu lực do người sử dụng lao động quyết định trong nội quy lao động."", ""#### Điều 3. Giải thích từ ngữ\n\nTrong Bộ luật này, các từ ngữ dưới đây được hiểu như sau:\n\n1. Người lao động là người làm việc cho người sử dụng lao động theo thỏa thuận, được trả lương và chịu sự quản lý, điều hành, giám sát của người sử dụng lao động.\n\nĐộ tuổi lao động tối thiểu của người lao động là đủ 15 tuổi, trừ trường hợp quy định tại Mục 1 Chương XI của Bộ luật này.\n\n2. Người sử dụng lao động là doanh nghiệp, cơ quan, tổ chức, hợp tác xã, hộ gia đình, cá nhân có thuê mướn, sử dụng người lao động làm việc cho mình theo thỏa thuận; trường hợp người sử dụng lao động là cá nhân thì phải có năng lực hành vi dân sự đầy đủ.""]",simple,1.0,0.6667,0.1088,1.0,"[""Điều 149""]"
"Theo Điều 158, nội dung quy định về chính sách của nhà nước đối với lao động là người khuyết tật là gì?","### Điều 158. Chính sách của Nhà nước đối với lao động là người khuyết tật Nhà nước bảo trợ quyền lao động, tự tạo việc làm của người lao động là người khuyết tật; có chính sách khuyến khích, ưu đãi phù hợp đối với người sử dụng lao động trong tạo việc làm và nhận người lao động là người khuyết tật vào làm việc theo quy định của pháp luật về người khuyết tật.","Chính sách của Nhà nước đối với lao động là người khuyết tật Nhà nước bảo trợ quyền lao động, tự tạo việc làm của người lao động là người khuyết tật; có chính sách khuyến khích, ưu đãi phù hợp đối với người sử dụng lao động trong tạo việc làm và nhận người lao động là người khuyết tật vào làm việc theo quy định của pháp luật về người khuyết tật.","[""### Điều 158. Chính sách của Nhà nước đối với lao động là người khuyết tật\n\nNhà nước bảo trợ quyền lao động, tự tạo việc làm của người lao động là người khuyết tật; có chính sách khuyến khích, ưu đãi phù hợp đối với người sử\n\ndụng lao động trong tạo việc làm và nhận người lao động là người khuyết tật vào làm việc theo quy định của pháp luật về người khuyết tật."", ""#### LAO ĐỘNG LÀ NGƯỜI KHUYẾT TẬT"", ""### Điều 64. Nội dung đối thoại tại nơi làm việc\n\n- 1. Nội dung đối thoại bắt buộc theo quy định tại điểm c khoản 2 Điều 63 của Bộ luật này. - 2. Ngoài nội dung quy định tại khoản 1 Điều này, các bên lựa chọn một hoặc một số nội dung sau đây để tiến hành đối thoại: - a) Tình hình sản xuất, kinh doanh của người sử dụng lao động; - b) Việc thực hiện hợp đồng lao động, thỏa ước lao động tập thể, nội quy lao động, quy chế và cam kết, thỏa thuận khác tại nơi làm việc; - c) Điều kiện làm việc; - d) Yêu cầu của người lao động, tổ chức đại diện người lao động đối với người sử dụng lao động; - đ) Yêu cầu của người sử dụng lao động đối với người lao động, tổ chức đại diện người lao động; - e) Nội dung khác mà một hoặc các bên quan tâm."", ""## Điều 159. Sử dụng lao động là người khuyết tật\n\n- 1. Người sử dụng lao động phải bảo đảm về điều kiện lao động, công cụ lao động, an toàn, vệ sinh lao động và tổ chức khám sức khỏe định kỳ phù hợp với người lao động là người khuyết tật. - 2. Người sử dụng lao động phải tham khảo ý kiến của người lao động là người khuyết tật khi quyết định những vấn đề liên quan đến quyền và lợi ích của họ."", "". .....................................\n\n- 11. Người sử dụng lao động cho người lao động thôi việc theo quy định tại Điều 42 và Điều 43 của Bộ luật này. - 12. Giấy phép lao động hết hiệu lực đối với người lao động là người nước ngoài làm việc tại Việt Nam theo quy định tại Điều 156 của Bộ luật này. - 13. Trường hợp thỏa thuận nội dung thử việc ghi trong hợp đồng lao động mà thử việc không đạt yêu cầu hoặc một bên hủy bỏ thỏa thuận thử việc.""]",simple,1.0,0.95,0.2,1.0,"[""Điều 158""]"
"Theo Điều 166, nội dung quy định về người lao động làm việc trong lĩnh vực nghệ thuật, thể dục, thể thao, hàng hải, hàng không là gì?","## Điều 166. Người lao động làm việc trong lĩnh vực nghệ thuật, thể dục, thể thao, hàng hải, hàng không Người lao động làm việc trong lĩnh vực nghệ thuật, thể dục, thể thao, hàng hải, hàng không được áp dụng một số chế độ phù hợp về đào tạo, bồi dưỡng, nâng cao trình độ, kỹ năng nghề; hợp đồng lao động; tiền lương, tiền thưởng; thời giờ làm việc, thời giờ nghỉ ngơi; an toàn, vệ sinh lao động theo quy định của Chính phủ.","Người lao động làm việc trong lĩnh vực nghệ thuật, thể dục, thể thao, hàng hải, hàng không Người lao động làm việc trong lĩnh vực nghệ thuật, thể dục, thể thao, hàng hải, hàng không được áp dụng một số chế độ phù hợp về đào tạo, bồi dưỡng, nâng cao trình độ, kỹ năng nghề; hợp đồng lao động; tiền lương, tiền thưởng; thời giờ làm việc, thời giờ nghỉ ngơi; an toàn, vệ sinh lao động theo quy định của Chính phủ.","[""## Điều 166. Người lao động làm việc trong lĩnh vực nghệ thuật, thể dục, thể thao, hàng hải, hàng không\n\nNgười lao động làm việc trong lĩnh vực nghệ thuật, thể dục, thể thao, hàng hải, hàng không được áp dụng một số chế độ phù hợp về đào tạo, bồi dưỡng, nâng cao trình độ, kỹ năng nghề; hợp đồng lao động; tiền lương, tiền thưởng; thời giờ làm việc, thời giờ nghỉ ngơi; an toàn, vệ sinh lao động theo quy định của Chính phủ."", ""### Điều 64. Nội dung đối thoại tại nơi làm việc\n\n- 1. Nội dung đối thoại bắt buộc theo quy định tại điểm c khoản 2 Điều 63 của Bộ luật này. - 2. Ngoài nội dung quy định tại khoản 1 Điều này, các bên lựa chọn một hoặc một số nội dung sau đây để tiến hành đối thoại: - a) Tình hình sản xuất, kinh doanh của người sử dụng lao động; - b) Việc thực hiện hợp đồng lao động, thỏa ước lao động tập thể, nội quy lao động, quy chế và cam kết, thỏa thuận khác tại nơi làm việc; - c) Điều kiện làm việc; - d) Yêu cầu của người lao động, tổ chức đại diện người lao động đối với người sử dụng lao động; - đ) Yêu cầu của người sử dụng lao động đối với người lao động, tổ chức đại diện người lao động; - e) Nội dung khác mà một hoặc các bên quan tâm."", ""### Điều 32. Làm việc không trọn thời gian\n\n- 1. Người lao động làm việc không trọn thời gian là người lao động có thời gian làm việc ngắn hơn so với thời gian làm việc bình thường theo ngày hoặc theo tuần hoặc theo tháng được quy định trong pháp luật về lao động, thỏa ước lao động tập thể hoặc nội quy lao động. - 2. Người lao động thỏa thuận với người sử dụng lao động làm việc không trọn thời gian khi giao kết hợp đồng lao động. - 3. Người lao động làm việc không trọn thời gian được hưởng lương; bình đẳng trong thực hiện quyền và nghĩa vụ với người lao động làm việc trọn thời gian; bình đẳng về cơ hội, không bị phân biệt đối xử, bảo đảm an toàn, vệ sinh lao động."", "". .....................................\n\n- 11. Người sử dụng lao động cho người lao động thôi việc theo quy định tại Điều 42 và Điều 43 của Bộ luật này. - 12. Giấy phép lao động hết hiệu lực đối với người lao động là người nước ngoài làm việc tại Việt Nam theo quy định tại Điều 156 của Bộ luật này. - 13. Trường hợp thỏa thuận nội dung thử việc ghi trong hợp đồng lao động mà thử việc không đạt yêu cầu hoặc một bên hủy bỏ thỏa thuận thử việc."", ""## Điều 167. Người lao động nhận công việc về làm tại nhà\n\nNgười lao động có thể thỏa thuận với người sử dụng lao động để nhận việc về làm tại nhà.""]",simple,1.0,0.9714,0.2982,1.0,"[""Điều 166""]"
"Theo Điều 176, nội dung quy định về quyền của thành viên ban lãnh đạo của tổ chức đại diện người lao động tại cơ sở là gì?",## Điều 176. Quyền của thành viên ban lãnh đạo của tổ chức đại diện người lao động tại cơ sở - 1.,Quyền của thành viên ban lãnh đạo của tổ chức đại diện người lao động tại cơ sở Thành viên ban lãnh đạo của tổ chức đại diện người lao động tại cơ sở có quyền sau đây: - a) Tiếp cận người lao động tại nơi làm việc trong quá trình thực hiện các nhiệm vụ của tổ chức đại diện người lao động tại cơ sở. Việc thực hiện quyền này phải bảo đảm không ảnh hưởng đến hoạt động bình thường của người sử dụng lao động; - b) Tiếp cận người sử dụng lao động để thực hiện các nhiệm vụ đại diện của tổ chức đại diện người lao động tại cơ sở; - c) Được sử dụng thời gian làm việc theo quy định tại khoản 2 và khoản 3 Điều này để thực hiện công việc của tổ chức đại diện người lao động tại cơ sở mà vẫn được người sử dụng lao động trả lương; - d) Được hưởng các bảo đảm khác trong quan hệ lao động và trong việc thực hiện chức năng đại diện theo quy định của pháp luật.,"[""## Điều 176. Quyền của thành viên ban lãnh đạo của tổ chức đại diện người lao động tại cơ sở\n\n- 1. Thành viên ban lãnh đạo của tổ chức đại diện người lao động tại cơ sở có quyền sau đây: - a) Tiếp cận người lao động tại nơi làm việc trong quá trình thực hiện các nhiệm vụ của tổ chức đại diện người lao động tại cơ sở. Việc thực hiện quyền này phải bảo đảm không ảnh hưởng đến hoạt động bình thường của người sử dụng lao động; - b) Tiếp cận người sử dụng lao động để thực hiện các nhiệm vụ đại diện của tổ chức đại diện người lao động tại cơ sở; - c) Được sử dụng thời gian làm việc theo quy định tại khoản 2 và khoản 3 Điều này để thực hiện công việc của tổ chức đại diện người lao động tại cơ sở mà vẫn được người sử dụng lao động trả lương; - d) Được hưởng các bảo đảm khác trong quan hệ lao động và trong việc thực hiện chức năng đại diện theo quy định của pháp luật. - 2. Chính phủ quy định thời gian tối thiểu mà người sử dụng lao động dành cho toàn bộ thành viên ban lãnh đạo của tổ chức đại diện người lao động tại\n\ncơ sở để thực hiện nhiệm vụ của tổ chức đại diện trên cơ sở số lượng thành viên của tổ chức."", ""- 1. Không được cản trở, gây khó khăn khi người lao động tiến hành các hoạt động hợp pháp nhằm thành lập, gia nhập và tham gia các hoạt động của tổ chức đại diện người lao động tại cơ sở. - 2. Công nhận và tôn trọng các quyền của tổ chức đại diện người lao động tại cơ sở đã được thành lập hợp pháp. - 3. Phải thỏa thuận bằng văn bản với ban lãnh đạo của tổ chức đại diện người lao động tại cơ sở khi đơn phương chấm dứt hợp đồng lao động, chuyển làm công việc khác, kỷ luật sa thải đối với người lao động là thành viên ban lãnh đạo của tổ chức đại diện người lao động tại cơ sở. Trường hợp không thỏa thuận được, hai bên phải báo cáo với cơ quan chuyên môn về lao động thuộc Ủy ban nhân dân cấp tỉnh. Sau 30 ngày kể từ ngày báo cho cơ quan chuyên môn về lao động thuộc Ủy ban nhân dân cấp tỉnh biết, người sử dụng lao động mới có quyền quyết định. Trường hợp không nhất trí với quyết định của người sử dụng lao động thì người lao động, ban lãnh đạo của tổ chức đại diện người lao động tại cơ sở có quyền yêu cầu giải quyết tranh chấp lao động theo trình tự, thủ tục do pháp luật quy định. - 4. Phải gia hạn họp đồng lao động đã giao kết đến hết nhiệm kỳ cho người lao động là thành viên ban lãnh đạo của tổ chức đại diện người lao động tại cơ sở đang trong nhiệm kỳ mà hết hạn họp đồng lao động. - 5. Các nghĩa vụ khác theo quy định của pháp luật."", ""Những nội dung phải do thành viên quyết định theo đa số bao gồm thông qua, sửa đổi, bổ sung điều lệ của tổ chức; bầu cử, miễn nhiệm người đứng đầu và thành viên ban lãnh đạo của tổ chức; chia, tách, hợp nhất, sáp nhập, đổi tên, giải thể, liên kết tổ chức; gia nhập Công đoàn Việt Nam;\n\ng) Phí thành viên, nguồn tài sản, tài chính và việc quản lý, sử dụng tài sản, tài chính của tổ chức.\n\nViệc thu, chi tài chính của tổ chức của người lao động tại doanh nghiệp phải được theo dõi, lưu trữ và định kỳ hằng năm công khai cho thành viên của tổ chức;\n\n- h) Kiến nghị và giải quyết kiến nghị của thành viên trong nội bộ tổ chức. - 2. Chính phủ quy định chi tiết Điều này.\n\nĐiều 175. Các hành vi bị nghiêm cấm đối với người sử dụng lao động liên quan đến thành lập, gia nhập và hoạt động của tổ chức đại diện người lao động tại cơ sở"", ""## Điều 173. Ban lãnh đạo và thành viên tổ chức của người lao động tại doanh nghiệp\n\n- 1. Tại thời điểm đăng ký, tổ chức của người lao động tại doanh nghiệp phải có số lượng tối thiểu thành viên là người lao động làm việc tại doanh nghiệp theo quy định của Chính phủ. - 2. Ban lãnh đạo do thành viên của tổ chức của người lao động tại doanh nghiệp bầu. Thành viên ban lãnh đạo là người lao động Việt Nam đang làm việc tại doanh nghiệp; không đang trong thời gian bị truy cứu trách nhiệm hình sự, chấp hành hình phạt hoặc chưa được xóa án tích do phạm các tội xâm phạm an ninh quốc gia, các tội xâm phạm quyền tự do của con người, quyền tự do, dân chủ của công dân, các tội xâm phạm sở hữu theo quy định của Bộ luật Hình sự."", ""#### TỔ CHỨC ĐẠI DIỆN NGƯỜI LAO ĐỘNG TẠI CƠ SỞ\n\nĐiều 170. Quyền thành lập, gia nhập và tham gia hoạt động của tổ chức đại diện người lao động tại cơ sở\n\n- 1. Người lao động có quyền thành lập, gia nhập và hoạt động công đoàn theo quy định của Luật Công đoàn. - 2. Người lao động trong doanh nghiệp có quyền thành lập, gia nhập và tham gia hoạt động của tổ chức của người lao động tại doanh nghiệp theo quy định tại các điều 172, 173 và 174 của Bộ luật này. - 3. Các tổ chức đại diện người lao động quy định tại khoản 1 và khoản 2 Điều này bình đẳng về quyền và nghĩa vụ trong việc đại diện bảo vệ quyền và lợi ích hợp pháp, chính đáng của người lao động trong quan hệ lao động.""]",simple,1.0,0.9091,0.2235,1.0,"[""Điều 176""]"
"Theo Điều 184, nội dung quy định về hòa giải viên lao động là gì?",#### Điều 184. Hòa giải viên lao động - 1.,"Hòa giải viên lao động Hòa giải viên lao động là người do Chủ tịch Ủy ban nhân dân cấp tỉnh bổ nhiệm để hòa giải tranh chấp lao động, tranh chấp về hợp đồng đào tạo nghề; hỗ trợ phát triển quan hệ lao động. - 2.","[""#### Điều 184. Hòa giải viên lao động\n\n- 1. Hòa giải viên lao động là người do Chủ tịch Ủy ban nhân dân cấp tỉnh bổ nhiệm để hòa giải tranh chấp lao động, tranh chấp về hợp đồng đào tạo nghề; hỗ trợ phát triển quan hệ lao động. - 2. Chính phủ quy định tiêu chuẩn, trình tự, thủ tục bổ nhiệm, chế độ, điều kiện hoạt động và việc quản lý hòa giải viên lao động; thẩm quyền, trình tự, thủ tục cử hòa giải viên lao động."", ""- 1. Tranh chấp lao động cá nhân phải được giải quyết thông qua thủ tục hòa giải của hòa giải viên lao động trước khi yêu cầu Hội đồng trọng tài lao động hoặc Tòa án giải quyết, trừ các tranh chấp lao động sau đây không bắt buộc phải qua thủ tục hòa giải: - a) Về xử lý kỷ luật lao động theo hình thức sa thải hoặc về trường hợp bị đơn phương chấm dứt hợp đồng lao động; - b) Về bồi thường thiệt hại, trợ cấp khi chấm dứt hợp đồng lao động; - c) Giữa người giúp việc gia đình với người sử dụng lao động; - d) Về bảo hiểm xã hội theo quy định của pháp luật về bảo hiểm xã hội, về bảo hiểm y tế theo quy định của pháp luật về bảo hiểm y tế, về bảo hiểm thất nghiệp theo quy định của pháp luật về việc làm, về bảo hiểm tai nạn lao động, bệnh nghề nghiệp theo quy định của pháp luật về an toàn, vệ sinh lao động; - đ) Về bồi thường thiệt hại giữa người lao động với doanh nghiệp, tổ chức đưa người lao động đi làm việc ở nước ngoài theo hợp đồng; - e) Giữa người lao động thuê lại với người sử dụng lao động thuê lại. - 2. Trong thời hạn 05 ngày làm việc kể từ ngày hòa giải viên lao động nhận được yêu cầu từ bên yêu cầu giải quyết tranh chấp hoặc từ cơ quan quy định tại khoản 3 Điều 181 của Bộ luật này, hòa giải viên lao động phải kết thúc việc hòa giải. - 3. Tại phiên họp hòa giải phải có mặt hai bên tranh chấp. Các bên tranh chấp có thể ủy quyền cho người khác tham gia phiên họp hòa giải. - 4."", ""- 1. Tranh chấp lao động cá nhân giữa người lao động với người sử dụng lao động phải thông qua thủ tục hòa giải của hòa giải viên lao động mà hòa giải thành nhưng các bên không thực hiện hoặc thực hiện không đúng, hòa giải không thành hoặc hết thời hạn hòa giải theo quy định của pháp luật về lao động mà hòa giải viên lao động không tiến hành hòa giải, trừ các tranh chấp lao động sau đây không bắt buộc phải qua thủ tục hòa giải: - a) Về xử lý kỷ luật lao động theo hình thức sa thấi hoặc về trường hợp bị đơn phương chấm dứt hợp đồng lao động; - b) Về bồi thường thiệt hại, trợ cấp khi chấm đứt hợp đồng lao động; - c) Giữa người giúp việc gia đình với người sử dụng lao động; - d) Về bảo hiểm xã hội theo quy định của pháp luật về bảo hiểm xã hội, về bảo hiểm y tế theo quy định của pháp luật về bảo hiểm y tế, về bảo hiểm thất nghiệp theo quy định của pháp luật về việc làm, về bảo hiểm tai nạn lao động, bệnh nghề nghiệp theo quy định của pháp luật về an toàn, vệ sinh lao động; - đ) Về bồi thường thiệt hại giữa người lao động với doanh nghiệp, tổ chức đưa người lao động đi làm việc ở nước ngoài theo hợp đồng; - e) Giữa người lao động thuê lại với người sử dụng lao động thuê lại. - la. Tranh chấp lao động cá nhân mà hai bên thỏa thuận lựa chọn Hội đồng trọng tài lao động giải quyết nhưng hết thời hạn theo quy định của pháp luật về lao động mà Ban trọng tài lao động không được thành"", ""lập, Ban trọng tài lao động không ra quyết định giải quyết tranh chấp hoặc một trong các bên không thì hành quyết định của Ban trọng tài lao động thì có quyền yêu cầu Tòa án giải quyết. - 1b. Tranh chấp lao động tập thể về quyền theo quy định của pháp luật về lao động đã qua thủ tục hòa giải của hòa giải viên lao động mà hòa giải không thành, hết thời hạn hòa giải theo quy định của pháp luật về lao động mà hòa giải viên lao động không tiến hành hòa giải hoặc một trong các bên không thực hiện biên bản hòa giải thành thì có quyền yêu cầu Tòa án giải quyết. - 1c. Tranh chấp lao động tập thể về quyền mà hai bên thỏa thuận lựa chọn Hội đồng trọng tài lao động giải quyết nhưng hết thời hạn theo quy định của pháp luật về lao động mà Ban trọng tài lao động không được thành lập, Ban trọng tài lao động không ra quyết định giải quyết tranh chấp hoặc một trong"", ""## Điều 192. Trình tự, thủ tục giải quyết tranh chấp lao động tập thể về quyền\n\n1. Trình tự, thủ tục hòa giải tranh chấp lao động tập thể về quyền được thực hiện theo quy định tại các khoản 2, 3, 4, 5 và 6 Điều 188 của Bộ luật này.\n\nĐối với tranh chấp quy định tại điểm b và điểm c khoản 2 Điều 179 của Bộ luật này mà xác định có hành vi vi phạm pháp luật thì hòa giải viên lao động lập biên bản và chuyển hồ sơ, tài liệu đến cơ quan có thẩm quyền xem xét, xử lý theo quy định của pháp luật.\n\n2. Trong trường hợp hòa giải không thành hoặc hết thời hạn hòa giải quy định tại khoản 2 Điều 188 của Bộ luật này mà hòa giải viên lao động không tiến hành hòa giải thì các bên tranh chấp có quyền lựa chọn một trong các phương thức sau để giải quyết tranh chấp:\n\n- a) Yêu cầu Hội đồng trọng tài lao động giải quyết theo quy định tại Điều 193 của Bộ luật này; - b) Yêu cầu Tòa án giải quyết.""]",simple,1.0,0.75,0.1654,1.0,"[""Điều 184""]"
"Theo Điều 192, nội dung quy định về trình tự, thủ tục giải quyết tranh chấp lao động tập thể về quyền là gì?",#### THẨM QUYỀN VÀ TRÌNH TỰ GIẢI QUYẾT TRANH CHẤP LAO ĐỘNG TẬP THỂ VỀ QUYỀN,"Trình tự, thủ tục giải quyết tranh chấp lao động tập thể về quyền Trình tự, thủ tục hòa giải tranh chấp lao động tập thể về quyền được thực hiện theo quy định tại các khoản 2, 3, 4, 5 và 6 Điều 188 của Bộ luật này. Đối với tranh chấp quy định tại điểm b và điểm c khoản 2 Điều 179 của Bộ luật này mà xác định có hành vi vi phạm pháp luật thì hòa giải viên lao động lập biên bản và chuyển hồ sơ, tài liệu đến cơ quan có thẩm quyền xem xét, xử lý theo quy định của pháp luật.","[""#### THẨM QUYỀN VÀ TRÌNH TỰ GIẢI QUYẾT TRANH CHẤP LAO ĐỘNG TẬP THỂ VỀ QUYỀN"", ""#### THẨM QUYỀN VÀ TRÌNH TỰ GIẢI QUYẾT TRANH CHẤP LAO ĐỘNG TẬP THỂ VỀ LỢI ÍCH"", ""#### NHỮNG QUY ĐỊNH CHUNG VỀ GIẢI QUYẾT TRANH CHẤP LAO ĐỘNG"", ""## Điều 191. Thẩm quyền giải quyết tranh chấp lao động tập thể về quyền\n\n- 1. Cơ quan, tổ chức, cá nhân có thẩm quyền giải quyết tranh chấp lao động tập thể về quyền bao gồm: - a) Hòa giải viên lao động; - b) Hội đồng trọng tài lao động; - c) Tòa án nhân dân. - 2. Tranh chấp lao động tập thể về quyền phải được giải quyết thông qua thủ tục hòa giải của hòa giải viên lao động trước khi yêu cầu Hội đồng trọng tài lao động hoặc Tòa án giải quyết."", ""## Điều 195. Thẩm quyền giải quyết tranh chấp lao động tập thể về lợi ích\n\n- 1. Tổ chức, cá nhân có thẩm quyền giải quyết tranh chấp lao động tập thể về lợi ích bao gồm: - a) Hòa giải viên lao động; - b) Hội đồng trọng tài lao động. - 2. Tranh chấp lao động tập thể về lợi ích phải được giải quyết thông qua thủ tục hòa giải của hòa giải viên lao động trước khi yêu cầu Hội đồng trọng tài lao động giải quyết hoặc tiến hành thủ tục đình công.""]",simple,1.0,1.0,0.4,0.4848,"[""Điều 192""]"
"Theo Điều 200, nội dung quy định về trình tự đình công là gì?",#### Điều 200. Trình tự đình công - 1.,Trình tự đình công Lấy ý kiến về đình công theo quy định tại Điều 201 của Bộ luật này. - 2.,"[""#### Điều 200. Trình tự đình công\n\n- 1. Lấy ý kiến về đình công theo quy định tại Điều 201 của Bộ luật này. - 2. Ra quyết định đình công và thông báo đình công theo quy định tại Điều 202 của Bộ luật này. - 3. Tiến hành đình công."", ""## Điều 204. Trường hợp đình công bất hợp pháp\n\n- 1. Không thuộc trường hợp được đình công quy định tại Điều 199 của Bộ luật này. - 2. Không do tổ chức đại diện người lao động có quyền tổ chức và lãnh đạo đình công. - 3. Vi phạm các quy định về trình tự, thủ tục tiến hành đình công theo quy định của Bộ luật này. - 4. Khi tranh chấp lao động tập thể đang được cơ quan, tổ chức, cá nhân có thẩm quyền giải quyết theo quy định của Bộ luật này. - 5. Tiến hành đình công trường hợp không được đình công quy định tại Điều 209 của Bộ luật này. - 6. Khi đã có quyết định hoãn hoặc ngừng đình công của cơ quan có thẩm quyền theo quy định tại Điều 210 của Bộ luật này."", ""## Điều 202. Quyết định đình công và thông báo thời điểm bắt đầu đình công\n\n- 1. Khi có trên 50% số người được lấy ý kiến đồng ý với nội dung lấy ý kiến đình công theo quy định tại khoản 2 Điều 201 của Bộ luật này thì tổ chức đại diện người lao động ra quyết định đình công bằng văn bản. - 2. Quyết định đình công phải có các nội dung sau đây: - a) Kết quả lấy ý kiến đình công; - b) Thời điểm bắt đầu đình công, địa điểm đình công; - c) Phạm vi tiến hành đình công; - d) Yêu cầu của người lao động; - đ) Họ tên, địa chỉ liên hệ của người đại diện cho tổ chức đại diện người lao động tổ chức và lãnh đạo đình công. - 3. Ít nhất là 05 ngày làm việc trước ngày bắt đầu đình công, tổ chức đại diện người lao động tổ chức và lãnh đạo đình công phải gửi văn bản về việc quyết định đình công cho người sử dụng lao động, Ủy ban nhân dân cấp huyện và cơ quan chuyên môn về lao động thuộc Ủy ban nhân dân cấp tỉnh. - 4. Đến thời điểm bắt đầu đình công, nếu người sử dụng lao động vẫn không chấp nhận giải quyết yêu cầu của người lao động thì tổ chức đại diện người lao động tổ chức và lãnh đạo đình công."", ""## Điều 203. Quyền của các bên trước và trong quá trình đình công\n\n1. Tiếp tục thỏa thuận để giải quyết nội dung tranh chấp lao động tập thể hoặc cùng đề nghị hòa giải viên lao động, Hội đồng trọng tài lao động tiến hành hòa giải, giải quyết tranh chấp lao động.\n\n- 2. Tổ chức đại diện người lao động có quyền tổ chức và lãnh đạo đình công theo quy định tại Điều 198 của Bộ luật này có quyền sau đây: - a) Rút quyết định đình công nếu chưa đình công hoặc chấm dứt đình công nếu đang đình công; - b) Yêu cầu Tòa án tuyên bố cuộc đình công là hợp pháp. - 3. Người sử dụng lao động có quyền sau đây: - a) Chấp nhận toàn bộ hoặc một phần yêu cầu và thông báo bằng văn bản cho tổ chức đại diện người lao động đang tổ chức và lãnh đạo đình công; - b) Đóng cửa tạm thời nơi làm việc trong thời gian đình công do không đủ điều kiện để duy trì hoạt động bình thường hoặc để bảo vệ tài sản; - c) Yêu cầu Tòa án tuyên bố cuộc đình công là bất hợp pháp."", ""#### Điều 210. Quyết định hoãn, ngừng đình công\n\n- 1. Khi xét thấy cuộc đình công có nguy cơ gây thiệt hại nghiêm trọng cho nền kinh tế quốc dân, lợi ích công cộng, đe dọa đến quốc phòng, an ninh, trật tự công cộng, sức khỏe của con người thì Chủ tịch Ủy ban nhân dân cấp tỉnh quyết đinh hoãn hoặc ngừng đình công. - 2. Chính phủ quy định chi tiết việc hoãn, ngừng đình công và giải quyết quyền lợi của người lao động.""]",simple,1.0,0.75,0.0548,1.0,"[""Điều 200""]"
"Theo Điều 54, quy định cụ thể về doanh là bao nhiêu hoặc như thế nào?",## Điều 84. Mở rộng phạm vi áp dụng của thỏa ước lao động tập thể ngành hoặc thỏa ước lao động tập thể có nhiều doanh nghiệp - 1.,Doanh nghiệp cho thuê lại lao động Doanh nghiệp cho thuê lại lao động phải ký quỹ và được cấp Giấy phép hoạt động cho thuê lại lao động. - 2.,"[""## Điều 84. Mở rộng phạm vi áp dụng của thỏa ước lao động tập thể ngành hoặc thỏa ước lao động tập thể có nhiều doanh nghiệp\n\n- 1. Khi một thỏa ước lao động tập thể ngành hoặc thỏa ước lao động tập thể có nhiều doanh nghiệp có phạm vi áp dụng chiếm trên 75% người lao động hoặc trên 75% doanh nghiệp cùng ngành, nghề, lĩnh vực trong khu công nghiệp, khu kinh tế, khu chế xuất, khu công nghệ cao thì người sử dụng lao động hoặc tổ chức đại diện của người lao động tại đó đề nghị cơ quan nhà nước có thẩm quyền quyết định mở rộng phạm vi áp dụng một phần hoặc toàn bộ thỏa ước đó đối với các doanh nghiệp cùng ngành, nghề, lĩnh vực trong khu công nghiệp, khu kinh tế, khu chế xuất, khu công nghệ cao. - 2. Chính phủ quy định chi tiết khoản 1 Điều này; quy định trình tự, thủ tục và thẩm quyền quyết định mở rộng phạm vi áp dụng thỏa ước lao động tập thể quy định tại khoản 1 Điều này."", ""#### Điều 117. Kỷ luật lao động\n\nKỷ luật lao động là những quy định về việc tuân theo thời gian, công nghệ và điều hành sản xuất, kinh doanh do người sử dụng lao động ban hành trong nội quy lao động và do pháp luật quy định."", ""## Điều 68. Quyền thương lượng tập thể của tổ chức đại diện người lao động tại cơ sở trong doanh nghiệp\n\n- 1. Tổ chức đại diện người lao động tại cơ sở có quyền yêu cầu thương lượng tập thể khi đạt tỷ lệ thành viên tối thiểu trên tổng số người lao động trong doanh nghiệp theo quy định của Chính phủ. - 2. Trường hợp doanh nghiệp có nhiều tổ chức đại diện người lao động tại cơ sở đáp ứng quy định tại khoản 1 Điều này thì tổ chức có quyền yêu cầu thương lượng là tổ chức có số thành viên nhiều nhất trong doanh nghiệp. Các tổ chức đại diện người lao động tại cơ sở khác có thể tham gia thương lượng tập thể khi được tổ chức đại diện người lao động có quyền yêu cầu thương lượng tập thể đồng ý. - 3. Trường hợp doanh nghiệp có nhiều tổ chức đại diện người lao động tại cơ sở mà không có tổ chức nào đáp ứng quy định tại khoản 1 Điều này thì các tổ chức có quyền tự nguyện kết hợp với nhau để yêu cầu thương lượng tập thể nhưng tổng số thành viên của các tổ chức này phải đạt tỷ lệ tối thiểu theo quy định tại khoản 1 Điều này. - 4. Chính phủ quy định việc giải quyết tranh chấp giữa các bên liên quan đến quyền thương lượng tập thể."", ""Khi hết thời hạn quy định tại khoản 2 Điều này mà Ban trọng tài lao động không được thành lập hoặc hết thời hạn quy định tại khoản 3 Điều này mà Ban trọng tài không ra quyết định giải quyết tranh chấp hoặc người sử dụng lao động là bên tranh chấp không thực hiện quyết định giải quyết tranh chấp của Ban trọng tài lao động thì tổ chức đại diện người lao động là bên tranh chấp có quyền tiến hành thủ tục quy định tại các điều 200, 201 và 202 của Bộ luật này để đình công."", ""## Điều 72. Thương lượng tập thể ngành, thương lượng tập thể có nhiều doanh nghiệp tham gia\n\n- 1. Nguyên tắc, nội dung thương lượng tập thể ngành, thương lượng tập thể có nhiều doanh nghiệp tham gia thực hiện theo quy định tại Điều 66 và Điều 67 của Bộ luật này. - 2. Quy trình tiến hành thương lượng tập thể ngành, thương lượng tập thể có nhiều doanh nghiệp tham gia do các bên thỏa thuận quyết định, bao gồm cả việc thỏa thuận tiến hành thương lượng tập thể thông qua Hội đồng thương lượng tập thể quy định tại Điều 73 của Bộ luật này. - 3. Trường hợp thương lượng tập thể ngành thì đại diện thương lượng là tổ chức công đoàn ngành và tổ chức đại diện người sử dụng lao động cấp ngành quyết định.\n\nTrường hợp thương lượng tập thể có nhiều doanh nghiệp tham gia thì đại diện thương lượng do các bên thương lượng quyết định trên cơ sở tự nguyện, thỏa thuân.""]",reasoning,1.0,0.1818,0.0364,0.4,"[""Điều 54""]"
"Theo Điều 55, quy định cụ thể về hợp là bao nhiêu hoặc như thế nào?",## Điều 204. Trường hợp đình công bất hợp pháp - 1.,"Hợp đồng cho thuê lại lao động Doanh nghiệp cho thuê lại lao động và bên thuê lại lao động phải ký kết hợp đồng cho thuê lại lao động bằng văn bản và được làm thành 02 bản, mỗi bên giữ 01 bản. - 2.","[""## Điều 204. Trường hợp đình công bất hợp pháp\n\n- 1. Không thuộc trường hợp được đình công quy định tại Điều 199 của Bộ luật này. - 2. Không do tổ chức đại diện người lao động có quyền tổ chức và lãnh đạo đình công. - 3. Vi phạm các quy định về trình tự, thủ tục tiến hành đình công theo quy định của Bộ luật này. - 4. Khi tranh chấp lao động tập thể đang được cơ quan, tổ chức, cá nhân có thẩm quyền giải quyết theo quy định của Bộ luật này. - 5. Tiến hành đình công trường hợp không được đình công quy định tại Điều 209 của Bộ luật này. - 6. Khi đã có quyết định hoãn hoặc ngừng đình công của cơ quan có thẩm quyền theo quy định tại Điều 210 của Bộ luật này."", ""## Điều 68. Quyền thương lượng tập thể của tổ chức đại diện người lao động tại cơ sở trong doanh nghiệp\n\n- 1. Tổ chức đại diện người lao động tại cơ sở có quyền yêu cầu thương lượng tập thể khi đạt tỷ lệ thành viên tối thiểu trên tổng số người lao động trong doanh nghiệp theo quy định của Chính phủ. - 2. Trường hợp doanh nghiệp có nhiều tổ chức đại diện người lao động tại cơ sở đáp ứng quy định tại khoản 1 Điều này thì tổ chức có quyền yêu cầu thương lượng là tổ chức có số thành viên nhiều nhất trong doanh nghiệp. Các tổ chức đại diện người lao động tại cơ sở khác có thể tham gia thương lượng tập thể khi được tổ chức đại diện người lao động có quyền yêu cầu thương lượng tập thể đồng ý. - 3. Trường hợp doanh nghiệp có nhiều tổ chức đại diện người lao động tại cơ sở mà không có tổ chức nào đáp ứng quy định tại khoản 1 Điều này thì các tổ chức có quyền tự nguyện kết hợp với nhau để yêu cầu thương lượng tập thể nhưng tổng số thành viên của các tổ chức này phải đạt tỷ lệ tối thiểu theo quy định tại khoản 1 Điều này. - 4. Chính phủ quy định việc giải quyết tranh chấp giữa các bên liên quan đến quyền thương lượng tập thể."", ""### Điều 65. Thương lượng tập thể\n\nThương lượng tập thể là việc đàm phán, thỏa thuận giữa một bên là một hoặc nhiều tổ chức đại diện người lao động với một bên là một hoặc nhiều người sử dụng lao động hoặc tổ chức đại diện người sử dụng lao động nhằm xác lập điều kiện lao động, quy định về mối quan hệ giữa các bên và xây dựng quan hệ lao động tiến bộ, hài hòa và ổn định."", ""### Điều 131. Khiếu nại về kỷ luật lao động, trách nhiệm vật chất\n\nNgười bị xử lý kỷ luật lao động, bị tạm đình chỉ công việc hoặc phải bồi thường theo chế độ trách nhiệm vật chất nếu thấy không thỏa đáng có quyền khiếu nại với người sử dụng lao động, với cơ quan có thẩm quyền theo quy định của pháp luật hoặc yêu cầu giải quyết tranh chấp lao động theo trình tự do pháp luật quy định.\n\nChính phủ quy định chi tiết Điều này."", ""## Điều 72. Thương lượng tập thể ngành, thương lượng tập thể có nhiều doanh nghiệp tham gia\n\n- 1. Nguyên tắc, nội dung thương lượng tập thể ngành, thương lượng tập thể có nhiều doanh nghiệp tham gia thực hiện theo quy định tại Điều 66 và Điều 67 của Bộ luật này. - 2. Quy trình tiến hành thương lượng tập thể ngành, thương lượng tập thể có nhiều doanh nghiệp tham gia do các bên thỏa thuận quyết định, bao gồm cả việc thỏa thuận tiến hành thương lượng tập thể thông qua Hội đồng thương lượng tập thể quy định tại Điều 73 của Bộ luật này. - 3. Trường hợp thương lượng tập thể ngành thì đại diện thương lượng là tổ chức công đoàn ngành và tổ chức đại diện người sử dụng lao động cấp ngành quyết định.\n\nTrường hợp thương lượng tập thể có nhiều doanh nghiệp tham gia thì đại diện thương lượng do các bên thương lượng quyết định trên cơ sở tự nguyện, thỏa thuân.""]",reasoning,1.0,0.1429,0.0696,0.5333,"[""Điều 55""]"
"Theo Điều 169, quy định cụ thể về tuổi là bao nhiêu hoặc như thế nào?",#### Điều 200. Trình tự đình công - 1.,Tuổi nghỉ hưu Người lao động bảo đảm điều kiện về thời gian đóng bảo hiểm xã hội theo quy định của pháp luật về bảo hiểm xã hội được hưởng lương hưu khi đủ tuổi nghỉ hưu. - 2.,"[""#### Điều 200. Trình tự đình công\n\n- 1. Lấy ý kiến về đình công theo quy định tại Điều 201 của Bộ luật này. - 2. Ra quyết định đình công và thông báo đình công theo quy định tại Điều 202 của Bộ luật này. - 3. Tiến hành đình công."", ""## Điều 204. Trường hợp đình công bất hợp pháp\n\n- 1. Không thuộc trường hợp được đình công quy định tại Điều 199 của Bộ luật này. - 2. Không do tổ chức đại diện người lao động có quyền tổ chức và lãnh đạo đình công. - 3. Vi phạm các quy định về trình tự, thủ tục tiến hành đình công theo quy định của Bộ luật này. - 4. Khi tranh chấp lao động tập thể đang được cơ quan, tổ chức, cá nhân có thẩm quyền giải quyết theo quy định của Bộ luật này. - 5. Tiến hành đình công trường hợp không được đình công quy định tại Điều 209 của Bộ luật này. - 6. Khi đã có quyết định hoãn hoặc ngừng đình công của cơ quan có thẩm quyền theo quy định tại Điều 210 của Bộ luật này."", ""### Điều 65. Thương lượng tập thể\n\nThương lượng tập thể là việc đàm phán, thỏa thuận giữa một bên là một hoặc nhiều tổ chức đại diện người lao động với một bên là một hoặc nhiều người sử dụng lao động hoặc tổ chức đại diện người sử dụng lao động nhằm xác lập điều kiện lao động, quy định về mối quan hệ giữa các bên và xây dựng quan hệ lao động tiến bộ, hài hòa và ổn định."", ""## Điều 84. Mở rộng phạm vi áp dụng của thỏa ước lao động tập thể ngành hoặc thỏa ước lao động tập thể có nhiều doanh nghiệp\n\n- 1. Khi một thỏa ước lao động tập thể ngành hoặc thỏa ước lao động tập thể có nhiều doanh nghiệp có phạm vi áp dụng chiếm trên 75% người lao động hoặc trên 75% doanh nghiệp cùng ngành, nghề, lĩnh vực trong khu công nghiệp, khu kinh tế, khu chế xuất, khu công nghệ cao thì người sử dụng lao động hoặc tổ chức đại diện của người lao động tại đó đề nghị cơ quan nhà nước có thẩm quyền quyết định mở rộng phạm vi áp dụng một phần hoặc toàn bộ thỏa ước đó đối với các doanh nghiệp cùng ngành, nghề, lĩnh vực trong khu công nghiệp, khu kinh tế, khu chế xuất, khu công nghệ cao. - 2. Chính phủ quy định chi tiết khoản 1 Điều này; quy định trình tự, thủ tục và thẩm quyền quyết định mở rộng phạm vi áp dụng thỏa ước lao động tập thể quy định tại khoản 1 Điều này."", ""độc hại, nguy hiểm hoặc đặc biệt nặng nhọc, độc hại, nguy hiểm thuộc danh mục do Bộ Lao động - Thương binh và Xã hội ban hành hoặc có đủ 15 năm làm việc ở vùng có điều kiện kinh tế - xã hội đặc biệt khó khăn bao gồm cả thời gian làm việc ở nơi có phụ cấp khu vực hệ số 0,7 trở lên trước ngày 01 tháng 01 năm 2021;\n\n- c) Người bị nhiễm HIV do tai nạn rửi ro nghề nghiệp trong khi thực hiện nhiệm vụ được giao. - 3. Lao động nữ là cán bộ, công chức cấp xã hoặc là người hoạt động không chuyên trách ở xã, phường, thị trấn tham gia bảo hiểm xã hội khi nghỉ việc mà có từ đủ 15 năm đến dưới 20 năm đóng bảo hiểm xã hội và đủ tuổi nghỉ hưu quy định tại khoản 2 Điều 169 của Bộ luật Lao động thì được hưởng lương hưu. - 4. Điều kiện về tuổi hưởng lương hưu đối với một số trường hợp đặc biệt theo quy định của Chính phủ.\""; - b) Sửa đổi, bổ sung Điều 55 như sau:""]",reasoning,1.0,0.0,0.0921,0.9333,"[""Điều 169""]"
"Theo Điều 36, quy định cụ thể về quyền là bao nhiêu hoặc như thế nào?",## Điều 204. Trường hợp đình công bất hợp pháp - 1.,"Quyền đơn phương chấm dứt hợp đồng lao động của người sử dụng lao động Người sử dụng lao động có quyền đơn phương chấm dứt hợp đồng lao động trong trường hợp sau đây: - a) Người lao động thường xuyên không hoàn thành công việc theo hợp đồng lao động được xác định theo tiêu chí đánh giá mức độ hoàn thành công việc trong quy chế của người sử dụng lao động. Quy chế đánh giá mức độ hoàn thành công việc do người sử dụng lao động ban hành nhưng phải tham khảo ý kiến tổ chức đại diện người lao động tại cơ sở đối với nơi có tổ chức đại diện người lao động tại cơ sở; - b) Người lao động bị ốm đau, tai nạn đã điều trị 12 tháng liên tục đối với người làm việc theo hợp đồng lao động không xác định thời hạn hoặc đã điều trị 06 tháng liên tục đối với người làm việc theo hợp đồng lao động xác định thời hạn có thời hạn từ 12 tháng đến 36 tháng hoặc quá nửa thời hạn hợp đồng lao động đối với người làm việc theo hợp đồng lao động xác định thời hạn có thời hạn dưới 12 tháng mà khả năng lao động chưa hồi phục.","[""## Điều 204. Trường hợp đình công bất hợp pháp\n\n- 1. Không thuộc trường hợp được đình công quy định tại Điều 199 của Bộ luật này. - 2. Không do tổ chức đại diện người lao động có quyền tổ chức và lãnh đạo đình công. - 3. Vi phạm các quy định về trình tự, thủ tục tiến hành đình công theo quy định của Bộ luật này. - 4. Khi tranh chấp lao động tập thể đang được cơ quan, tổ chức, cá nhân có thẩm quyền giải quyết theo quy định của Bộ luật này. - 5. Tiến hành đình công trường hợp không được đình công quy định tại Điều 209 của Bộ luật này. - 6. Khi đã có quyết định hoãn hoặc ngừng đình công của cơ quan có thẩm quyền theo quy định tại Điều 210 của Bộ luật này."", ""### Điều 131. Khiếu nại về kỷ luật lao động, trách nhiệm vật chất\n\nNgười bị xử lý kỷ luật lao động, bị tạm đình chỉ công việc hoặc phải bồi thường theo chế độ trách nhiệm vật chất nếu thấy không thỏa đáng có quyền khiếu nại với người sử dụng lao động, với cơ quan có thẩm quyền theo quy định của pháp luật hoặc yêu cầu giải quyết tranh chấp lao động theo trình tự do pháp luật quy định.\n\nChính phủ quy định chi tiết Điều này."", ""## Điều 68. Quyền thương lượng tập thể của tổ chức đại diện người lao động tại cơ sở trong doanh nghiệp\n\n- 1. Tổ chức đại diện người lao động tại cơ sở có quyền yêu cầu thương lượng tập thể khi đạt tỷ lệ thành viên tối thiểu trên tổng số người lao động trong doanh nghiệp theo quy định của Chính phủ. - 2. Trường hợp doanh nghiệp có nhiều tổ chức đại diện người lao động tại cơ sở đáp ứng quy định tại khoản 1 Điều này thì tổ chức có quyền yêu cầu thương lượng là tổ chức có số thành viên nhiều nhất trong doanh nghiệp. Các tổ chức đại diện người lao động tại cơ sở khác có thể tham gia thương lượng tập thể khi được tổ chức đại diện người lao động có quyền yêu cầu thương lượng tập thể đồng ý. - 3. Trường hợp doanh nghiệp có nhiều tổ chức đại diện người lao động tại cơ sở mà không có tổ chức nào đáp ứng quy định tại khoản 1 Điều này thì các tổ chức có quyền tự nguyện kết hợp với nhau để yêu cầu thương lượng tập thể nhưng tổng số thành viên của các tổ chức này phải đạt tỷ lệ tối thiểu theo quy định tại khoản 1 Điều này. - 4. Chính phủ quy định việc giải quyết tranh chấp giữa các bên liên quan đến quyền thương lượng tập thể."", ""## Điều 192. Trình tự, thủ tục giải quyết tranh chấp lao động tập thể về quyền\n\n1. Trình tự, thủ tục hòa giải tranh chấp lao động tập thể về quyền được thực hiện theo quy định tại các khoản 2, 3, 4, 5 và 6 Điều 188 của Bộ luật này.\n\nĐối với tranh chấp quy định tại điểm b và điểm c khoản 2 Điều 179 của Bộ luật này mà xác định có hành vi vi phạm pháp luật thì hòa giải viên lao động lập biên bản và chuyển hồ sơ, tài liệu đến cơ quan có thẩm quyền xem xét, xử lý theo quy định của pháp luật.\n\n2. Trong trường hợp hòa giải không thành hoặc hết thời hạn hòa giải quy định tại khoản 2 Điều 188 của Bộ luật này mà hòa giải viên lao động không tiến hành hòa giải thì các bên tranh chấp có quyền lựa chọn một trong các phương thức sau để giải quyết tranh chấp:\n\n- a) Yêu cầu Hội đồng trọng tài lao động giải quyết theo quy định tại Điều 193 của Bộ luật này; - b) Yêu cầu Tòa án giải quyết."", ""## Điều 84. Mở rộng phạm vi áp dụng của thỏa ước lao động tập thể ngành hoặc thỏa ước lao động tập thể có nhiều doanh nghiệp\n\n- 1. Khi một thỏa ước lao động tập thể ngành hoặc thỏa ước lao động tập thể có nhiều doanh nghiệp có phạm vi áp dụng chiếm trên 75% người lao động hoặc trên 75% doanh nghiệp cùng ngành, nghề, lĩnh vực trong khu công nghiệp, khu kinh tế, khu chế xuất, khu công nghệ cao thì người sử dụng lao động hoặc tổ chức đại diện của người lao động tại đó đề nghị cơ quan nhà nước có thẩm quyền quyết định mở rộng phạm vi áp dụng một phần hoặc toàn bộ thỏa ước đó đối với các doanh nghiệp cùng ngành, nghề, lĩnh vực trong khu công nghiệp, khu kinh tế, khu chế xuất, khu công nghệ cao. - 2. Chính phủ quy định chi tiết khoản 1 Điều này; quy định trình tự, thủ tục và thẩm quyền quyết định mở rộng phạm vi áp dụng thỏa ước lao động tập thể quy định tại khoản 1 Điều này.""]",reasoning,1.0,0.4286,0.194,0.4815,"[""Điều 36""]"
"Theo Điều 107, quy định cụ thể về thêm là bao nhiêu hoặc như thế nào?",### Điều 107. Làm thêm giờ,"Làm thêm giờ Thời gian làm thêm giờ là khoảng thời gian làm việc ngoài thời giờ làm việc bình thường theo quy định của pháp luật, thỏa ước lao động tập thể hoặc nội quy lao động. - 2.","[""### Điều 107. Làm thêm giờ"", ""#### Điều 200. Trình tự đình công\n\n- 1. Lấy ý kiến về đình công theo quy định tại Điều 201 của Bộ luật này. - 2. Ra quyết định đình công và thông báo đình công theo quy định tại Điều 202 của Bộ luật này. - 3. Tiến hành đình công."", ""## Điều 204. Trường hợp đình công bất hợp pháp\n\n- 1. Không thuộc trường hợp được đình công quy định tại Điều 199 của Bộ luật này. - 2. Không do tổ chức đại diện người lao động có quyền tổ chức và lãnh đạo đình công. - 3. Vi phạm các quy định về trình tự, thủ tục tiến hành đình công theo quy định của Bộ luật này. - 4. Khi tranh chấp lao động tập thể đang được cơ quan, tổ chức, cá nhân có thẩm quyền giải quyết theo quy định của Bộ luật này. - 5. Tiến hành đình công trường hợp không được đình công quy định tại Điều 209 của Bộ luật này. - 6. Khi đã có quyết định hoãn hoặc ngừng đình công của cơ quan có thẩm quyền theo quy định tại Điều 210 của Bộ luật này."", ""### Điều 65. Thương lượng tập thể\n\nThương lượng tập thể là việc đàm phán, thỏa thuận giữa một bên là một hoặc nhiều tổ chức đại diện người lao động với một bên là một hoặc nhiều người sử dụng lao động hoặc tổ chức đại diện người sử dụng lao động nhằm xác lập điều kiện lao động, quy định về mối quan hệ giữa các bên và xây dựng quan hệ lao động tiến bộ, hài hòa và ổn định."", ""## Điều 84. Mở rộng phạm vi áp dụng của thỏa ước lao động tập thể ngành hoặc thỏa ước lao động tập thể có nhiều doanh nghiệp\n\n- 1. Khi một thỏa ước lao động tập thể ngành hoặc thỏa ước lao động tập thể có nhiều doanh nghiệp có phạm vi áp dụng chiếm trên 75% người lao động hoặc trên 75% doanh nghiệp cùng ngành, nghề, lĩnh vực trong khu công nghiệp, khu kinh tế, khu chế xuất, khu công nghệ cao thì người sử dụng lao động hoặc tổ chức đại diện của người lao động tại đó đề nghị cơ quan nhà nước có thẩm quyền quyết định mở rộng phạm vi áp dụng một phần hoặc toàn bộ thỏa ước đó đối với các doanh nghiệp cùng ngành, nghề, lĩnh vực trong khu công nghiệp, khu kinh tế, khu chế xuất, khu công nghệ cao. - 2. Chính phủ quy định chi tiết khoản 1 Điều này; quy định trình tự, thủ tục và thẩm quyền quyết định mở rộng phạm vi áp dụng thỏa ước lao động tập thể quy định tại khoản 1 Điều này.""]",reasoning,1.0,0.6667,0.0957,0.5625,"[""Điều 107""]"
"Theo Điều 35, quy định cụ thể về quyền là bao nhiêu hoặc như thế nào?",## Điều 204. Trường hợp đình công bất hợp pháp - 1.,"Quyền đơn phương chấm dứt hợp đồng lao động của người lao động Người lao động có quyền đơn phương chấm dứt hợp đồng lao động nhưng phải báo trước cho người sử dụng lao động như sau: - a) Ít nhất 45 ngày nếu làm việc theo họp đồng lao động không xác định thời hạn; - b) Ít nhất 30 ngày nếu làm việc theo hợp đồng lao động xác định thời hạn có thời hạn từ 12 tháng đến 36 tháng; - c) Ít nhất 03 ngày làm việc nếu làm việc theo hợp đồng lao động xác định thời hạn có thời hạn dưới 12 tháng; - d) Đối với một số ngành, nghề, công việc đặc thù thì thời hạn báo trước được thực hiện theo quy định của Chính phủ. - 2.","[""## Điều 204. Trường hợp đình công bất hợp pháp\n\n- 1. Không thuộc trường hợp được đình công quy định tại Điều 199 của Bộ luật này. - 2. Không do tổ chức đại diện người lao động có quyền tổ chức và lãnh đạo đình công. - 3. Vi phạm các quy định về trình tự, thủ tục tiến hành đình công theo quy định của Bộ luật này. - 4. Khi tranh chấp lao động tập thể đang được cơ quan, tổ chức, cá nhân có thẩm quyền giải quyết theo quy định của Bộ luật này. - 5. Tiến hành đình công trường hợp không được đình công quy định tại Điều 209 của Bộ luật này. - 6. Khi đã có quyết định hoãn hoặc ngừng đình công của cơ quan có thẩm quyền theo quy định tại Điều 210 của Bộ luật này."", ""### Điều 131. Khiếu nại về kỷ luật lao động, trách nhiệm vật chất\n\nNgười bị xử lý kỷ luật lao động, bị tạm đình chỉ công việc hoặc phải bồi thường theo chế độ trách nhiệm vật chất nếu thấy không thỏa đáng có quyền khiếu nại với người sử dụng lao động, với cơ quan có thẩm quyền theo quy định của pháp luật hoặc yêu cầu giải quyết tranh chấp lao động theo trình tự do pháp luật quy định.\n\nChính phủ quy định chi tiết Điều này."", ""## Điều 68. Quyền thương lượng tập thể của tổ chức đại diện người lao động tại cơ sở trong doanh nghiệp\n\n- 1. Tổ chức đại diện người lao động tại cơ sở có quyền yêu cầu thương lượng tập thể khi đạt tỷ lệ thành viên tối thiểu trên tổng số người lao động trong doanh nghiệp theo quy định của Chính phủ. - 2. Trường hợp doanh nghiệp có nhiều tổ chức đại diện người lao động tại cơ sở đáp ứng quy định tại khoản 1 Điều này thì tổ chức có quyền yêu cầu thương lượng là tổ chức có số thành viên nhiều nhất trong doanh nghiệp. Các tổ chức đại diện người lao động tại cơ sở khác có thể tham gia thương lượng tập thể khi được tổ chức đại diện người lao động có quyền yêu cầu thương lượng tập thể đồng ý. - 3. Trường hợp doanh nghiệp có nhiều tổ chức đại diện người lao động tại cơ sở mà không có tổ chức nào đáp ứng quy định tại khoản 1 Điều này thì các tổ chức có quyền tự nguyện kết hợp với nhau để yêu cầu thương lượng tập thể nhưng tổng số thành viên của các tổ chức này phải đạt tỷ lệ tối thiểu theo quy định tại khoản 1 Điều này. - 4. Chính phủ quy định việc giải quyết tranh chấp giữa các bên liên quan đến quyền thương lượng tập thể."", ""## Điều 192. Trình tự, thủ tục giải quyết tranh chấp lao động tập thể về quyền\n\n1. Trình tự, thủ tục hòa giải tranh chấp lao động tập thể về quyền được thực hiện theo quy định tại các khoản 2, 3, 4, 5 và 6 Điều 188 của Bộ luật này.\n\nĐối với tranh chấp quy định tại điểm b và điểm c khoản 2 Điều 179 của Bộ luật này mà xác định có hành vi vi phạm pháp luật thì hòa giải viên lao động lập biên bản và chuyển hồ sơ, tài liệu đến cơ quan có thẩm quyền xem xét, xử lý theo quy định của pháp luật.\n\n2. Trong trường hợp hòa giải không thành hoặc hết thời hạn hòa giải quy định tại khoản 2 Điều 188 của Bộ luật này mà hòa giải viên lao động không tiến hành hòa giải thì các bên tranh chấp có quyền lựa chọn một trong các phương thức sau để giải quyết tranh chấp:\n\n- a) Yêu cầu Hội đồng trọng tài lao động giải quyết theo quy định tại Điều 193 của Bộ luật này; - b) Yêu cầu Tòa án giải quyết."", ""## Điều 84. Mở rộng phạm vi áp dụng của thỏa ước lao động tập thể ngành hoặc thỏa ước lao động tập thể có nhiều doanh nghiệp\n\n- 1. Khi một thỏa ước lao động tập thể ngành hoặc thỏa ước lao động tập thể có nhiều doanh nghiệp có phạm vi áp dụng chiếm trên 75% người lao động hoặc trên 75% doanh nghiệp cùng ngành, nghề, lĩnh vực trong khu công nghiệp, khu kinh tế, khu chế xuất, khu công nghệ cao thì người sử dụng lao động hoặc tổ chức đại diện của người lao động tại đó đề nghị cơ quan nhà nước có thẩm quyền quyết định mở rộng phạm vi áp dụng một phần hoặc toàn bộ thỏa ước đó đối với các doanh nghiệp cùng ngành, nghề, lĩnh vực trong khu công nghiệp, khu kinh tế, khu chế xuất, khu công nghệ cao. - 2. Chính phủ quy định chi tiết khoản 1 Điều này; quy định trình tự, thủ tục và thẩm quyền quyết định mở rộng phạm vi áp dụng thỏa ước lao động tập thể quy định tại khoản 1 Điều này.""]",reasoning,1.0,0.2857,0.1343,0.6,"[""Điều 35""]"
"Theo Điều 185, quy định cụ thể về hội là bao nhiêu hoặc như thế nào?","độc hại, nguy hiểm hoặc đặc biệt nặng nhọc, độc hại, nguy hiểm thuộc danh mục do Bộ Lao động - Thương binh và Xã hội ban hành hoặc có đủ 15 năm làm việc ở vùng có điều kiện kinh tế - xã hội đặc biệt khó khăn bao gồm cả thời gian làm việc ở nơi có phụ cấp khu vực hệ số 0,7 trở lên trước ngày 01 tháng 01 năm 2021; - c) Người bị nhiễm HIV do tai nạn rửi ro nghề nghiệp trong khi thực hiện nhiệm vụ được giao. - 3.","Hội đồng trọng tài lao động Chủ tịch Ủy ban nhân dân cấp tỉnh quyết định thành lập Hội đồng trọng tài lao động, bổ nhiệm Chủ tịch, thư ký và các trọng tài viên lao động của Hội đồng trọng tài lao động. Nhiệm kỳ của Hội đồng trọng tài lao động là 05 năm.","[""độc hại, nguy hiểm hoặc đặc biệt nặng nhọc, độc hại, nguy hiểm thuộc danh mục do Bộ Lao động - Thương binh và Xã hội ban hành hoặc có đủ 15 năm làm việc ở vùng có điều kiện kinh tế - xã hội đặc biệt khó khăn bao gồm cả thời gian làm việc ở nơi có phụ cấp khu vực hệ số 0,7 trở lên trước ngày 01 tháng 01 năm 2021;\n\n- c) Người bị nhiễm HIV do tai nạn rửi ro nghề nghiệp trong khi thực hiện nhiệm vụ được giao. - 3. Lao động nữ là cán bộ, công chức cấp xã hoặc là người hoạt động không chuyên trách ở xã, phường, thị trấn tham gia bảo hiểm xã hội khi nghỉ việc mà có từ đủ 15 năm đến dưới 20 năm đóng bảo hiểm xã hội và đủ tuổi nghỉ hưu quy định tại khoản 2 Điều 169 của Bộ luật Lao động thì được hưởng lương hưu. - 4. Điều kiện về tuổi hưởng lương hưu đối với một số trường hợp đặc biệt theo quy định của Chính phủ.\""; - b) Sửa đổi, bổ sung Điều 55 như sau:"", ""#### Điều 200. Trình tự đình công\n\n- 1. Lấy ý kiến về đình công theo quy định tại Điều 201 của Bộ luật này. - 2. Ra quyết định đình công và thông báo đình công theo quy định tại Điều 202 của Bộ luật này. - 3. Tiến hành đình công."", ""## Điều 204. Trường hợp đình công bất hợp pháp\n\n- 1. Không thuộc trường hợp được đình công quy định tại Điều 199 của Bộ luật này. - 2. Không do tổ chức đại diện người lao động có quyền tổ chức và lãnh đạo đình công. - 3. Vi phạm các quy định về trình tự, thủ tục tiến hành đình công theo quy định của Bộ luật này. - 4. Khi tranh chấp lao động tập thể đang được cơ quan, tổ chức, cá nhân có thẩm quyền giải quyết theo quy định của Bộ luật này. - 5. Tiến hành đình công trường hợp không được đình công quy định tại Điều 209 của Bộ luật này. - 6. Khi đã có quyết định hoãn hoặc ngừng đình công của cơ quan có thẩm quyền theo quy định tại Điều 210 của Bộ luật này."", ""### Điều 65. Thương lượng tập thể\n\nThương lượng tập thể là việc đàm phán, thỏa thuận giữa một bên là một hoặc nhiều tổ chức đại diện người lao động với một bên là một hoặc nhiều người sử dụng lao động hoặc tổ chức đại diện người sử dụng lao động nhằm xác lập điều kiện lao động, quy định về mối quan hệ giữa các bên và xây dựng quan hệ lao động tiến bộ, hài hòa và ổn định."", ""## Điều 84. Mở rộng phạm vi áp dụng của thỏa ước lao động tập thể ngành hoặc thỏa ước lao động tập thể có nhiều doanh nghiệp\n\n- 1. Khi một thỏa ước lao động tập thể ngành hoặc thỏa ước lao động tập thể có nhiều doanh nghiệp có phạm vi áp dụng chiếm trên 75% người lao động hoặc trên 75% doanh nghiệp cùng ngành, nghề, lĩnh vực trong khu công nghiệp, khu kinh tế, khu chế xuất, khu công nghệ cao thì người sử dụng lao động hoặc tổ chức đại diện của người lao động tại đó đề nghị cơ quan nhà nước có thẩm quyền quyết định mở rộng phạm vi áp dụng một phần hoặc toàn bộ thỏa ước đó đối với các doanh nghiệp cùng ngành, nghề, lĩnh vực trong khu công nghiệp, khu kinh tế, khu chế xuất, khu công nghệ cao. - 2. Chính phủ quy định chi tiết khoản 1 Điều này; quy định trình tự, thủ tục và thẩm quyền quyết định mở rộng phạm vi áp dụng thỏa ước lao động tập thể quy định tại khoản 1 Điều này.""]",reasoning,1.0,0.1064,0.0526,0.4444,"[""Điều 185""]"
"Theo Điều 188, trong trường hợp nào trình được áp dụng?",## Điều 34. Các trường hợp chấm dứt hợp đồng lao động,"Trình tự, thủ tục hòa giải tranh chấp lao động cá nhân của hòa giải viên lao động Tranh chấp lao động cá nhân phải được giải quyết thông qua thủ tục hòa giải của hòa giải viên lao động trước khi yêu cầu Hội đồng trọng tài lao động hoặc Tòa án giải quyết, trừ các tranh chấp lao động sau đây không bắt buộc phải qua thủ tục hòa giải: - a) Về xử lý kỷ luật lao động theo hình thức sa thải hoặc về trường hợp bị đơn phương chấm dứt hợp đồng lao động; - b) Về bồi thường thiệt hại, trợ cấp khi chấm dứt hợp đồng lao động; - c) Giữa người giúp việc gia đình với người sử dụng lao động; - d) Về bảo hiểm xã hội theo quy định của pháp luật về bảo hiểm xã hội, về bảo hiểm y tế theo quy định của pháp luật về bảo hiểm y tế, về bảo hiểm thất nghiệp theo quy định của pháp luật về việc làm, về bảo hiểm tai nạn lao động, bệnh nghề nghiệp theo quy định của pháp luật về an toàn, vệ sinh lao động; - đ) Về bồi thường thiệt hại giữa người lao động với doanh nghiệp, tổ chức đưa người lao động đi làm việc ở nước ngoài theo hợp đồng; - e) Giữa người lao động thuê lại với người sử dụng lao động thuê lại. - 2.","[""## Điều 34. Các trường hợp chấm dứt hợp đồng lao động"", ""## Điều 125. Áp dụng hình thức xử lý kỷ luật sa thải\n\nHình thức xử lý kỷ luật sa thải được người sử dụng lao động áp dụng trong trường hợp sau đây:\n\n- 1. Người lao động có hành vi trộm cắp, tham ô, đánh bạc, cố ý gây thương tích, sử dụng ma tuý tại nơi làm việc; - 2. Người lao động có hành vi tiết lộ bí mật kinh doanh, bí mật công nghệ, xâm phạm quyền sở hữu trí tuệ của người sử dụng lao động, có hành vi gây thiệt hại nghiêm trọng hoặc đe dọa gây thiệt hại đặc biệt nghiêm trọng về tài sản, lợi ích của người sử dụng lao động hoặc quấy rối tình dục tại nơi làm việc được quy định trong nội quy lao động;\n\n- 3. Người lao động bị xử lý kỷ luật kéo dài thời hạn nâng lương hoặc cách chức mà tái phạm trong thời gian chưa xóa kỷ luật. Tái phạm là trường hợp người lao động lặp lại hành vi vi phạm đã bị xử lý kỷ luật mà chưa được xóa kỷ luật theo quy định tại Điều 126 của Bộ luật này; - 4. Người lao động tự ý bỏ việc 05 ngày cộng dồn trong thời hạn 30 ngày hoặc 20 ngày cộng dồn trong thời hạn 365 ngày tính từ ngày đầu tiên tự ý bỏ việc mà không có lý do chính đáng.\n\nTrường hợp được coi là có lý do chính đáng bao gồm thiên tai, hỏa hoạn, bản thân, thân nhân bị ốm có xác nhận của cơ sở khám bệnh, chữa bệnh có thẩm quyền và trường hợp khác được quy định trong nội quy lao động."", ""- 1. Người lao động có quyền đơn phương chấm dứt hợp đồng lao động nhưng phải báo trước cho người sử dụng lao động như sau: - a) Ít nhất 45 ngày nếu làm việc theo họp đồng lao động không xác định thời hạn; - b) Ít nhất 30 ngày nếu làm việc theo hợp đồng lao động xác định thời hạn có thời hạn từ 12 tháng đến 36 tháng; - c) Ít nhất 03 ngày làm việc nếu làm việc theo hợp đồng lao động xác định thời hạn có thời hạn dưới 12 tháng; - d) Đối với một số ngành, nghề, công việc đặc thù thì thời hạn báo trước được thực hiện theo quy định của Chính phủ. - 2. Người lao động có quyền đơn phương chấm dứt hợp đồng lao động không cần báo trước trong trường hợp sau đây: - a) Không được bố trí theo đúng công việc, địa điểm làm việc hoặc không được bảo đảm điều kiện làm việc theo thỏa thuận, trừ trường hợp quy định tại Điều 29 của Bộ luật này; - b) Không được trả đủ lương hoặc trả lương không đúng thời hạn, trừ trường hợp quy định tại khoản 4 Điều 97 của Bộ luật này; - c) Bị người sử dụng lao động ngược đãi, đánh đập hoặc có lời nói, hành vi nhục mạ, hành vi làm ảnh hưởng đến sức khỏe, nhân phẩm, danh dự; bị cưỡng bức lao động; - d) Bị quấy rối tình dục tại nơi làm việc; - đ) Lao động nữ mang thai phải nghỉ việc theo quy định tại khoản 1 Điều 138 của Bộ luật này; - e) Đủ tuổi nghỉ hưu theo quy định tại Điều 169 của Bộ luật này, trừ trường hợp các bên có thỏa thuận khác; - g) Người sử dụng lao"", ""## Điều 129. Bồi thường thiệt hại\n\n1. Người lao động làm hư hỏng dụng cụ, thiết bị hoặc có hành vi khác gây thiệt hại tài sản của người sử dụng lao động thì phải bồi thường theo quy định của pháp luật hoặc nội quy lao động của người sử dụng lao động.\n\nTrường hợp người lao động gây thiệt hại không nghiêm trọng do sơ suất với giá trị không quá 10 tháng lương tối thiểu vùng do Chính phủ công bố được áp dụng tại nơi người lao động làm việc thì người lao động phải bồi thường nhiều nhất là 03 tháng tiền lương và bị khấu trừ hằng tháng vào lương theo quy định tại khoản 3 Điều 102 của Bộ luật này.\n\n2. Người lao động làm mất dụng cụ, thiết bị, tài sản của người sử dụng lao động hoặc tài sản khác do người sử dụng lao động giao hoặc tiêu hao vật tư quá định mức cho phép thì phải bồi thường thiệt hại một phần hoặc toàn bộ theo thời giá thị trường hoặc nội quy lao động; trường hợp có hợp đồng trách nhiệm thì phải bồi thường theo hợp đồng trách nhiệm; trường hợp do thiên tai, hỏa hoạn, địch họa, dịch bệnh nguy hiểm, thảm họa, sự kiện xảy ra khách quan không thể lường trước được và không thể khắc phục được mặc dù đã áp dụng mọi biện pháp cần thiết và khả năng cho phép thì không phải bồi thường."", ""### Điều 108. Làm thêm giờ trong trường hợp đặc biệt\n\nNgười sử dụng lao động có quyền yêu cầu người lao động làm thêm giờ vào bất kỳ ngày nào mà không bị giới hạn về số giờ làm thêm theo quy định tại Điều 107 của Bộ luật này và người lao động không được từ chối trong trường hợp sau đây:\n\n- 1. Thực hiện lệnh động viên, huy động bảo đảm nhiệm vụ quốc phòng, an ninh theo quy định của pháp luật; - 2. Thực hiện các công việc nhằm bảo vệ tính mạng con người, tài sản của cơ quan, tổ chức, cá nhân trong phòng ngừa, khắc phục hậu quả thiên tai, hỏa hoạn, dịch bệnh nguy hiểm và thảm họa, trừ trường hợp có nguy cơ ảnh hưởng đến tính mạng, sức khỏe của người lao động theo quy định của pháp luật về an toàn, vệ sinh lao động.""]",reasoning,1.0,1.0,0.1797,0.5909,"[""Điều 188""]"
"Theo Điều 34, trong trường hợp nào trường được áp dụng?",## Điều 34. Các trường hợp chấm dứt hợp đồng lao động,"Các trường hợp chấm dứt hợp đồng lao động Hết hạn hợp đồng lao động, trừ trường hợp quy định tại khoản 4 Điều 177 của Bộ luật này. - 2.","[""## Điều 34. Các trường hợp chấm dứt hợp đồng lao động"", ""### Điều 108. Làm thêm giờ trong trường hợp đặc biệt\n\nNgười sử dụng lao động có quyền yêu cầu người lao động làm thêm giờ vào bất kỳ ngày nào mà không bị giới hạn về số giờ làm thêm theo quy định tại Điều 107 của Bộ luật này và người lao động không được từ chối trong trường hợp sau đây:\n\n- 1. Thực hiện lệnh động viên, huy động bảo đảm nhiệm vụ quốc phòng, an ninh theo quy định của pháp luật; - 2. Thực hiện các công việc nhằm bảo vệ tính mạng con người, tài sản của cơ quan, tổ chức, cá nhân trong phòng ngừa, khắc phục hậu quả thiên tai, hỏa hoạn, dịch bệnh nguy hiểm và thảm họa, trừ trường hợp có nguy cơ ảnh hưởng đến tính mạng, sức khỏe của người lao động theo quy định của pháp luật về an toàn, vệ sinh lao động."", ""## Điều 42. Nghĩa vụ của người sử dụng lao động trong trường hợp thay đổi cơ cấu, công nghệ hoặc vì lý do kinh tế\n\n- 1. Những trường hợp sau đây được coi là thay đổi cơ cấu, công nghệ: - a) Thay đổi cơ cấu tổ chức, tổ chức lại lao động; - b) Thay đổi quy trình, công nghệ, máy móc, thiết bị sản xuất, kinh doanh gắn với ngành, nghề sản xuất, kinh doanh của người sử dụng lao động; - c) Thay đổi sản phẩm hoặc cơ cấu sản phẩm. - 2. Những trường hợp sau đây được coi là vì lý do kinh tế: - a) Khủng hoảng hoặc suy thoái kinh tế; - b) Thực hiện chính sách, pháp luật của Nhà nước khi cơ cấu lại nền kinh tế hoặc thực hiện cam kết quốc tế. - 3. Trường hợp thay đổi cơ cấu, công nghệ mà ảnh hưởng đến việc làm của nhiều người lao động thì người sử dụng lao động phải xây dựng và thực hiện phương án sử dụng lao động theo quy định tại Điều 44 của Bộ luật này; trường hợp có chỗ làm việc mới thì ưu tiên đào tạo lại người lao động để tiếp tục sử dụng. - 4. Trong trường hợp vì lý do kinh tế mà nhiều người lao động có nguy cơ mất việc làm, phải thôi việc thì người sử dụng lao động phải xây dựng và thực hiện phương án sử dụng lao động theo quy định tại Điều 44 của Bộ luật này."", ""## Điều 129. Bồi thường thiệt hại\n\n1. Người lao động làm hư hỏng dụng cụ, thiết bị hoặc có hành vi khác gây thiệt hại tài sản của người sử dụng lao động thì phải bồi thường theo quy định của pháp luật hoặc nội quy lao động của người sử dụng lao động.\n\nTrường hợp người lao động gây thiệt hại không nghiêm trọng do sơ suất với giá trị không quá 10 tháng lương tối thiểu vùng do Chính phủ công bố được áp dụng tại nơi người lao động làm việc thì người lao động phải bồi thường nhiều nhất là 03 tháng tiền lương và bị khấu trừ hằng tháng vào lương theo quy định tại khoản 3 Điều 102 của Bộ luật này.\n\n2. Người lao động làm mất dụng cụ, thiết bị, tài sản của người sử dụng lao động hoặc tài sản khác do người sử dụng lao động giao hoặc tiêu hao vật tư quá định mức cho phép thì phải bồi thường thiệt hại một phần hoặc toàn bộ theo thời giá thị trường hoặc nội quy lao động; trường hợp có hợp đồng trách nhiệm thì phải bồi thường theo hợp đồng trách nhiệm; trường hợp do thiên tai, hỏa hoạn, địch họa, dịch bệnh nguy hiểm, thảm họa, sự kiện xảy ra khách quan không thể lường trước được và không thể khắc phục được mặc dù đã áp dụng mọi biện pháp cần thiết và khả năng cho phép thì không phải bồi thường."", ""- 1. Người lao động có quyền đơn phương chấm dứt hợp đồng lao động nhưng phải báo trước cho người sử dụng lao động như sau: - a) Ít nhất 45 ngày nếu làm việc theo họp đồng lao động không xác định thời hạn; - b) Ít nhất 30 ngày nếu làm việc theo hợp đồng lao động xác định thời hạn có thời hạn từ 12 tháng đến 36 tháng; - c) Ít nhất 03 ngày làm việc nếu làm việc theo hợp đồng lao động xác định thời hạn có thời hạn dưới 12 tháng; - d) Đối với một số ngành, nghề, công việc đặc thù thì thời hạn báo trước được thực hiện theo quy định của Chính phủ. - 2. Người lao động có quyền đơn phương chấm dứt hợp đồng lao động không cần báo trước trong trường hợp sau đây: - a) Không được bố trí theo đúng công việc, địa điểm làm việc hoặc không được bảo đảm điều kiện làm việc theo thỏa thuận, trừ trường hợp quy định tại Điều 29 của Bộ luật này; - b) Không được trả đủ lương hoặc trả lương không đúng thời hạn, trừ trường hợp quy định tại khoản 4 Điều 97 của Bộ luật này; - c) Bị người sử dụng lao động ngược đãi, đánh đập hoặc có lời nói, hành vi nhục mạ, hành vi làm ảnh hưởng đến sức khỏe, nhân phẩm, danh dự; bị cưỡng bức lao động; - d) Bị quấy rối tình dục tại nơi làm việc; - đ) Lao động nữ mang thai phải nghỉ việc theo quy định tại khoản 1 Điều 138 của Bộ luật này; - e) Đủ tuổi nghỉ hưu theo quy định tại Điều 169 của Bộ luật này, trừ trường hợp các bên có thỏa thuận khác; - g) Người sử dụng lao""]",reasoning,1.0,1.0,0.0495,0.8333,"[""Điều 34""]"
"Theo Điều 42, trong trường hợp nào nghĩa được áp dụng?",## Điều 34. Các trường hợp chấm dứt hợp đồng lao động,"Nghĩa vụ của người sử dụng lao động trong trường hợp thay đổi cơ cấu, công nghệ hoặc vì lý do kinh tế Những trường hợp sau đây được coi là thay đổi cơ cấu, công nghệ: - a) Thay đổi cơ cấu tổ chức, tổ chức lại lao động; - b) Thay đổi quy trình, công nghệ, máy móc, thiết bị sản xuất, kinh doanh gắn với ngành, nghề sản xuất, kinh doanh của người sử dụng lao động; - c) Thay đổi sản phẩm hoặc cơ cấu sản phẩm. - 2.","[""## Điều 34. Các trường hợp chấm dứt hợp đồng lao động"", ""## Điều 51. Xử lý hợp đồng lao động vô hiệu\n\n- 1. Khi hợp đồng lao động bị tuyên bố vô hiệu từng phần thì xử lý như sau: - a) Quyền, nghĩa vụ và lợi ích của hai bên được giải quyết theo thỏa ước lao động tập thể đang áp dụng; trường hợp không có thỏa ước lao động tập thể thì thực hiện theo quy định của pháp luật;\n\n- b) Hai bên tiến hành sửa đổi, bổ sung phần của hợp đồng lao động bị tuyên bố vô hiệu để phù hợp với thỏa ước lao động tập thể hoặc pháp luật về lao động. - 2. Khi hợp đồng lao động bị tuyên bố vô hiệu toàn bộ thì quyền, nghĩa vụ và lợi ích của người lao động được giải quyết theo quy định của pháp luật; trường hợp do ký sai thẩm quyền thì hai bên ký lại. - 3. Chính phủ quy định chi tiết Điều này."", ""#### Điều 30. Tạm hoãn thực hiện hợp đồng lao động\n\n- 1. Các trường hợp tạm hoãn thực hiện hợp đồng lao động bao gồm: - a) Người lao động thực hiện nghĩa vụ quân sự, nghĩa vụ tham gia Dân quân tự vệ; - b) Người lao động bị tạm giữ, tạm giam theo quy định của pháp luật về tố tụng hình sự; - c) Người lao động phải chấp hành quyết định áp dụng biện pháp đưa vào trường giáo dưỡng, cơ sở cai nghiện bắt buộc hoặc cơ sở giáo dục bắt buộc; - d) Lao động nữ mang thai theo quy định tại Điều 138 của Bộ luật này; - đ) Người lao động được bổ nhiệm làm người quản lý doanh nghiệp của công ty trách nhiệm hữu hạn một thành viên do Nhà nước nắm giữ 100% vốn điều lệ; - e) Người lao động được ủy quyền để thực hiện quyền, trách nhiệm của đại diện chủ sở hữu nhà nước đối với phần vốn nhà nước tại doanh nghiệp; - g) Người lao động được ủy quyền để thực hiện quyền, trách nhiệm của doanh nghiệp đối với phần vốn của doanh nghiệp đầu tư tại doanh nghiệp khác; - h) Trường hợp khác do hai bên thỏa thuận. - 2. Trong thời gian tạm hoãn thực hiện hợp đồng lao động, người lao động không được hưởng lương và quyền, lợi ích đã giao kết trong hợp đồng lao động, trừ trường hợp hai bên có thỏa thuận hoặc pháp luật có quy định khác."", ""## Điều 129. Bồi thường thiệt hại\n\n1. Người lao động làm hư hỏng dụng cụ, thiết bị hoặc có hành vi khác gây thiệt hại tài sản của người sử dụng lao động thì phải bồi thường theo quy định của pháp luật hoặc nội quy lao động của người sử dụng lao động.\n\nTrường hợp người lao động gây thiệt hại không nghiêm trọng do sơ suất với giá trị không quá 10 tháng lương tối thiểu vùng do Chính phủ công bố được áp dụng tại nơi người lao động làm việc thì người lao động phải bồi thường nhiều nhất là 03 tháng tiền lương và bị khấu trừ hằng tháng vào lương theo quy định tại khoản 3 Điều 102 của Bộ luật này.\n\n2. Người lao động làm mất dụng cụ, thiết bị, tài sản của người sử dụng lao động hoặc tài sản khác do người sử dụng lao động giao hoặc tiêu hao vật tư quá định mức cho phép thì phải bồi thường thiệt hại một phần hoặc toàn bộ theo thời giá thị trường hoặc nội quy lao động; trường hợp có hợp đồng trách nhiệm thì phải bồi thường theo hợp đồng trách nhiệm; trường hợp do thiên tai, hỏa hoạn, địch họa, dịch bệnh nguy hiểm, thảm họa, sự kiện xảy ra khách quan không thể lường trước được và không thể khắc phục được mặc dù đã áp dụng mọi biện pháp cần thiết và khả năng cho phép thì không phải bồi thường."", ""- 1. Người lao động có quyền đơn phương chấm dứt hợp đồng lao động nhưng phải báo trước cho người sử dụng lao động như sau: - a) Ít nhất 45 ngày nếu làm việc theo họp đồng lao động không xác định thời hạn; - b) Ít nhất 30 ngày nếu làm việc theo hợp đồng lao động xác định thời hạn có thời hạn từ 12 tháng đến 36 tháng; - c) Ít nhất 03 ngày làm việc nếu làm việc theo hợp đồng lao động xác định thời hạn có thời hạn dưới 12 tháng; - d) Đối với một số ngành, nghề, công việc đặc thù thì thời hạn báo trước được thực hiện theo quy định của Chính phủ. - 2. Người lao động có quyền đơn phương chấm dứt hợp đồng lao động không cần báo trước trong trường hợp sau đây: - a) Không được bố trí theo đúng công việc, địa điểm làm việc hoặc không được bảo đảm điều kiện làm việc theo thỏa thuận, trừ trường hợp quy định tại Điều 29 của Bộ luật này; - b) Không được trả đủ lương hoặc trả lương không đúng thời hạn, trừ trường hợp quy định tại khoản 4 Điều 97 của Bộ luật này; - c) Bị người sử dụng lao động ngược đãi, đánh đập hoặc có lời nói, hành vi nhục mạ, hành vi làm ảnh hưởng đến sức khỏe, nhân phẩm, danh dự; bị cưỡng bức lao động; - d) Bị quấy rối tình dục tại nơi làm việc; - đ) Lao động nữ mang thai phải nghỉ việc theo quy định tại khoản 1 Điều 138 của Bộ luật này; - e) Đủ tuổi nghỉ hưu theo quy định tại Điều 169 của Bộ luật này, trừ trường hợp các bên có thỏa thuận khác; - g) Người sử dụng lao""]",reasoning,1.0,0.4,0.0746,0.5769,"[""Điều 42""]"
"Theo Điều 113, quy định cụ thể về nghỉ là bao nhiêu hoặc như thế nào?",#### Điều 113. Nghỉ hằng năm,"Nghỉ hằng năm Người lao động làm việc đủ 12 tháng cho một người sử dụng lao động thì được nghi hằng năm, hưởng nguyên lương theo hợp đồng lao động như sau: - a) 12 ngày làm việc đối với người làm công việc trong điều kiện bình thường; - b) 14 ngày làm việc đối với người lao động chưa thành niên, lao động là người khuyết tật, người làm nghề, công việc nặng nhọc, độc hại, nguy hiểm; - c) 16 ngày làm việc đối với người làm nghề, công việc đặc biệt nặng nhọc, độc hại, nguy hiểm. - 2.","[""#### Điều 113. Nghỉ hằng năm"", ""#### Điều 200. Trình tự đình công\n\n- 1. Lấy ý kiến về đình công theo quy định tại Điều 201 của Bộ luật này. - 2. Ra quyết định đình công và thông báo đình công theo quy định tại Điều 202 của Bộ luật này. - 3. Tiến hành đình công."", ""## Điều 204. Trường hợp đình công bất hợp pháp\n\n- 1. Không thuộc trường hợp được đình công quy định tại Điều 199 của Bộ luật này. - 2. Không do tổ chức đại diện người lao động có quyền tổ chức và lãnh đạo đình công. - 3. Vi phạm các quy định về trình tự, thủ tục tiến hành đình công theo quy định của Bộ luật này. - 4. Khi tranh chấp lao động tập thể đang được cơ quan, tổ chức, cá nhân có thẩm quyền giải quyết theo quy định của Bộ luật này. - 5. Tiến hành đình công trường hợp không được đình công quy định tại Điều 209 của Bộ luật này. - 6. Khi đã có quyết định hoãn hoặc ngừng đình công của cơ quan có thẩm quyền theo quy định tại Điều 210 của Bộ luật này."", ""### Điều 65. Thương lượng tập thể\n\nThương lượng tập thể là việc đàm phán, thỏa thuận giữa một bên là một hoặc nhiều tổ chức đại diện người lao động với một bên là một hoặc nhiều người sử dụng lao động hoặc tổ chức đại diện người sử dụng lao động nhằm xác lập điều kiện lao động, quy định về mối quan hệ giữa các bên và xây dựng quan hệ lao động tiến bộ, hài hòa và ổn định."", ""## Điều 84. Mở rộng phạm vi áp dụng của thỏa ước lao động tập thể ngành hoặc thỏa ước lao động tập thể có nhiều doanh nghiệp\n\n- 1. Khi một thỏa ước lao động tập thể ngành hoặc thỏa ước lao động tập thể có nhiều doanh nghiệp có phạm vi áp dụng chiếm trên 75% người lao động hoặc trên 75% doanh nghiệp cùng ngành, nghề, lĩnh vực trong khu công nghiệp, khu kinh tế, khu chế xuất, khu công nghệ cao thì người sử dụng lao động hoặc tổ chức đại diện của người lao động tại đó đề nghị cơ quan nhà nước có thẩm quyền quyết định mở rộng phạm vi áp dụng một phần hoặc toàn bộ thỏa ước đó đối với các doanh nghiệp cùng ngành, nghề, lĩnh vực trong khu công nghiệp, khu kinh tế, khu chế xuất, khu công nghệ cao. - 2. Chính phủ quy định chi tiết khoản 1 Điều này; quy định trình tự, thủ tục và thẩm quyền quyết định mở rộng phạm vi áp dụng thỏa ước lao động tập thể quy định tại khoản 1 Điều này.""]",reasoning,1.0,0.75,0.0737,0.2258,"[""Điều 113""]"
"Theo Điều 112, trong trường hợp nào nghỉ được áp dụng?",## Điều 37. Trường hợp người sử dụng lao động không được thực hiện quyền đơn phương chấm dứt hợp đồng lao động - 1.,"Nghỉ lễ, tết Người lao động được nghi làm việc, hưởng nguyên lương trong những ngày lễ, tết sau đây: - a) Tết Dương lịch: 01 ngày (ngày 01 tháng 01 dương lịch); - b) Tết Âm lịch: 05 ngày; Ngày Chiến thắng: 01 ngày (ngày 30 tháng 4 dương lịch); - d) Ngày Quốc tế lao động: 01 ngày (ngày 01 tháng 5 dương lịch); - đ) Quốc khánh: 02 ngày (ngày 02 tháng 9 dương lịch và 01 ngày liền kề trước hoặc sau); - e) Ngày Giỗ Tổ Hùng Vương: 01 ngày (ngày 10 tháng 3 âm lịch). - 2.","[""## Điều 37. Trường hợp người sử dụng lao động không được thực hiện quyền đơn phương chấm dứt hợp đồng lao động\n\n- 1. Người lao động ốm đau hoặc bị tai nạn, bệnh nghề nghiệp đang điều trị, điều dưỡng theo chỉ định của cơ sở khám bệnh, chữa bệnh có thẩm quyền, trừ trường hợp quy định tại điểm b khoản 1 Điều 36 của Bộ luật này. - 2. Người lao động đang nghỉ hằng năm, nghỉ việc riêng và trường hợp nghỉ khác được người sử dụng lao động đồng ý. - 3. Người lao động nữ mang thai; người lao động đang nghỉ thai sản hoặc nuôi con dưới 12 tháng tuổi."", ""## Điều 34. Các trường hợp chấm dứt hợp đồng lao động"", ""Trường hợp hợp đồng lao động hết hạn trong thời gian lao động nữ mang thai hoặc nuôi con dưới 12 tháng tuổi thì được ưu tiên giao kết hợp đồng lao động mới.\n\n4. Lao động nữ trong thời gian hành kinh được nghỉ mỗi ngày 30 phút, trong thời gian nuôi con dưới 12 tháng tuổi được nghỉ mỗi ngày 60 phút trong thời gian làm việc. Thời gian nghỉ vẫn được hưởng đủ tiền lương theo hợp đồng lao động."", ""#### Điều 216. Quyền của thanh tra lao động\n\nThanh tra lao động có quyền thanh tra, điều tra nơi thuộc đối tượng, phạm vi thanh tra được giao theo quyết định thanh tra.\n\nKhi thanh tra đột xuất theo quyết định của người có thẩm quyền trong trường hợp khẩn cấp có nguy cơ đe dọa an toàn, tính mạng, sức khỏe, danh dự, nhân phẩm của người lao động tại nơi làm việc thì không cần báo trước."", ""- 1. Người lao động có quyền đơn phương chấm dứt hợp đồng lao động nhưng phải báo trước cho người sử dụng lao động như sau: - a) Ít nhất 45 ngày nếu làm việc theo họp đồng lao động không xác định thời hạn; - b) Ít nhất 30 ngày nếu làm việc theo hợp đồng lao động xác định thời hạn có thời hạn từ 12 tháng đến 36 tháng; - c) Ít nhất 03 ngày làm việc nếu làm việc theo hợp đồng lao động xác định thời hạn có thời hạn dưới 12 tháng; - d) Đối với một số ngành, nghề, công việc đặc thù thì thời hạn báo trước được thực hiện theo quy định của Chính phủ. - 2. Người lao động có quyền đơn phương chấm dứt hợp đồng lao động không cần báo trước trong trường hợp sau đây: - a) Không được bố trí theo đúng công việc, địa điểm làm việc hoặc không được bảo đảm điều kiện làm việc theo thỏa thuận, trừ trường hợp quy định tại Điều 29 của Bộ luật này; - b) Không được trả đủ lương hoặc trả lương không đúng thời hạn, trừ trường hợp quy định tại khoản 4 Điều 97 của Bộ luật này; - c) Bị người sử dụng lao động ngược đãi, đánh đập hoặc có lời nói, hành vi nhục mạ, hành vi làm ảnh hưởng đến sức khỏe, nhân phẩm, danh dự; bị cưỡng bức lao động; - d) Bị quấy rối tình dục tại nơi làm việc; - đ) Lao động nữ mang thai phải nghỉ việc theo quy định tại khoản 1 Điều 138 của Bộ luật này; - e) Đủ tuổi nghỉ hưu theo quy định tại Điều 169 của Bộ luật này, trừ trường hợp các bên có thỏa thuận khác; - g) Người sử dụng lao""]",reasoning,1.0,0.0,0.072,0.4091,"[""Điều 112""]"
Điều 1 (Phạm vi điều chỉnh) và Điều 2 (Đối tượng áp dụng) cùng làm rõ nội dung gì trong chương này?,"### ""Điều 54. Điều kiện hưởng lương hưu","Điều 1: Phạm vi điều chỉnh Bộ luật Lao động quy định tiêu chuẩn lao động; quyền, nghĩa vụ, trách nhiệm của người lao động, người sử dụng lao động, tổ chức đại diện người lao động tại cơ sở, tổ chức đại diện người sử dụng lao động trong quan hệ lao động và các quan hệ khác liên quan trực tiếp đến quan hệ lao động; quản lý nhà nước về lao động.; Điều 2: Đối tượng áp dụng Người lao động, người học nghề, người tập nghề và người làm việc không có quan hệ lao động.","[""### \""Điều 54. Điều kiện hưởng lương hưu"", ""vẫn tiếp tục làm việc thì phải ký kết hợp đồng lao động không xác định thời hạn, trừ hợp đồng lao động đối với người được thuê làm giám đốc trong doanh nghiệp có vốn nhà nước và trường hợp quy định tại khoản 1 Điều 149, khoản 2 Điều 151 và khoản 4 Điều 177 của Bộ luật này."", ""### Điều 107. Làm thêm giờ"", ""#### Điều 21. Nội dung hợp đồng lao động"", ""### Điều 64. Nội dung đối thoại tại nơi làm việc\n\n- 1. Nội dung đối thoại bắt buộc theo quy định tại điểm c khoản 2 Điều 63 của Bộ luật này. - 2. Ngoài nội dung quy định tại khoản 1 Điều này, các bên lựa chọn một hoặc một số nội dung sau đây để tiến hành đối thoại: - a) Tình hình sản xuất, kinh doanh của người sử dụng lao động; - b) Việc thực hiện hợp đồng lao động, thỏa ước lao động tập thể, nội quy lao động, quy chế và cam kết, thỏa thuận khác tại nơi làm việc; - c) Điều kiện làm việc; - d) Yêu cầu của người lao động, tổ chức đại diện người lao động đối với người sử dụng lao động; - đ) Yêu cầu của người sử dụng lao động đối với người lao động, tổ chức đại diện người lao động; - e) Nội dung khác mà một hoặc các bên quan tâm.""]",multi_context,1.0,0.0,0.1714,0.4444,"[""Điều 1"", ""Điều 2""]"
Điều 2 (Đối tượng áp dụng) và Điều 3 (Giải thích từ ngữ) cùng làm rõ nội dung gì trong chương này?,### Điều 64. Nội dung đối thoại tại nơi làm việc - 1.,"Điều 2: Đối tượng áp dụng Người lao động, người học nghề, người tập nghề và người làm việc không có quan hệ lao động.; Điều 3: Giải thích từ ngữ Trong Bộ luật này, các từ ngữ dưới đây được hiểu như sau: Người lao động là người làm việc cho người sử dụng lao động theo thỏa thuận, được trả lương và chịu sự quản lý, điều hành, giám sát của người sử dụng lao động.","[""### Điều 64. Nội dung đối thoại tại nơi làm việc\n\n- 1. Nội dung đối thoại bắt buộc theo quy định tại điểm c khoản 2 Điều 63 của Bộ luật này. - 2. Ngoài nội dung quy định tại khoản 1 Điều này, các bên lựa chọn một hoặc một số nội dung sau đây để tiến hành đối thoại: - a) Tình hình sản xuất, kinh doanh của người sử dụng lao động; - b) Việc thực hiện hợp đồng lao động, thỏa ước lao động tập thể, nội quy lao động, quy chế và cam kết, thỏa thuận khác tại nơi làm việc; - c) Điều kiện làm việc; - d) Yêu cầu của người lao động, tổ chức đại diện người lao động đối với người sử dụng lao động; - đ) Yêu cầu của người sử dụng lao động đối với người lao động, tổ chức đại diện người lao động; - e) Nội dung khác mà một hoặc các bên quan tâm."", ""#### Điều 63. Tổ chức đối thoại tại nơi làm việc\n\n1. Đối thoại tại nơi làm việc là việc chia sẻ thông tin, tham khảo, thảo luận, trao đổi ý kiến giữa người sử dụng lao động với người lao động hoặc tổ chức đại diện người lao động về những vấn đề liên quan đến quyền, lợi ích và mối quan tâm của các bên tại nơi làm việc nhằm tăng cường sự hiểu biết, hợp tác, cùng nỗ lực hướng tới giải pháp các bên cùng có lợi.\n\n- 2. Người sử dụng lao động phải tổ chức đối thoại tại nơi làm việc trong trường hợp sau đây: - a) Định kỳ ít nhất 01 năm một lần; - b) Khi có yêu cầu của một hoặc các bên; - c) Khi có vụ việc quy định tại điểm a khoản 1 Điều 36, các điều 42, 44, 93, 104, 118 và khoản 1 Điều 128 của Bộ luật này. - 3. Khuyến khích người sử dụng lao động và người lao động hoặc tổ chức đại diện người lao động tiến hành đối thoại ngoài những trường hợp quy định tại khoản 2 Điều này. - 4. Chính phủ quy định việc tổ chức đối thoại và thực hiện quy chế dân chủ ở cơ sở tại nơi làm việc."", ""thức giải quyết trong trường hợp thực hiện hợp đồng chịu ảnh hưởng của thiên tai, hỏa hoạn, thời tiết. - 4. Chính phủ quy định nội dung của hợp đồng lao động đối với người lao động được thuê làm giám đốc trong doanh nghiệp có vốn nhà nước. - 5. Bộ trưởng Bộ Lao động Thương binh và Xã hội quy định chi tiết các khoản 1, 2 và 3 Điều này."", ""## Điều 192. Trình tự, thủ tục giải quyết tranh chấp lao động tập thể về quyền\n\n1. Trình tự, thủ tục hòa giải tranh chấp lao động tập thể về quyền được thực hiện theo quy định tại các khoản 2, 3, 4, 5 và 6 Điều 188 của Bộ luật này.\n\nĐối với tranh chấp quy định tại điểm b và điểm c khoản 2 Điều 179 của Bộ luật này mà xác định có hành vi vi phạm pháp luật thì hòa giải viên lao động lập biên bản và chuyển hồ sơ, tài liệu đến cơ quan có thẩm quyền xem xét, xử lý theo quy định của pháp luật.\n\n2. Trong trường hợp hòa giải không thành hoặc hết thời hạn hòa giải quy định tại khoản 2 Điều 188 của Bộ luật này mà hòa giải viên lao động không tiến hành hòa giải thì các bên tranh chấp có quyền lựa chọn một trong các phương thức sau để giải quyết tranh chấp:\n\n- a) Yêu cầu Hội đồng trọng tài lao động giải quyết theo quy định tại Điều 193 của Bộ luật này; - b) Yêu cầu Tòa án giải quyết."", ""vẫn tiếp tục làm việc thì phải ký kết hợp đồng lao động không xác định thời hạn, trừ hợp đồng lao động đối với người được thuê làm giám đốc trong doanh nghiệp có vốn nhà nước và trường hợp quy định tại khoản 1 Điều 149, khoản 2 Điều 151 và khoản 4 Điều 177 của Bộ luật này.""]",multi_context,1.0,0.0,0.089,0.5417,"[""Điều 2"", ""Điều 3""]"
Điều 3 (Giải thích từ ngữ) và Điều 4 (Chính sách của Nhà nước về lao động) cùng làm rõ nội dung gì trong chương này?,#### Điều 135. Chính sách của Nhà nước - 1.,"Điều 3: Giải thích từ ngữ Trong Bộ luật này, các từ ngữ dưới đây được hiểu như sau: Người lao động là người làm việc cho người sử dụng lao động theo thỏa thuận, được trả lương và chịu sự quản lý, điều hành, giám sát của người sử dụng lao động.; Điều 4: Chính sách của Nhà nước về lao động Bảo đảm quyền và lợi ích hợp pháp, chính đáng của người lao động, người làm việc không có quan hệ lao động; khuyến khích những thỏa thuận bảo đảm cho người lao động có điều kiện thuận lợi hơn so với quy định của pháp luật về lao động.","[""#### Điều 135. Chính sách của Nhà nước\n\n- 1. Bảo đảm quyền bình đẳng của lao động nữ, lao động nam, thực hiện các biện pháp bảo đảm bình đẳng giới và phòng, chống quấy rối tình dục tại nơi làm việc. - 2. Khuyến khích người sử dụng lao động tạo điều kiện để lao động nữ, lao động nam có việc làm thường xuyên, áp dụng rộng rãi chế độ làm việc theo thời gian biểu linh hoạt, làm việc không trọn thời gian, giao việc làm tại nhà. - 3. Có biện pháp tạo việc làm, cải thiện điều kiện lao động, nâng cao trình độ nghề nghiệp, chăm sóc sức khỏe, tăng cường phúc lợi về vật chất và tinh thần của lao động nữ nhằm giúp lao động nữ phát huy có hiệu quả năng lực nghề nghiệp, kết hợp hài hòa cuộc sống lao động và cuộc sống gia đình. - 4. Có chính sách giảm thuế đối với người sử dụng lao động có sử dụng nhiều lao động nữ theo quy định của pháp luật về thuế. - 5. Nhà nước có kế hoạch, biện pháp tổ chức nhà trẻ, lớp mẫu giáo ở nơi có nhiều lao động. Mở rộng nhiều loại hình đào tạo thuận lợi cho lao động nữ có thêm nghề dự phòng và phù hợp với đặc điểm về cơ thể, sinh lý và chức năng làm mẹ của phụ nữ. - 6. Chính phủ quy định chi tiết Điều này."", ""thức giải quyết trong trường hợp thực hiện hợp đồng chịu ảnh hưởng của thiên tai, hỏa hoạn, thời tiết. - 4. Chính phủ quy định nội dung của hợp đồng lao động đối với người lao động được thuê làm giám đốc trong doanh nghiệp có vốn nhà nước. - 5. Bộ trưởng Bộ Lao động Thương binh và Xã hội quy định chi tiết các khoản 1, 2 và 3 Điều này."", ""### Điều 213. Thẩm quyền quản lý nhà nước về lao động\n\n- 1. Chính phủ thống nhất quản lý nhà nước về lao động trong phạm vi cả nước. - 2. Bộ Lao động Thương binh và Xã hội chịu trách nhiệm trước Chính phủ thực hiện quản lý nhà nước về lao động. - 3. Bộ, cơ quan ngang Bộ, trong phạm vi nhiệm vụ, quyền hạn của mình, có trách nhiệm thực hiện và phối hợp với Bộ Lao động Thương binh và Xã hội trong quản lý nhà nước về lao động. - 4. Ủy ban nhân dân các cấp thực hiện quản lý nhà nước về lao động trong phạm vi địa phương mình."", ""vẫn tiếp tục làm việc thì phải ký kết hợp đồng lao động không xác định thời hạn, trừ hợp đồng lao động đối với người được thuê làm giám đốc trong doanh nghiệp có vốn nhà nước và trường hợp quy định tại khoản 1 Điều 149, khoản 2 Điều 151 và khoản 4 Điều 177 của Bộ luật này."", ""#### Điều 21. Nội dung hợp đồng lao động""]",multi_context,1.0,0.8,0.1391,0.5833,"[""Điều 3"", ""Điều 4""]"
So sánh nội dung quy định của Điều 4 (Chính sách của Nhà nước về lao động) và Điều 5 (Quyền và nghĩa vụ của người lao động) về quyền và nghĩa vụ liên quan.,## Điều 6. Quyền và nghĩa vụ của người sử dụng lao động,"Điều 4: Chính sách của Nhà nước về lao động Bảo đảm quyền và lợi ích hợp pháp, chính đáng của người lao động, người làm việc không có quan hệ lao động; khuyến khích những thỏa thuận bảo đảm cho người lao động có điều kiện thuận lợi hơn so với quy định của pháp luật về lao động.; Điều 5: Quyền và nghĩa vụ của người lao động Người lao động có các quyền sau đây: - a) Làm việc; tự do lựa chọn việc làm, nơi làm việc, nghề nghiệp, học nghề, nâng cao trình độ nghề nghiệp; không bị phân biệt đối xử, cưỡng bức lao động, quấy rối tình dục tại nơi làm việc; - b) Hưởng lương phù hợp với trình độ, kỹ năng nghề trên cơ sở thỏa thuận với người sử dụng lao động; được bảo hộ lao động, làm việc trong điều kiện bảo đảm về an toàn, vệ sinh lao động; nghỉ theo chế độ, nghỉ hằng năm có hưởng lương và được hưởng phúc lợi tập thể; - c) Thành lập, gia nhập, hoạt động trong tổ chức đại diện người lao động, tổ chức nghề nghiệp và tổ chức khác theo quy định của pháp luật; yêu cầu và tham gia đối thoại, thực hiện quy chế dân chủ, thương lượng tập thể với người sử dụng lao động và được tham vấn tại nơi làm việc để bảo vệ quyền và lợi ích hợp pháp, chính đáng của mình; tham gia quản lý theo nội quy của người sử dụng lao động; - d) Từ chối làm việc nếu có nguy cơ rõ ràng đe dọa trực tiếp đến tính mạng, sức khỏe trong quá trình thực hiện công việc; - đ) Đơn phương chấm dứt hợp đồng lao động; - e) Đình công; - g) Các quyền khác theo quy định của pháp luật.","[""## Điều 6. Quyền và nghĩa vụ của người sử dụng lao động"", ""#### Điều 4. Chính sách của Nhà nước về lao động\n\n- 1. Bảo đảm quyền và lợi ích hợp pháp, chính đáng của người lao động, người làm việc không có quan hệ lao động; khuyến khích những thỏa thuận bảo đảm cho người lao động có điều kiện thuận lợi hơn so với quy định của pháp luật về lao động. - 2. Bảo đảm quyền và lợi ích hợp pháp của người sử dụng lao động, quản lý lao động đúng pháp luật, dân chủ, công bằng, văn minh và nâng cao trách nhiệm xã hội."", ""#### TỔ CHỨC ĐẠI DIỆN NGƯỜI LAO ĐỘNG TẠI CƠ SỞ\n\nĐiều 170. Quyền thành lập, gia nhập và tham gia hoạt động của tổ chức đại diện người lao động tại cơ sở\n\n- 1. Người lao động có quyền thành lập, gia nhập và hoạt động công đoàn theo quy định của Luật Công đoàn. - 2. Người lao động trong doanh nghiệp có quyền thành lập, gia nhập và tham gia hoạt động của tổ chức của người lao động tại doanh nghiệp theo quy định tại các điều 172, 173 và 174 của Bộ luật này. - 3. Các tổ chức đại diện người lao động quy định tại khoản 1 và khoản 2 Điều này bình đẳng về quyền và nghĩa vụ trong việc đại diện bảo vệ quyền và lợi ích hợp pháp, chính đáng của người lao động trong quan hệ lao động."", ""## Điều 178. Quyền và nghĩa vụ của tổ chức đại diện người lao động tại cơ sở trong quan hệ lao động\n\n- 1. Thương lượng tập thể với người sử dụng lao động theo quy định của Bộ luật này. - 2. Đối thoại tại nơi làm việc theo quy định của Bộ luật này. - 3. Được tham khảo ý kiến xây dựng và giám sát việc thực hiện thang lương, bảng lương, mức lao động, quy chế trả lương, quy chế thưởng, nội quy lao động và những vấn đề liên quan đến quyền, lợi ích của người lao động là thành viên của mình. - 4. Đại diện cho người lao động trong quá trình giải quyết khiếu nại, tranh chấp lao động cá nhân khi được người lao động ủy quyền.\n\n- 5. Tổ chức và lãnh đạo đình công theo quy định của Bộ luật này. - 6. Tiếp nhận hỗ trợ kỹ thuật của cơ quan, tổ chức đăng ký hoạt động hợp pháp tại Việt Nam nhằm tìm hiểu pháp luật về lao động; về trình tự, thủ tục thành lập tổ chức đại diện người lao động và việc tiến hành các hoạt động đại diện trong quan hệ lao động sau khi được cấp đăng ký. - 7. Được người sử dụng lao động bố trí nơi làm việc và được cung cấp thông tin, bảo đảm các điều kiện cần thiết cho hoạt động của tổ chức đại diện người lao động tại cơ sở. - 8. Các quyền và nghĩa vụ khác theo quy định của pháp luật."", ""## Điều 212. Nội dung quản lý nhà nước về lao động\n\n- 1. Ban hành và tổ chức thực hiện văn bản quy phạm pháp luật về lao động. - 2. Theo dõi, thống kê, cung cấp thông tin về cung cầu và biến động cung, cầu lao động; quyết định chính sách tiền lương đối với người lao động; quyết định chính sách, quy hoạch, kế hoạch về nguồn nhân lực, phân bố và sử dụng lao động toàn xã hội, giáo dục nghề nghiệp, phát triển kỹ năng nghề; xây dựng khung trình độ kỹ năng nghề quốc gia, khung trình độ quốc gia Việt Nam đối với các trình độ thuộc giáo dục nghề nghiệp. Quy định danh mục nghề chỉ được sử dụng lao động đã qua đào tạo giáo dục nghề nghiệp hoặc có chứng chỉ kỹ năng nghề quốc gia. - 3. Tổ chức và tiến hành nghiên cứu khoa học về lao động; thống kê, thông tin về lao động và thị trường lao động, về mức sống, tiền lương và thu nhập của người lao động; quản lý lao động về số lượng, chất lượng và biến động lao động. - 4. Xây dựng các cơ chế, thiết chế hỗ trợ phát triển quan hệ lao động tiến bộ, hài hòa và ổn định; thúc đẩy việc áp dụng quy định của Bộ luật này đối với người làm việc không có quan hệ lao động; thực hiện việc đăng ký và quản lý hoạt động của tổ chức của người lao động tại doanh nghiệp. - 5. Kiểm tra, thanh tra, xử lý vi phạm pháp luật và giải quyết khiếu nại, tố cáo về lao động; giải quyết tranh chấp lao động theo quy định của pháp luật. - 6. Hợp tác quốc tế về lao động.""]",multi_context,1.0,1.0,0.3855,0.6667,"[""Điều 4"", ""Điều 5""]"
So sánh nội dung quy định của Điều 5 (Quyền và nghĩa vụ của người lao động) và Điều 6 (Quyền và nghĩa vụ của người sử dụng lao động) về quyền và nghĩa vụ liên quan.,## Điều 6. Quyền và nghĩa vụ của người sử dụng lao động,"Điều 5: Quyền và nghĩa vụ của người lao động Người lao động có các quyền sau đây: - a) Làm việc; tự do lựa chọn việc làm, nơi làm việc, nghề nghiệp, học nghề, nâng cao trình độ nghề nghiệp; không bị phân biệt đối xử, cưỡng bức lao động, quấy rối tình dục tại nơi làm việc; - b) Hưởng lương phù hợp với trình độ, kỹ năng nghề trên cơ sở thỏa thuận với người sử dụng lao động; được bảo hộ lao động, làm việc trong điều kiện bảo đảm về an toàn, vệ sinh lao động; nghỉ theo chế độ, nghỉ hằng năm có hưởng lương và được hưởng phúc lợi tập thể; - c) Thành lập, gia nhập, hoạt động trong tổ chức đại diện người lao động, tổ chức nghề nghiệp và tổ chức khác theo quy định của pháp luật; yêu cầu và tham gia đối thoại, thực hiện quy chế dân chủ, thương lượng tập thể với người sử dụng lao động và được tham vấn tại nơi làm việc để bảo vệ quyền và lợi ích hợp pháp, chính đáng của mình; tham gia quản lý theo nội quy của người sử dụng lao động; - d) Từ chối làm việc nếu có nguy cơ rõ ràng đe dọa trực tiếp đến tính mạng, sức khỏe trong quá trình thực hiện công việc; - đ) Đơn phương chấm dứt hợp đồng lao động; - e) Đình công; - g) Các quyền khác theo quy định của pháp luật.; Điều 6: Quyền và nghĩa vụ của người sử dụng lao động VIỆC LÀM, TUYỂN DỤNG VÀ QUẢN LÝ LAO ĐỘNG Người sử dụng lao động có các quyền sau đây: - a) Tuyển dụng, bố trí, quản lý, điều hành, giám sát lao động; khen thưởng và xử lý vi phạm kỷ luật lao động; - b) Thành lập, gia nhập, hoạt động trong tổ chức đại diện người sử dụng lao động, tổ chức nghề nghiệp và tổ chức khác theo quy định của pháp luật; - c) Yêu cầu tổ chức đại diện người lao động thương lượng với mục đích ký kết thỏa ước lao động tập thể; tham gia giải quyết tranh chấp lao động, đình công; đối thoại, trao đổi với tổ chức đại diện người lao động về các vấn đề trong quan hệ lao động, cải thiện đời sống vật chất và tinh thần của người lao động; - d) Đóng cửa tạm thời nơi làm việc; - đ) Các quyền khác theo quy định của pháp luật.","[""## Điều 6. Quyền và nghĩa vụ của người sử dụng lao động"", ""#### TỔ CHỨC ĐẠI DIỆN NGƯỜI LAO ĐỘNG TẠI CƠ SỞ\n\nĐiều 170. Quyền thành lập, gia nhập và tham gia hoạt động của tổ chức đại diện người lao động tại cơ sở\n\n- 1. Người lao động có quyền thành lập, gia nhập và hoạt động công đoàn theo quy định của Luật Công đoàn. - 2. Người lao động trong doanh nghiệp có quyền thành lập, gia nhập và tham gia hoạt động của tổ chức của người lao động tại doanh nghiệp theo quy định tại các điều 172, 173 và 174 của Bộ luật này. - 3. Các tổ chức đại diện người lao động quy định tại khoản 1 và khoản 2 Điều này bình đẳng về quyền và nghĩa vụ trong việc đại diện bảo vệ quyền và lợi ích hợp pháp, chính đáng của người lao động trong quan hệ lao động."", ""## Điều 178. Quyền và nghĩa vụ của tổ chức đại diện người lao động tại cơ sở trong quan hệ lao động\n\n- 1. Thương lượng tập thể với người sử dụng lao động theo quy định của Bộ luật này. - 2. Đối thoại tại nơi làm việc theo quy định của Bộ luật này. - 3. Được tham khảo ý kiến xây dựng và giám sát việc thực hiện thang lương, bảng lương, mức lao động, quy chế trả lương, quy chế thưởng, nội quy lao động và những vấn đề liên quan đến quyền, lợi ích của người lao động là thành viên của mình. - 4. Đại diện cho người lao động trong quá trình giải quyết khiếu nại, tranh chấp lao động cá nhân khi được người lao động ủy quyền.\n\n- 5. Tổ chức và lãnh đạo đình công theo quy định của Bộ luật này. - 6. Tiếp nhận hỗ trợ kỹ thuật của cơ quan, tổ chức đăng ký hoạt động hợp pháp tại Việt Nam nhằm tìm hiểu pháp luật về lao động; về trình tự, thủ tục thành lập tổ chức đại diện người lao động và việc tiến hành các hoạt động đại diện trong quan hệ lao động sau khi được cấp đăng ký. - 7. Được người sử dụng lao động bố trí nơi làm việc và được cung cấp thông tin, bảo đảm các điều kiện cần thiết cho hoạt động của tổ chức đại diện người lao động tại cơ sở. - 8. Các quyền và nghĩa vụ khác theo quy định của pháp luật."", ""### Điều 7. Xây dựng quan hệ lao động\n\n- 1. Quan hệ lao động được xác lập qua đối thoại, thương lượng, thỏa thuận theo nguyên tắc tự nguyện, thiện chí, bình đẳng, hợp tác, tôn trọng quyền và lợi ích hợp pháp của nhau. - 2. Người sử dụng lao động, tổ chức đại diện người sử dụng lao động và người lao động, tổ chức đại diện người lao động xây dựng quan hệ lao động tiến bộ, hài hòa và ổn định với sự hỗ trợ của cơ quan nhà nước có thẩm quyền.\n\n- 3. Công đoàn tham gia cùng với cơ quan nhà nước có thẩm quyền hỗ trợ xây dựng quan hệ lao động tiến bộ, hài hòa và ổn định; giám sát việc thi hành quy định của pháp luật về lao động; bảo vệ quyền và lợi ích hợp pháp, chính đáng của người lao động. - 4. Phòng Thương mại và Công nghiệp Việt Nam, Liên minh Hợp tác xã Việt Nam và các tổ chức đại diện của người sử dụng lao động khác được thành lập theo quy định của pháp luật có vai trò đại diện, bảo vệ quyền và lợi ích hợp pháp của người sử dụng lao động, tham gia xây dựng quan hệ lao động tiến bộ, hài hòa và ổn đinh."", ""## Điều 174. Điều lệ tổ chức của người lao động tại doanh nghiệp\n\n- 1. Điều lệ tổ chức của người lao động tại doanh nghiệp phải có các nội dung chủ yếu sau đây: - a) Tên, địa chỉ tổ chức; biểu tượng (nếu có); - b) Tôn chỉ, mục đích và phạm vi hoạt động là bảo vệ quyền, lợi ích hợp pháp, chính đáng của thành viên tổ chức mình trong quan hệ lao động tại doanh nghiệp; cùng với người sử dụng lao động giải quyết các vấn đề liên quan đến quyền, nghĩa vụ và lợi ích của người lao động và người sử dụng lao động; xây dựng quan hệ lao động tiến bộ, hài hòa và ổn định; - c) Điều kiện, thủ tục gia nhập và ra khỏi tổ chức của người lao động tại doanh nghiệp.\n\nTrong một tổ chức của người lao động tại doanh nghiệp không đồng thời có thành viên là người lao động thông thường và thành viên là người lao động trực tiếp tham gia vào quá trình ra quyết định liên quan đến điều kiện lao động, tuyển dụng lao động, kỷ luật lao động, chấm dứt hợp đồng lao động hoặc chuyển người lao động làm công việc khác;\n\n- d) Cơ cấu tổ chức, nhiệm kỳ, người đại diện của tổ chức; - đ) Nguyên tắc tổ chức, hoạt động; - e) Thể thức thông qua quyết định của tổ chức.""]",multi_context,1.0,1.0,0.4497,0.5583,"[""Điều 5"", ""Điều 6""]"
So sánh nội dung quy định của Điều 6 (Quyền và nghĩa vụ của người sử dụng lao động) và Điều 7 (Xây dựng quan hệ lao động) về quyền và nghĩa vụ liên quan.,## Điều 6. Quyền và nghĩa vụ của người sử dụng lao động,"Điều 6: Quyền và nghĩa vụ của người sử dụng lao động VIỆC LÀM, TUYỂN DỤNG VÀ QUẢN LÝ LAO ĐỘNG Người sử dụng lao động có các quyền sau đây: - a) Tuyển dụng, bố trí, quản lý, điều hành, giám sát lao động; khen thưởng và xử lý vi phạm kỷ luật lao động; - b) Thành lập, gia nhập, hoạt động trong tổ chức đại diện người sử dụng lao động, tổ chức nghề nghiệp và tổ chức khác theo quy định của pháp luật; - c) Yêu cầu tổ chức đại diện người lao động thương lượng với mục đích ký kết thỏa ước lao động tập thể; tham gia giải quyết tranh chấp lao động, đình công; đối thoại, trao đổi với tổ chức đại diện người lao động về các vấn đề trong quan hệ lao động, cải thiện đời sống vật chất và tinh thần của người lao động; - d) Đóng cửa tạm thời nơi làm việc; - đ) Các quyền khác theo quy định của pháp luật.; Điều 7: Xây dựng quan hệ lao động Quan hệ lao động được xác lập qua đối thoại, thương lượng, thỏa thuận theo nguyên tắc tự nguyện, thiện chí, bình đẳng, hợp tác, tôn trọng quyền và lợi ích hợp pháp của nhau.","[""## Điều 6. Quyền và nghĩa vụ của người sử dụng lao động"", ""### Điều 7. Xây dựng quan hệ lao động\n\n- 1. Quan hệ lao động được xác lập qua đối thoại, thương lượng, thỏa thuận theo nguyên tắc tự nguyện, thiện chí, bình đẳng, hợp tác, tôn trọng quyền và lợi ích hợp pháp của nhau. - 2. Người sử dụng lao động, tổ chức đại diện người sử dụng lao động và người lao động, tổ chức đại diện người lao động xây dựng quan hệ lao động tiến bộ, hài hòa và ổn định với sự hỗ trợ của cơ quan nhà nước có thẩm quyền.\n\n- 3. Công đoàn tham gia cùng với cơ quan nhà nước có thẩm quyền hỗ trợ xây dựng quan hệ lao động tiến bộ, hài hòa và ổn định; giám sát việc thi hành quy định của pháp luật về lao động; bảo vệ quyền và lợi ích hợp pháp, chính đáng của người lao động. - 4. Phòng Thương mại và Công nghiệp Việt Nam, Liên minh Hợp tác xã Việt Nam và các tổ chức đại diện của người sử dụng lao động khác được thành lập theo quy định của pháp luật có vai trò đại diện, bảo vệ quyền và lợi ích hợp pháp của người sử dụng lao động, tham gia xây dựng quan hệ lao động tiến bộ, hài hòa và ổn đinh."", ""## Điều 178. Quyền và nghĩa vụ của tổ chức đại diện người lao động tại cơ sở trong quan hệ lao động\n\n- 1. Thương lượng tập thể với người sử dụng lao động theo quy định của Bộ luật này. - 2. Đối thoại tại nơi làm việc theo quy định của Bộ luật này. - 3. Được tham khảo ý kiến xây dựng và giám sát việc thực hiện thang lương, bảng lương, mức lao động, quy chế trả lương, quy chế thưởng, nội quy lao động và những vấn đề liên quan đến quyền, lợi ích của người lao động là thành viên của mình. - 4. Đại diện cho người lao động trong quá trình giải quyết khiếu nại, tranh chấp lao động cá nhân khi được người lao động ủy quyền.\n\n- 5. Tổ chức và lãnh đạo đình công theo quy định của Bộ luật này. - 6. Tiếp nhận hỗ trợ kỹ thuật của cơ quan, tổ chức đăng ký hoạt động hợp pháp tại Việt Nam nhằm tìm hiểu pháp luật về lao động; về trình tự, thủ tục thành lập tổ chức đại diện người lao động và việc tiến hành các hoạt động đại diện trong quan hệ lao động sau khi được cấp đăng ký. - 7. Được người sử dụng lao động bố trí nơi làm việc và được cung cấp thông tin, bảo đảm các điều kiện cần thiết cho hoạt động của tổ chức đại diện người lao động tại cơ sở. - 8. Các quyền và nghĩa vụ khác theo quy định của pháp luật."", ""#### Điều 1. Phạm vi điều chỉnh\n\nBộ luật Lao động quy định tiêu chuẩn lao động; quyền, nghĩa vụ, trách nhiệm của người lao động, người sử dụng lao động, tổ chức đại diện người lao động tại cơ sở, tổ chức đại diện người sử dụng lao động trong quan hệ lao động và các quan hệ khác liên quan trực tiếp đến quan hệ lao động; quản lý nhà nước về lao động."", ""#### TỔ CHỨC ĐẠI DIỆN NGƯỜI LAO ĐỘNG TẠI CƠ SỞ\n\nĐiều 170. Quyền thành lập, gia nhập và tham gia hoạt động của tổ chức đại diện người lao động tại cơ sở\n\n- 1. Người lao động có quyền thành lập, gia nhập và hoạt động công đoàn theo quy định của Luật Công đoàn. - 2. Người lao động trong doanh nghiệp có quyền thành lập, gia nhập và tham gia hoạt động của tổ chức của người lao động tại doanh nghiệp theo quy định tại các điều 172, 173 và 174 của Bộ luật này. - 3. Các tổ chức đại diện người lao động quy định tại khoản 1 và khoản 2 Điều này bình đẳng về quyền và nghĩa vụ trong việc đại diện bảo vệ quyền và lợi ích hợp pháp, chính đáng của người lao động trong quan hệ lao động.""]",multi_context,1.0,1.0,0.4419,0.7125,"[""Điều 6"", ""Điều 7""]"
Điều 7 (Xây dựng quan hệ lao động) và Điều 8 (Các hành vi bị nghiêm cấm trong lĩnh vực lao động) cùng làm rõ nội dung gì trong chương này?,"#### Điều 1. Phạm vi điều chỉnh Bộ luật Lao động quy định tiêu chuẩn lao động; quyền, nghĩa vụ, trách nhiệm của người lao động, người sử dụng lao động, tổ chức đại diện người lao động tại cơ sở, tổ chức đại diện người sử dụng lao động trong quan hệ lao động và các quan hệ khác liên quan trực tiếp đến quan hệ lao động; quản lý nhà nước về lao động.","Điều 7: Xây dựng quan hệ lao động Quan hệ lao động được xác lập qua đối thoại, thương lượng, thỏa thuận theo nguyên tắc tự nguyện, thiện chí, bình đẳng, hợp tác, tôn trọng quyền và lợi ích hợp pháp của nhau.; Điều 8: Các hành vi bị nghiêm cấm trong lĩnh vực lao động Phân biệt đối xử trong lao động.","[""#### Điều 1. Phạm vi điều chỉnh\n\nBộ luật Lao động quy định tiêu chuẩn lao động; quyền, nghĩa vụ, trách nhiệm của người lao động, người sử dụng lao động, tổ chức đại diện người lao động tại cơ sở, tổ chức đại diện người sử dụng lao động trong quan hệ lao động và các quan hệ khác liên quan trực tiếp đến quan hệ lao động; quản lý nhà nước về lao động."", ""#### Điều 21. Nội dung hợp đồng lao động"", ""### Điều 13. Hợp đồng lao động\n\n1. Hợp đồng lao động là sự thỏa thuận giữa người lao động và người sử dụng lao động về việc làm có trả công, tiền lương, điều kiện lao động, quyền và nghĩa vụ của mỗi bên trong quan hệ lao động.\n\nTrường hợp hai bên thỏa thuận bằng tên gọi khác nhưng có nội dung thể hiện về việc làm có trả công, tiền lương và sự quản lý, điều hành, giám sát của một bên thì được coi là hợp đồng lao động.\n\n2. Trước khi nhận người lao động vào làm việc thì người sử dụng lao động phải giao kết hợp đồng lao động với người lao động."", ""- 3. Tổ chức đại diện người lao động tại cơ sở là tổ chức được thành lập trên cơ sở tự nguyên của người lao động tại một đơn vị sử dụng lao động nhằm mục đích bảo vệ quyền và lợi ích hợp pháp, chính đáng của người lao động trong quan hệ lao động thông qua thương lượng tập thể hoặc các hình thức khác theo quy định của pháp luật về lao động. Tổ chức đại diện người lao động tại cơ sở bao gồm công đoàn cơ sở và tổ chức của người lao động tại doanh nghiệp. - 4. Tổ chức đại diện người sử dụng lao động là tổ chức được thành lập hợp pháp, đại diện và bảo vệ quyền, lợi ích hợp pháp của người sử dụng lao động trong quan hệ lao động. - 5. Quan hệ lao động là quan hệ xã hội phát sinh trong việc thuê mướn, sử dụng lao động, trả lương giữa người lao động, người sử dụng lao động, các tổ chức đại diện của các bên, cơ quan nhà nước có thẩm quyền. Quan hệ lao động bao gồm quan hệ lao động cá nhân và quan hệ lao động tập thể. - 6. Người làm việc không có quan hệ lao động là người làm việc không trên cơ sở thuê mướn bằng hợp đồng lao động. - 7. Cưỡng bức lao động là việc dùng vũ lực, đe dọa dùng vũ lực hoặc các thủ đoạn khác để ép buộc người lao động phải làm việc trái ý muốn của họ. - 8. Phân biệt đối xử trong lao động là hành vi phân biệt, loại trừ hoặc ưu tiên dựa trên chủng tộc, màu da, nguồn gốc quốc gia hoặc nguồn gốc xã hội, dân tộc, giới tính, độ tuổi, tình trạng thai sản, tình trạng hôn"", ""### Điều 7. Xây dựng quan hệ lao động\n\n- 1. Quan hệ lao động được xác lập qua đối thoại, thương lượng, thỏa thuận theo nguyên tắc tự nguyện, thiện chí, bình đẳng, hợp tác, tôn trọng quyền và lợi ích hợp pháp của nhau. - 2. Người sử dụng lao động, tổ chức đại diện người sử dụng lao động và người lao động, tổ chức đại diện người lao động xây dựng quan hệ lao động tiến bộ, hài hòa và ổn định với sự hỗ trợ của cơ quan nhà nước có thẩm quyền.\n\n- 3. Công đoàn tham gia cùng với cơ quan nhà nước có thẩm quyền hỗ trợ xây dựng quan hệ lao động tiến bộ, hài hòa và ổn định; giám sát việc thi hành quy định của pháp luật về lao động; bảo vệ quyền và lợi ích hợp pháp, chính đáng của người lao động. - 4. Phòng Thương mại và Công nghiệp Việt Nam, Liên minh Hợp tác xã Việt Nam và các tổ chức đại diện của người sử dụng lao động khác được thành lập theo quy định của pháp luật có vai trò đại diện, bảo vệ quyền và lợi ích hợp pháp của người sử dụng lao động, tham gia xây dựng quan hệ lao động tiến bộ, hài hòa và ổn đinh.""]",multi_context,1.0,0.0909,0.2013,0.8824,"[""Điều 7"", ""Điều 8""]"
"Điều 8 (Các hành vi bị nghiêm cấm trong lĩnh vực lao động) và Điều 9 (Việc làm, giải quyết việc làm) cùng làm rõ nội dung gì trong chương này?","#### Điều 9. Việc làm, giải quyết việc làm - 1.","Điều 8: Các hành vi bị nghiêm cấm trong lĩnh vực lao động Phân biệt đối xử trong lao động.; Điều 9: Việc làm, giải quyết việc làm Việc làm là hoạt động lao động tạo ra thu nhập mà pháp luật không cấm.","[""#### Điều 9. Việc làm, giải quyết việc làm\n\n- 1. Việc làm là hoạt động lao động tạo ra thu nhập mà pháp luật không cấm. - 2. Nhà nước, người sử dụng lao động và xã hội có trách nhiệm tham gia giải quyết việc làm, bảo đảm cho mọi người có khả năng lao động đều có cơ hội có việc làm."", ""#### Điều 10. Quyền làm việc của người lao động\n\n- 1. Được tự do lựa chọn việc làm, làm việc cho bất kỳ người sử dụng lao động nào và ở bất kỳ nơi nào mà pháp luật không cấm. - 2. Trực tiếp liên hệ với người sử dụng lao động hoặc thông qua tổ chức dịch vụ việc làm để tìm kiếm việc làm theo nguyện vọng, khả năng, trình độ nghiệp và sức khỏe của mình."", ""#### Điều 47. Trợ cấp mất việc làm\n\n- 1. Người sử dụng lao động trả trợ cấp mất việc làm cho người lao động đã làm việc thường xuyên cho mình từ đủ 12 tháng trở lên mà bị mất việc làm theo quy định tại khoản 11 Điều 34 của Bộ luật này, cứ mỗi năm làm việc trả 01 tháng tiền lương nhưng ít nhất bằng 02 tháng tiền lương. - 2. Thời gian làm việc để tính trợ cấp mất việc làm là tổng thời gian người lao động đã làm việc thực tế cho người sử dụng lao động trừ đi thời gian người lao động đã tham gia bảo hiểm thất nghiệp theo quy định của pháp luật về bảo hiểm thất nghiệp và thời gian làm việc đã được người sử dụng lao động chi trả trợ cấp thôi việc, trợ cấp mất việc làm. - 3. Tiền lương để tính trợ cấp mất việc làm là tiền lương bình quân của 06 tháng liền kề theo hợp đồng lao động trước khi người lao động mất việc làm. - 4. Chính phủ quy định chi tiết Điều này."", ""#### Điều 109. Nghỉ trong giờ làm việc\n\n1. Người lao động làm việc theo thời giờ làm việc quy định tại Điều 105 của Bộ luật này từ 06 giờ trở lên trong một ngày thì được nghỉ giữa giờ ít nhất 30 phút liên tục, làm việc ban đêm thì được nghỉ giữa giờ ít nhất 45 phút liên tục.\n\nTrường hợp người lao động làm việc theo ca liên tục từ 06 giờ trở lên thì thời gian nghỉ giữa giờ được tính vào giờ làm việc.\n\n2. Ngoài thời gian nghi quy định tại khoản 1 Điều này, người sử dụng lao động bố trí cho người lao động các đợt nghỉ giải lao và ghi vào nội quy lao động."", ""vẫn tiếp tục làm việc thì phải ký kết hợp đồng lao động không xác định thời hạn, trừ hợp đồng lao động đối với người được thuê làm giám đốc trong doanh nghiệp có vốn nhà nước và trường hợp quy định tại khoản 1 Điều 149, khoản 2 Điều 151 và khoản 4 Điều 177 của Bộ luật này.""]",multi_context,1.0,1.0,0.0885,0.625,"[""Điều 8"", ""Điều 9""]"
"So sánh nội dung quy định của Điều 9 (Việc làm, giải quyết việc làm) và Điều 10 (Quyền làm việc của người lao động) về quyền và nghĩa vụ liên quan.",#### Điều 10. Quyền làm việc của người lao động - 1.,"Điều 9: Việc làm, giải quyết việc làm Việc làm là hoạt động lao động tạo ra thu nhập mà pháp luật không cấm.; Điều 10: Quyền làm việc của người lao động Được tự do lựa chọn việc làm, làm việc cho bất kỳ người sử dụng lao động nào và ở bất kỳ nơi nào mà pháp luật không cấm.","[""#### Điều 10. Quyền làm việc của người lao động\n\n- 1. Được tự do lựa chọn việc làm, làm việc cho bất kỳ người sử dụng lao động nào và ở bất kỳ nơi nào mà pháp luật không cấm. - 2. Trực tiếp liên hệ với người sử dụng lao động hoặc thông qua tổ chức dịch vụ việc làm để tìm kiếm việc làm theo nguyện vọng, khả năng, trình độ nghiệp và sức khỏe của mình."", ""#### Điều 9. Việc làm, giải quyết việc làm\n\n- 1. Việc làm là hoạt động lao động tạo ra thu nhập mà pháp luật không cấm. - 2. Nhà nước, người sử dụng lao động và xã hội có trách nhiệm tham gia giải quyết việc làm, bảo đảm cho mọi người có khả năng lao động đều có cơ hội có việc làm."", ""#### Điều 47. Trợ cấp mất việc làm\n\n- 1. Người sử dụng lao động trả trợ cấp mất việc làm cho người lao động đã làm việc thường xuyên cho mình từ đủ 12 tháng trở lên mà bị mất việc làm theo quy định tại khoản 11 Điều 34 của Bộ luật này, cứ mỗi năm làm việc trả 01 tháng tiền lương nhưng ít nhất bằng 02 tháng tiền lương. - 2. Thời gian làm việc để tính trợ cấp mất việc làm là tổng thời gian người lao động đã làm việc thực tế cho người sử dụng lao động trừ đi thời gian người lao động đã tham gia bảo hiểm thất nghiệp theo quy định của pháp luật về bảo hiểm thất nghiệp và thời gian làm việc đã được người sử dụng lao động chi trả trợ cấp thôi việc, trợ cấp mất việc làm. - 3. Tiền lương để tính trợ cấp mất việc làm là tiền lương bình quân của 06 tháng liền kề theo hợp đồng lao động trước khi người lao động mất việc làm. - 4. Chính phủ quy định chi tiết Điều này."", ""#### Điều 63. Tổ chức đối thoại tại nơi làm việc\n\n1. Đối thoại tại nơi làm việc là việc chia sẻ thông tin, tham khảo, thảo luận, trao đổi ý kiến giữa người sử dụng lao động với người lao động hoặc tổ chức đại diện người lao động về những vấn đề liên quan đến quyền, lợi ích và mối quan tâm của các bên tại nơi làm việc nhằm tăng cường sự hiểu biết, hợp tác, cùng nỗ lực hướng tới giải pháp các bên cùng có lợi.\n\n- 2. Người sử dụng lao động phải tổ chức đối thoại tại nơi làm việc trong trường hợp sau đây: - a) Định kỳ ít nhất 01 năm một lần; - b) Khi có yêu cầu của một hoặc các bên; - c) Khi có vụ việc quy định tại điểm a khoản 1 Điều 36, các điều 42, 44, 93, 104, 118 và khoản 1 Điều 128 của Bộ luật này. - 3. Khuyến khích người sử dụng lao động và người lao động hoặc tổ chức đại diện người lao động tiến hành đối thoại ngoài những trường hợp quy định tại khoản 2 Điều này. - 4. Chính phủ quy định việc tổ chức đối thoại và thực hiện quy chế dân chủ ở cơ sở tại nơi làm việc."", ""#### Điều 5. Quyền và nghĩa vụ của người lao động\n\n- 1. Người lao động có các quyền sau đây: - a) Làm việc; tự do lựa chọn việc làm, nơi làm việc, nghề nghiệp, học nghề, nâng cao trình độ nghề nghiệp; không bị phân biệt đối xử, cưỡng bức lao động, quấy rối tình dục tại nơi làm việc; - b) Hưởng lương phù hợp với trình độ, kỹ năng nghề trên cơ sở thỏa thuận với người sử dụng lao động; được bảo hộ lao động, làm việc trong điều kiện bảo đảm về an toàn, vệ sinh lao động; nghỉ theo chế độ, nghỉ hằng năm có hưởng lương và được hưởng phúc lợi tập thể; - c) Thành lập, gia nhập, hoạt động trong tổ chức đại diện người lao động, tổ chức nghề nghiệp và tổ chức khác theo quy định của pháp luật; yêu cầu và tham gia đối thoại, thực hiện quy chế dân chủ, thương lượng tập thể với người sử dụng lao động và được tham vấn tại nơi làm việc để bảo vệ quyền và lợi ích hợp pháp, chính đáng của mình; tham gia quản lý theo nội quy của người sử dụng lao động; - d) Từ chối làm việc nếu có nguy cơ rõ ràng đe dọa trực tiếp đến tính mạng, sức khỏe trong quá trình thực hiện công việc; - đ) Đơn phương chấm dứt hợp đồng lao động; - e) Đình công; - g) Các quyền khác theo quy định của pháp luật. - 2. Người lao động có các nghĩa vụ sau đây: - a) Thực hiện hợp đồng lao động, thỏa ước lao động tập thể và thỏa thuận hợp pháp khác;""]",multi_context,1.0,1.0,0.0899,1.0,"[""Điều 9"", ""Điều 10""]"
So sánh nội dung quy định của Điều 10 (Quyền làm việc của người lao động) và Điều 11 (Tuyển dụng lao động) về quyền và nghĩa vụ liên quan.,## Điều 6. Quyền và nghĩa vụ của người sử dụng lao động,"Điều 10: Quyền làm việc của người lao động Được tự do lựa chọn việc làm, làm việc cho bất kỳ người sử dụng lao động nào và ở bất kỳ nơi nào mà pháp luật không cấm.; Điều 11: Tuyển dụng lao động Người sử dụng lao động có quyền trực tiếp hoặc thông qua tổ chức dịch vụ việc làm, doanh nghiệp hoạt động cho thuê lại lao động để tuyển dụng lao động theo nhu cầu của người sử dụng lao động.","[""## Điều 6. Quyền và nghĩa vụ của người sử dụng lao động"", ""## Điều 178. Quyền và nghĩa vụ của tổ chức đại diện người lao động tại cơ sở trong quan hệ lao động\n\n- 1. Thương lượng tập thể với người sử dụng lao động theo quy định của Bộ luật này. - 2. Đối thoại tại nơi làm việc theo quy định của Bộ luật này. - 3. Được tham khảo ý kiến xây dựng và giám sát việc thực hiện thang lương, bảng lương, mức lao động, quy chế trả lương, quy chế thưởng, nội quy lao động và những vấn đề liên quan đến quyền, lợi ích của người lao động là thành viên của mình. - 4. Đại diện cho người lao động trong quá trình giải quyết khiếu nại, tranh chấp lao động cá nhân khi được người lao động ủy quyền.\n\n- 5. Tổ chức và lãnh đạo đình công theo quy định của Bộ luật này. - 6. Tiếp nhận hỗ trợ kỹ thuật của cơ quan, tổ chức đăng ký hoạt động hợp pháp tại Việt Nam nhằm tìm hiểu pháp luật về lao động; về trình tự, thủ tục thành lập tổ chức đại diện người lao động và việc tiến hành các hoạt động đại diện trong quan hệ lao động sau khi được cấp đăng ký. - 7. Được người sử dụng lao động bố trí nơi làm việc và được cung cấp thông tin, bảo đảm các điều kiện cần thiết cho hoạt động của tổ chức đại diện người lao động tại cơ sở. - 8. Các quyền và nghĩa vụ khác theo quy định của pháp luật."", ""#### TỔ CHỨC ĐẠI DIỆN NGƯỜI LAO ĐỘNG TẠI CƠ SỞ\n\nĐiều 170. Quyền thành lập, gia nhập và tham gia hoạt động của tổ chức đại diện người lao động tại cơ sở\n\n- 1. Người lao động có quyền thành lập, gia nhập và hoạt động công đoàn theo quy định của Luật Công đoàn. - 2. Người lao động trong doanh nghiệp có quyền thành lập, gia nhập và tham gia hoạt động của tổ chức của người lao động tại doanh nghiệp theo quy định tại các điều 172, 173 và 174 của Bộ luật này. - 3. Các tổ chức đại diện người lao động quy định tại khoản 1 và khoản 2 Điều này bình đẳng về quyền và nghĩa vụ trong việc đại diện bảo vệ quyền và lợi ích hợp pháp, chính đáng của người lao động trong quan hệ lao động."", ""### Điều 64. Nội dung đối thoại tại nơi làm việc\n\n- 1. Nội dung đối thoại bắt buộc theo quy định tại điểm c khoản 2 Điều 63 của Bộ luật này. - 2. Ngoài nội dung quy định tại khoản 1 Điều này, các bên lựa chọn một hoặc một số nội dung sau đây để tiến hành đối thoại: - a) Tình hình sản xuất, kinh doanh của người sử dụng lao động; - b) Việc thực hiện hợp đồng lao động, thỏa ước lao động tập thể, nội quy lao động, quy chế và cam kết, thỏa thuận khác tại nơi làm việc; - c) Điều kiện làm việc; - d) Yêu cầu của người lao động, tổ chức đại diện người lao động đối với người sử dụng lao động; - đ) Yêu cầu của người sử dụng lao động đối với người lao động, tổ chức đại diện người lao động; - e) Nội dung khác mà một hoặc các bên quan tâm."", ""## Điều 174. Điều lệ tổ chức của người lao động tại doanh nghiệp\n\n- 1. Điều lệ tổ chức của người lao động tại doanh nghiệp phải có các nội dung chủ yếu sau đây: - a) Tên, địa chỉ tổ chức; biểu tượng (nếu có); - b) Tôn chỉ, mục đích và phạm vi hoạt động là bảo vệ quyền, lợi ích hợp pháp, chính đáng của thành viên tổ chức mình trong quan hệ lao động tại doanh nghiệp; cùng với người sử dụng lao động giải quyết các vấn đề liên quan đến quyền, nghĩa vụ và lợi ích của người lao động và người sử dụng lao động; xây dựng quan hệ lao động tiến bộ, hài hòa và ổn định; - c) Điều kiện, thủ tục gia nhập và ra khỏi tổ chức của người lao động tại doanh nghiệp.\n\nTrong một tổ chức của người lao động tại doanh nghiệp không đồng thời có thành viên là người lao động thông thường và thành viên là người lao động trực tiếp tham gia vào quá trình ra quyết định liên quan đến điều kiện lao động, tuyển dụng lao động, kỷ luật lao động, chấm dứt hợp đồng lao động hoặc chuyển người lao động làm công việc khác;\n\n- d) Cơ cấu tổ chức, nhiệm kỳ, người đại diện của tổ chức; - đ) Nguyên tắc tổ chức, hoạt động; - e) Thể thức thông qua quyết định của tổ chức.""]",multi_context,1.0,0.5,0.12,0.72,"[""Điều 10"", ""Điều 11""]"
Điều 11 (Tuyển dụng lao động) và Điều 12 (Trách nhiệm quản lý lao động của người sử dụng lao động) cùng làm rõ nội dung gì trong chương này?,#### Điều 11. Tuyển dụng lao động - 1.,"Điều 11: Tuyển dụng lao động Người sử dụng lao động có quyền trực tiếp hoặc thông qua tổ chức dịch vụ việc làm, doanh nghiệp hoạt động cho thuê lại lao động để tuyển dụng lao động theo nhu cầu của người sử dụng lao động.; Điều 12: Trách nhiệm quản lý lao động của người sử dụng lao động Lập, cập nhật, quản lý, sử dụng sổ quản lý lao động bằng bản giấy hoặc bản điện tử và xuất trình khi cơ quan nhà nước có thẩm quyền yêu cầu.","[""#### Điều 11. Tuyển dụng lao động\n\n- 1. Người sử dụng lao động có quyền trực tiếp hoặc thông qua tổ chức dịch vụ việc làm, doanh nghiệp hoạt động cho thuê lại lao động để tuyển dụng lao động theo nhu cầu của người sử dụng lao động. - 2. Người lao động không phải trả chi phí cho việc tuyển dụng lao động."", ""#### Điều 1. Phạm vi điều chỉnh\n\nBộ luật Lao động quy định tiêu chuẩn lao động; quyền, nghĩa vụ, trách nhiệm của người lao động, người sử dụng lao động, tổ chức đại diện người lao động tại cơ sở, tổ chức đại diện người sử dụng lao động trong quan hệ lao động và các quan hệ khác liên quan trực tiếp đến quan hệ lao động; quản lý nhà nước về lao động."", ""### Điều 13. Hợp đồng lao động\n\n1. Hợp đồng lao động là sự thỏa thuận giữa người lao động và người sử dụng lao động về việc làm có trả công, tiền lương, điều kiện lao động, quyền và nghĩa vụ của mỗi bên trong quan hệ lao động.\n\nTrường hợp hai bên thỏa thuận bằng tên gọi khác nhưng có nội dung thể hiện về việc làm có trả công, tiền lương và sự quản lý, điều hành, giám sát của một bên thì được coi là hợp đồng lao động.\n\n2. Trước khi nhận người lao động vào làm việc thì người sử dụng lao động phải giao kết hợp đồng lao động với người lao động."", ""#### Điều 118. Nội quy lao động\n\n- 1. Người sử dụng lao động phải ban hành nội quy lao động, nếu sử dụng từ 10 người lao động trở lên thì nội quy lao động phải bằng văn bản. - 2. Nội dung nội quy lao động không được trái với pháp luật về lao động và quy định của pháp luật có liên quan. Nội quy lao động bao gồm những nội dung chủ yếu sau đây: - a) Thời giờ làm việc, thời giờ nghi ngơi; - b) Trật tự tại nơi làm việc; - c) An toàn, vệ sinh lao động; - d) Phòng, chống quấy rối tình dục tại nơi làm việc; trình tự, thủ tục xử lý hành vi quấy rối tình dục tại nơi làm việc; - đ) Việc bảo vệ tài sản và bí mật kinh doanh, bí mật công nghệ, sở hữu trí tuệ của người sử dụng lao động; - e) Trường hợp được tạm thời chuyển người lao động làm việc khác so với hợp đồng lao động; - g) Các hành vi vi phạm kỷ luật lao động của người lao động và các hình thức xử lý kỷ luật lao động; - h) Trách nhiệm vật chất; - i) Người có thẩm quyền xử lý kỷ luật lao động. - 3. Trước khi ban hành nội quy lao động hoặc sửa đổi, bổ sung nội quy lao động, người sử dụng lao động phải tham khảo ý kiến của tổ chức đại diện người lao động tại cơ sở đối với nơi có tổ chức đại diện người lao động tại cơ sở. - 4. Nội quy lao động phải được thông báo đến người lao động và những nội dung chính phải được niêm yết ở những nơi cần thiết tại nơi làm việc. - 5. Chính phủ quy định chi tiết Điều này."", ""### Điều 64. Nội dung đối thoại tại nơi làm việc\n\n- 1. Nội dung đối thoại bắt buộc theo quy định tại điểm c khoản 2 Điều 63 của Bộ luật này. - 2. Ngoài nội dung quy định tại khoản 1 Điều này, các bên lựa chọn một hoặc một số nội dung sau đây để tiến hành đối thoại: - a) Tình hình sản xuất, kinh doanh của người sử dụng lao động; - b) Việc thực hiện hợp đồng lao động, thỏa ước lao động tập thể, nội quy lao động, quy chế và cam kết, thỏa thuận khác tại nơi làm việc; - c) Điều kiện làm việc; - d) Yêu cầu của người lao động, tổ chức đại diện người lao động đối với người sử dụng lao động; - đ) Yêu cầu của người sử dụng lao động đối với người lao động, tổ chức đại diện người lao động; - e) Nội dung khác mà một hoặc các bên quan tâm.""]",multi_context,1.0,1.0,0.1931,0.8485,"[""Điều 11"", ""Điều 12""]"
Điều 12 (Trách nhiệm quản lý lao động của người sử dụng lao động) và Điều 13 (Hợp đồng lao động) cùng làm rõ nội dung gì trong chương này?,### Điều 13. Hợp đồng lao động 1.,"Điều 12: Trách nhiệm quản lý lao động của người sử dụng lao động Lập, cập nhật, quản lý, sử dụng sổ quản lý lao động bằng bản giấy hoặc bản điện tử và xuất trình khi cơ quan nhà nước có thẩm quyền yêu cầu.; Điều 13: Hợp đồng lao động Hợp đồng lao động là sự thỏa thuận giữa người lao động và người sử dụng lao động về việc làm có trả công, tiền lương, điều kiện lao động, quyền và nghĩa vụ của mỗi bên trong quan hệ lao động.","[""### Điều 13. Hợp đồng lao động\n\n1. Hợp đồng lao động là sự thỏa thuận giữa người lao động và người sử dụng lao động về việc làm có trả công, tiền lương, điều kiện lao động, quyền và nghĩa vụ của mỗi bên trong quan hệ lao động.\n\nTrường hợp hai bên thỏa thuận bằng tên gọi khác nhưng có nội dung thể hiện về việc làm có trả công, tiền lương và sự quản lý, điều hành, giám sát của một bên thì được coi là hợp đồng lao động.\n\n2. Trước khi nhận người lao động vào làm việc thì người sử dụng lao động phải giao kết hợp đồng lao động với người lao động."", ""#### Điều 1. Phạm vi điều chỉnh\n\nBộ luật Lao động quy định tiêu chuẩn lao động; quyền, nghĩa vụ, trách nhiệm của người lao động, người sử dụng lao động, tổ chức đại diện người lao động tại cơ sở, tổ chức đại diện người sử dụng lao động trong quan hệ lao động và các quan hệ khác liên quan trực tiếp đến quan hệ lao động; quản lý nhà nước về lao động."", ""### Điều 64. Nội dung đối thoại tại nơi làm việc\n\n- 1. Nội dung đối thoại bắt buộc theo quy định tại điểm c khoản 2 Điều 63 của Bộ luật này. - 2. Ngoài nội dung quy định tại khoản 1 Điều này, các bên lựa chọn một hoặc một số nội dung sau đây để tiến hành đối thoại: - a) Tình hình sản xuất, kinh doanh của người sử dụng lao động; - b) Việc thực hiện hợp đồng lao động, thỏa ước lao động tập thể, nội quy lao động, quy chế và cam kết, thỏa thuận khác tại nơi làm việc; - c) Điều kiện làm việc; - d) Yêu cầu của người lao động, tổ chức đại diện người lao động đối với người sử dụng lao động; - đ) Yêu cầu của người sử dụng lao động đối với người lao động, tổ chức đại diện người lao động; - e) Nội dung khác mà một hoặc các bên quan tâm."", ""#### Điều 118. Nội quy lao động\n\n- 1. Người sử dụng lao động phải ban hành nội quy lao động, nếu sử dụng từ 10 người lao động trở lên thì nội quy lao động phải bằng văn bản. - 2. Nội dung nội quy lao động không được trái với pháp luật về lao động và quy định của pháp luật có liên quan. Nội quy lao động bao gồm những nội dung chủ yếu sau đây: - a) Thời giờ làm việc, thời giờ nghi ngơi; - b) Trật tự tại nơi làm việc; - c) An toàn, vệ sinh lao động; - d) Phòng, chống quấy rối tình dục tại nơi làm việc; trình tự, thủ tục xử lý hành vi quấy rối tình dục tại nơi làm việc; - đ) Việc bảo vệ tài sản và bí mật kinh doanh, bí mật công nghệ, sở hữu trí tuệ của người sử dụng lao động; - e) Trường hợp được tạm thời chuyển người lao động làm việc khác so với hợp đồng lao động; - g) Các hành vi vi phạm kỷ luật lao động của người lao động và các hình thức xử lý kỷ luật lao động; - h) Trách nhiệm vật chất; - i) Người có thẩm quyền xử lý kỷ luật lao động. - 3. Trước khi ban hành nội quy lao động hoặc sửa đổi, bổ sung nội quy lao động, người sử dụng lao động phải tham khảo ý kiến của tổ chức đại diện người lao động tại cơ sở đối với nơi có tổ chức đại diện người lao động tại cơ sở. - 4. Nội quy lao động phải được thông báo đến người lao động và những nội dung chính phải được niêm yết ở những nơi cần thiết tại nơi làm việc. - 5. Chính phủ quy định chi tiết Điều này."", ""## Điều 56. Quyền và nghĩa vụ của doanh nghiệp cho thuê lại lao động\n\nNgoài các quyền và nghĩa vụ quy định tại Điều 6 của Bộ luật này, doanh nghiệp cho thuê lại lao động có các quyền và nghĩa vụ sau đây:\n\n- 1. Bảo đảm đưa người lao động có trình độ phù hợp với những yêu cầu của bên thuê lại lao động và nội dung của hợp đồng lao động đã ký với người lao động; - 2. Thông báo cho người lao động biết nội dung của hợp đồng cho thuê lại lao động; - 3. Thông báo cho bên thuê lại lao động biết sơ yếu lý lịch của người lao động, yêu cầu của người lao động; - 4. Bảo đảm trả lương cho người lao động thuê lại không thấp hơn tiền lương của người lao động của bên thuê lại lao động có cùng trình độ, làm cùng công việc hoặc công việc có giá trị như nhau; - 5. Lập hồ sơ ghi rõ số lao động đã cho thuê lại, bên thuê lại lao động và định kỳ báo cáo cơ quan chuyên môn về lao động thuộc Ủy ban nhân dân cấp tỉnh; - 6. Xử lý kỷ luật lao động đối với người lao động vi phạm kỷ luật lao động khi bên thuê lại lao động trả lại người lao động do vi phạm kỷ luật lao động.""]",multi_context,1.0,1.0,0.1801,0.8788,"[""Điều 12"", ""Điều 13""]"
Điều 13 (Hợp đồng lao động) và Điều 14 (Hình thức hợp đồng lao động) cùng làm rõ nội dung gì trong chương này?,#### Điều 21. Nội dung hợp đồng lao động,"Điều 13: Hợp đồng lao động Hợp đồng lao động là sự thỏa thuận giữa người lao động và người sử dụng lao động về việc làm có trả công, tiền lương, điều kiện lao động, quyền và nghĩa vụ của mỗi bên trong quan hệ lao động.; Điều 14: Hình thức hợp đồng lao động Hợp đồng lao động phải được giao kết bằng văn bản và được làm thành 02 bản, người lao động giữ 01 bản, người sử dụng lao động giữ 01 bản, trừ trường hợp quy định tại khoản 2 Điều này.","[""#### Điều 21. Nội dung hợp đồng lao động"", ""### Điều 22. Phụ lục hợp đồng lao động\n\n1. Phụ lục hợp đồng lao động là bộ phận của hợp đồng lao động và có hiệu lực như hợp đồng lao động.\n\n2. Phụ lục hợp đồng lao động quy định chi tiết, sửa đổi, bổ sung một số điều, khoản của hợp đồng lao động nhưng không được sửa đổi thời hạn của hợp đồng lao động.\n\nTrường hợp phụ lục hợp đồng lao động quy định chi tiết một số điều, khoản của hợp đồng lao động mà dẫn đến cách hiểu khác với hợp đồng lao động thì thực hiện theo nội dung của hợp đồng lao động.\n\nTrường hợp phụ lục hợp đồng lao động sửa đổi, bổ sung một số điều, khoản của hợp đồng lao động thì phải ghi rõ nội dung điều, khoản sửa đổi, bổ sung và thời điểm có hiệu lực."", ""### Chương III HỢP ĐỒNG LAO ĐỘNG"", ""### Điều 13. Hợp đồng lao động\n\n1. Hợp đồng lao động là sự thỏa thuận giữa người lao động và người sử dụng lao động về việc làm có trả công, tiền lương, điều kiện lao động, quyền và nghĩa vụ của mỗi bên trong quan hệ lao động.\n\nTrường hợp hai bên thỏa thuận bằng tên gọi khác nhưng có nội dung thể hiện về việc làm có trả công, tiền lương và sự quản lý, điều hành, giám sát của một bên thì được coi là hợp đồng lao động.\n\n2. Trước khi nhận người lao động vào làm việc thì người sử dụng lao động phải giao kết hợp đồng lao động với người lao động."", ""### Điều 14. Hình thức hợp đồng lao động\n\n1. Hợp đồng lao động phải được giao kết bằng văn bản và được làm thành 02 bản, người lao động giữ 01 bản, người sử dụng lao động giữ 01 bản, trừ trường hợp quy định tại khoản 2 Điều này.\n\nHợp đồng lao động được giao kết thông qua phương tiện điện tử dưới hình thức thông điệp dữ liệu theo quy định của pháp luật về giao dịch điện tử có giá trị như hợp đồng lao động bằng văn bản.\n\n2. Hai bên có thể giao kết hợp đồng lao động bằng lời nói đối với hợp đồng có thời hạn dưới 01 tháng, trừ trường hợp quy định tại khoản 2 Điều 18, điểm a khoản 1 Điều 145 và khoản 1 Điều 162 của Bộ luật này.""]",multi_context,1.0,0.5,0.3412,1.0,"[""Điều 13"", ""Điều 14""]"
